"Id","ParentId","Type","CreatedById","CreatedDate","Body","Title","LinkUrl","RelatedRecordId","InsertedById","LastModifiedDate"
"0D5Qk00000VI9eSKAT","500Qk00000KvsZgIAJ","TextPost","0054u000008ARZjAAO","2025-01-22T15:32:22.000Z","Description: We're looking to create Collections for cloud-based apps and on-prem databases and wanted to know what is possible out-of-the-box and what is needed to do these type of scans.","","","","0054u000008ARZjAAO","2025-01-22T15:32:22.000Z"
"0D5Qk00000VIkpXKAT","500Qk00000KvsZgIAJ","TextPost","005Qk000002AJWTIA4","2025-01-22T16:38:20.000Z","Next Steps Updated: Awaiting response.","","","","005Qk000002AJWTIA4","2025-01-22T16:38:20.000Z"
"0D5Qk00000VIkpWKAT","500Qk00000KvsZgIAJ","TextPost","005Qk000002AJWTIA4","2025-01-22T16:38:20.000Z","What We've Learned Updated: Customer is asking for out of the box solutions and what their requirements are. Provided links to existing documentation.

https://helpcenter.netwrix.com/bundle/EnterpriseAuditor_11.6/page/Content/EnterpriseAuditor/Solutions/Overview.htm
https://helpcenter.netwrix.com/bundle/EnterpriseAuditor_11.6/page/Content/EnterpriseAuditor/Requirements/Overview.htm","","","","005Qk000002AJWTIA4","2025-01-22T16:38:20.000Z"
"0D5Qk00000VJ1LjKAL","500Qk00000KvsZgIAJ","TextPost","0054u000007MiY9AAK","2025-01-22T16:47:26.000Z","<p>Currently the support database types are:</p><ul><li>MS SQL</li><li>AzureSQL</li><li>MongoDB</li><li>RedShift</li><li>PostgresSQL</li><li>Oracle</li><li>Db2</li><li>MySQL</li></ul><p> </p><p>I <b>THINK </b>MongoDB, AzureSQL, Oracle, and Db2 are cloud options?</p>","","","","0054u000007MiY9AAK","2025-01-22T16:47:26.000Z"
