"Id","ParentId","Type","CreatedById","CreatedDate","Body","Title","LinkUrl","RelatedRecordId","InsertedById","LastModifiedDate"
"0D5Qk00000ZZWzhKAH","500Qk00000N12fJIAR","TextPost","0054u000008ARZjAAO","2025-03-17T15:21:59.000Z","Description: Trying to identify a report that illustrates the following:
- Information concerning Large files moved from a specific file share.
- Two folders specifically from the file share.
- The dates where the largest amount was moved and by whom.","","","","0054u000008ARZjAAO","2025-03-17T15:21:59.000Z"
"0D5Qk00000ZZzsqKAD","500Qk00000N12fJIAR","TextPost","0054u000006gpoAAAQ","2025-03-17T16:14:16.000Z","<p>I could see helping them Produce a report based on the SQL view creation of the SA_FSAC_ActivityEventsView.</p><p>Should be able to filter the data to the relevant activity.</p><p>Then they could query those results for dates and trustee information.</p>","","","","0054u000006gpoAAAQ","2025-03-17T16:14:16.000Z"
"0D5Qk00000ZgjLMKAZ","500Qk00000N12fJIAR","TextPost","00570000003KXurAAG","2025-03-19T14:14:15.000Z","<p>Can look at SQLViewCreation pointing to the <b>SA_FSAC_ActivityEventsView</b> as long as the host in question is being monitored by Netwrix Enterprise Auditor (<b>NEA</b>) &amp; Netwrix Activity Monitor (<b>NAM</b>)</p><p>Netwrix Enterprise Auditor v11.6 &gt; Administration &gt; Analysis Modules &gt; <b>SQLViewCreation Analysis Module</b></p><p><a href=""https://helpcenter.netwrix.com/bundle/EnterpriseAuditor_11.6/page/Content/EnterpriseAuditor/Admin/Analysis/SQLViewCreation/Overview.htm"" alt=""https://helpcenter.netwrix.com/bundle/EnterpriseAuditor_11.6/page/Content/EnterpriseAuditor/Admin/Analysis/SQLViewCreation/Overview.htm"" target=""_blank"">https://helpcenter.netwrix.com/bundle/EnterpriseAuditor_11.6/page/Content/EnterpriseAuditor/Admin/Analysis/SQLViewCreation/Overview.htm</a></p><p> </p><p>Within the Analysis we can filter for known details.</p><p>Netwrix Enterprise Auditor v11.6 &gt; Administration &gt; Analysis Modules &gt; SQLViewCreation Analysis Module &gt; SQLViewCreation: <b>Filter</b></p><p><a href=""https://helpcenter.netwrix.com/bundle/EnterpriseAuditor_11.6/page/Content/EnterpriseAuditor/Admin/Analysis/SQLViewCreation/Filter.htm"" alt=""https://helpcenter.netwrix.com/bundle/EnterpriseAuditor_11.6/page/Content/EnterpriseAuditor/Admin/Analysis/SQLViewCreation/Filter.htm"" target=""_blank"">https://helpcenter.netwrix.com/bundle/EnterpriseAuditor_11.6/page/Content/EnterpriseAuditor/Admin/Analysis/SQLViewCreation/Filter.htm</a></p>","","","","00570000003KXurAAG","2025-03-19T14:14:15.000Z"
"0D5Qk00000Zh5xyKAB","500Qk00000N12fJIAR","TextPost","00570000003KXurAAG","2025-03-19T14:16:24.000Z","Invitation updated. Attendees: No attendees listed","","","","00570000003KXurAAG","2025-03-19T14:16:24.000Z"
"0D5Qk00000Zh5y0KAB","500Qk00000N12fJIAR","TextPost","00570000003KXurAAG","2025-03-19T14:16:25.000Z","Invitation updated. Attendees: Dusty Grayson, Ryan Tyson","","","","00570000003KXurAAG","2025-03-19T14:16:25.000Z"
"0D5Qk00000Zh5xzKAB","500Qk00000N12fJIAR","TextPost","00570000003KXurAAG","2025-03-19T14:16:25.000Z","Invitation updated. Attendees: Dusty Grayson","","","","00570000003KXurAAG","2025-03-19T14:16:25.000Z"
"0D5Qk00000aI6jsKAC","500Qk00000N12fJIAR","TextPost","00570000003KXurAAG","2025-03-25T16:17:27.000Z","What We've Learned Updated: Name                                          Version    InstallDate
Netwrix Enterprise Auditor V11.6              11.6.0.117 20241115   
Netwrix Access Information Center             11.6.0.25  20241115   
Netwrix Sensitive Data Discovery Add-On V11.6 11.6.0.13  20241121
Netwrix Activity Monitor                      7.1.211    20241121   




We noted some related events for the path in question that was mistakenly moved into the Folder the was below its original path on the File Server.

Found an issue with the host Dropping packets so the Skip Hosts that do not respond to PING was disable for the FSAC scan and bulk import jobs.
Netwrix Enterprise Auditor v11.6 > Administration > Jobs Tree > Jobs > Job Properties > Performance Tab
https://helpcenter.netwrix.com/bundle/EnterpriseAuditor_11.6/page/Content/EnterpriseAuditor/Admin/Jobs/Job/Properties/Performance.htm","","","","00570000003KXurAAG","2025-03-25T16:17:27.000Z"
"0D5Qk00000aHheAKAS","500Qk00000N12fJIAR","TextPost","00570000003KXurAAG","2025-03-25T16:18:42.000Z","Next Steps Updated: Follow-up meeting to look within SSMS for the event(s) in question as well as tweak the File Activity report job we created today with better fiters.","","","","00570000003KXurAAG","2025-03-25T16:18:42.000Z"
