"Id","CaseNumber","Ticket_Record_Type_Name__c","Subject","Description","DevOps_Steps_to_Reproduce__c","What_We_Know__c","Next_Steps__c","Solution_Comment__c","Issue_Type__c","Ticket_Owner_Name__c","Ticket_Type__c","Platform__c","Collector_Code__c","Feature__c","Product_Version__c","Build_Number__c","Age__c","Status","Account_Name__c","Contact_Name__c","CreatedDate","ClosedDate"
"500Qk00000GTVX3IAP","00422502","Support Ticket","[MediaTek] Data at root level is invalid.Line 3,Postion 5","Hi Support,
Here is an error reported from Mediatek regarding NEA's  report can't be generated.
However,the error shown as ""Data at root level is <a href='https://invalid.Line' target='_blank'>invalid.Line</a> 3,Postion 5"",please assist in clarifying it asap.

Jimmy","","","","Customer was observing the error:  Data at root level is invalid.Line 3,Postion 5 when using the reports module for a job.

Solution: Republish reports for a job group","Product defect","Saqib Sharif","","Netwrix Enterprise Auditor","StealthAUDIT for Windows File Systems","Reports","11.5","11.5.276","1.9","Closed - Resolved","MediaTek Inc.","Support Sphinxtec","2024-10-01T03:42:06.000Z","2024-10-03T00:13:58.000Z"
