"Id","ParentId","Type","CreatedById","CreatedDate","Body","Title","LinkUrl","RelatedRecordId","InsertedById","LastModifiedDate"
"0D5Qk00000VCTRFKA5","500Qk00000KsSYUIA3","TextPost","0054u000008ARZjAAO","2025-01-21T09:45:42.000Z","Description: Hi Team,
Need Supervision while upgrading our EPP Production Server.
Please let us know available time slots for tomorrow.
Thanks
Manpreet Singh","","","","0054u000008ARZjAAO","2025-01-21T09:45:42.000Z"
"0D5Qk00000VDFNgKAP","500Qk00000KsSYUIA3","TextPost","005Qk000001nViDIAU","2025-01-21T15:20:29.000Z","Invitation updated. Attendees: No attendees listed","","","","005Qk000001nViDIAU","2025-01-21T15:20:29.000Z"
"0D5Qk00000VDFNhKAP","500Qk00000KsSYUIA3","TextPost","005Qk000001nViDIAU","2025-01-21T15:20:29.000Z","Invitation updated. Attendees: Adrian Draghici","","","","005Qk000001nViDIAU","2025-01-21T15:20:29.000Z"
"0D5Qk00000VDFNiKAP","500Qk00000KsSYUIA3","TextPost","005Qk000001nViDIAU","2025-01-21T15:20:29.000Z","Invitation updated. Attendees: Adrian Draghici, Manpreet Singh","","","","005Qk000001nViDIAU","2025-01-21T15:20:29.000Z"
