"Id","ParentId","Type","CreatedById","CreatedDate","Body","Title","LinkUrl","RelatedRecordId","InsertedById","LastModifiedDate"
"0D5Qk00000bJpOTKA0","500Qk00000NnAtqIAF","TextPost","0054u000008ARZjAAO","2025-04-07T19:57:38.000Z","Description: Actualmente contamos con el servicio de DLP en la empresa y esto debido a un crecimiento necesitamos instalar el EndPoint Protector en equipos que se encuentran en otra sucursal (segmentos de red diferentes), tengo entendido que para establecer esta comunicación el servidor necesita rutas estáticas para que la comunicación sea efectiva. Habrá manera de realizar esta configuración y también saber que requerimientos se necesitan de nuestro lado para realizar esta configuración.","","","","0054u000008ARZjAAO","2025-04-07T19:57:38.000Z"
"0D5Qk00000bajm7KAA","500Qk00000NnAtqIAF","TextPost","005Qk000001nViKIAU","2025-04-11T20:08:58.000Z","What We've Learned Updated: Provided info: You can either use a Public IP for the EPP server(or a dns) and have the EPP clients to connect to that IP/dns, or you can use an internal IP. If you go on the internal IP route, then all the computers within your network should have the possibility to reach that IP, or have the possibility to use VPN and connect to it.","","","","005Qk000001nViKIAU","2025-04-11T20:08:58.000Z"
"0D5Qk00000bac8LKAQ","500Qk00000NnAtqIAF","TextPost","005Qk000001nViKIAU","2025-04-11T20:09:13.000Z","Next Steps Updated: Waiting on customer to confirm we can close this ticket.","","","","005Qk000001nViKIAU","2025-04-11T20:09:13.000Z"
"0D5Qk00000csGocKAE","500Qk00000NnAtqIAF","TextPost","005Qk000001nViKIAU","2025-04-28T17:17:28.000Z","<p>Translation:</p><p> </p><p>Regarding the options, I&#39;ll share some of my observations with you.</p><p> </p><p>• Use a Public IP --- This option cannot be implemented as it poses a security risk to the company and the internal network.</p><p>• Use an Internal IP --- This option is already implemented in the company (computers on the same network segment have a connection).</p><p>• Use a VPN --- This option is already implemented as there is communication with other branches outside of Querétaro.</p><p> </p><p>The idea is for computers on a different network (communication with other centers is through the VPN) to have the appropriate connection to the DLP server.</p><p> </p><p>This configuration was previously in place, as they supported us at the time in this activity, but due to migration and backup issues, the configuration was lost.</p><p> </p><p>Issue:</p><p>We currently have DLP services at our company, and due to growth, we need to install EndPoint Protector on devices located in different branches (different network segments). I understand that to establish this communication, the server needs static routes for effective communication. Is there a way to configure this, and I also need to know what requirements are needed on our side to configure it?</p><p> </p><p> </p>","","","","005Qk000001nViKIAU","2025-04-28T17:17:28.000Z"
"0D5Qk00000csEbeKAE","500Qk00000NnAtqIAF","TextPost","005Qk000001nViKIAU","2025-04-28T17:18:33.000Z","Next Steps Updated: Asked Eduard if he thinks there is another solution for this.
---
Waiting on customer to confirm we can close this ticket.","","","","005Qk000001nViKIAU","2025-04-28T17:18:33.000Z"
"0D5Qk00000d286XKAQ","500Qk00000NnAtqIAF","TextPost","005Qk000001nViKIAU","2025-04-30T20:18:44.000Z","What We've Learned Updated: Proposed creating a route in their firewall. Alternative would be ssh access.

---
Provided info: You can either use a Public IP for the EPP server(or a dns) and have the EPP clients to connect to that IP/dns, or you can use an internal IP. If you go on the internal IP route, then all the computers within your network should have the possibility to reach that IP, or have the possibility to use VPN and connect to it.","","","","005Qk000001nViKIAU","2025-04-30T20:18:44.000Z"
