"Id","ParentId","Type","CreatedById","CreatedDate","Body","Title","LinkUrl","RelatedRecordId","InsertedById","LastModifiedDate"
"0D5Qk00000YSxp8KAD","500Qk00000Mdd3LIAR","TextPost","0054u000008ARZjAAO","2025-03-06T19:00:05.000Z","Description: We have several web based applications hosted internally domains http://mcbappsXXX with varying numbers from MCBAPPS101 to MCBAPPS204. Despite the wildcard being added to our DPI allowlist like http://mcbapps* uploads and file transfers to these applications are still being blocked by our CAP Policy. Please advice if there is a different syntax needed as these are necessary applications.","","","","0054u000008ARZjAAO","2025-03-06T19:00:05.000Z"
"0D5Qk00000YuukMKAR","500Qk00000Mdd3LIAR","TextPost","005Qk000001nViBIAU","2025-03-10T20:36:19.000Z","What We've Learned Updated: the allowlist is set correctly, the policy is correct, and it has the allowlist assigned.
they are using some internal tools accessed through the browser and it is still triggering for uploads
logs were enabled so I am hoping that the issue was caught and I can figure this one out.","","","","005Qk000001nViBIAU","2025-03-10T20:36:19.000Z"
"0D5Qk00000YtxvrKAB","500Qk00000Mdd3LIAR","TextPost","005Qk000001nViBIAU","2025-03-10T20:36:32.000Z","Next Steps Updated: waiting for the logs","","","","005Qk000001nViBIAU","2025-03-10T20:36:32.000Z"
