"Id","ParentId","Type","CreatedById","CreatedDate","Body","Title","LinkUrl","RelatedRecordId","InsertedById","LastModifiedDate"
"0D5Qk00000TehQwKAJ","500Qk00000JsatDIAR","TextPost","0054u000008ARZjAAO","2024-12-24T17:53:28.000Z","Description: Hello,
We have recently migrated our on-prem user home directories to OneDrive and I need to create permissions reports for our users. Unfortunately, I am not seeing all subdirectories. I currently see Social, Documents, Form Template and Style Library. How can I see all subdirectories in and their permissions if shared with other users?","","","","0054u000008ARZjAAO","2024-12-24T17:53:28.000Z"
"0D5Qk00000UN7uWKAT","500Qk00000JsatDIAR","TextPost","00570000003KXurAAG","2025-01-07T14:31:04.000Z","Next Steps Updated: Setting up meeting to look at the needed Access

Netwrix Enterprise Auditor v11.6 > Requirements > SharePoint Solution > SharePoint Scan Options > SharePoint Online Permissions
https://helpcenter.netwrix.com/bundle/EnterpriseAuditor_11.6/page/Content/EnterpriseAuditor/Requirements/Solutions/SharePoint/OnlinePermissions.htm","","","","00570000003KXurAAG","2025-01-07T14:31:04.000Z"
"0D5Qk00000UN5XaKAL","500Qk00000JsatDIAR","TextPost","00570000003KXurAAG","2025-01-07T14:32:38.000Z","What We've Learned Updated: The remote server returned an ERROR: (401) Unauthorized. 

Unable to connect to sharepoint farm… ACCESS DENIED","","","","00570000003KXurAAG","2025-01-07T14:32:38.000Z"
"0D5Qk00000UNE7eKAH","500Qk00000JsatDIAR","TextPost","00570000003KXurAAG","2025-01-07T14:34:21.000Z","Invitation updated. Attendees: Dusty Grayson","","","","00570000003KXurAAG","2025-01-07T14:34:21.000Z"
"0D5Qk00000UNE7dKAH","500Qk00000JsatDIAR","TextPost","00570000003KXurAAG","2025-01-07T14:34:21.000Z","Invitation updated. Attendees: No attendees listed","","","","00570000003KXurAAG","2025-01-07T14:34:21.000Z"
"0D5Qk00000UNE7fKAH","500Qk00000JsatDIAR","TextPost","00570000003KXurAAG","2025-01-07T14:34:21.000Z","Invitation updated. Attendees: Dusty Grayson, Charlie Davidson","","","","00570000003KXurAAG","2025-01-07T14:34:21.000Z"
"0D5Qk00000UYNfhKAH","500Qk00000JsatDIAR","TextPost","00570000003KXurAAG","2025-01-09T19:44:45.000Z","<p>SP_RegisterAzureAppAuth  Error</p><p> </p><p>Connect-MgGraph : InteractiveBrowserCredential authentication failed: Showing a modal dialog box or form when the application is not running in UserInteractive mode is not a valid operation. Specify the ServiceNotification or DefaultDesktopOnly style to display a notification from a service application.</p><p>At line:85 char:13</p>","","","","00570000003KXurAAG","2025-01-09T19:44:45.000Z"
"0D5Qk00000UoChjKAF","500Qk00000JsatDIAR","TextPost","00570000003KXurAAG","2025-01-14T15:29:22.000Z","Next Steps Updated: Awaiting for the next set of scans complete.","","","","00570000003KXurAAG","2025-01-14T15:29:22.000Z"
"0D5Qk00000UoB93KAF","500Qk00000JsatDIAR","TextPost","00570000003KXurAAG","2025-01-14T15:30:33.000Z","What We've Learned Updated: Jobs were overlapping causing host resource issues.","","","","00570000003KXurAAG","2025-01-14T15:30:33.000Z"
