"Id","CaseNumber","Ticket_Record_Type_Name__c","Subject","Description","DevOps_Steps_to_Reproduce__c","What_We_Know__c","Next_Steps__c","Solution_Comment__c","Issue_Type__c","Ticket_Owner_Name__c","Ticket_Type__c","Platform__c","Collector_Code__c","Feature__c","Product_Version__c","Build_Number__c","Age__c","Status","Account_Name__c","Contact_Name__c","CreatedDate","ClosedDate"
"500Qk00000KXDHYIA5","00431822","Support Ticket","Install DLP agent on Ubuntu for 23.4 AND Ubuntu 24","Hi Team,

I've to install DLP endpoint protector on Ubuntu versions 23 & 24, Could you provide scripts for the same?

Also One more concern, We've recently renamed our host-names in our organization and and they already have DLP agent, and we have to make the policies department wise again, but when I'm searching by new host-names, I am not getting while creating custom policy.

Could you please help me for the same.

Thanks","","","","Ticket will be closed as per confirmation from the customer","","Alin Anca","Question","Netwrix Endpoint Protector","Client","Client Deployment","","","58.1","Closed - Resolved","Renewbuy","Anil Kumar","2025-01-13T10:39:00.000Z","2025-03-12T13:26:37.000Z"
