"Id","CaseNumber","Ticket_Record_Type_Name__c","Subject","Description","DevOps_Steps_to_Reproduce__c","What_We_Know__c","Next_Steps__c","Solution_Comment__c","Issue_Type__c","Ticket_Owner_Name__c","Ticket_Type__c","Platform__c","Collector_Code__c","Feature__c","Product_Version__c","Build_Number__c","Age__c","Status","Account_Name__c","Contact_Name__c","CreatedDate","ClosedDate"
"500Qk00000K2NLDIA3","00430898","Support Ticket","[SIDI] FATAL ERROR","Hi,
Sidi server is not working. They had this message: FATAL ERROR. Class 'sfLoader not found'.

Can you please check to fix?

Find the message attached.","","the customer gave me SSH access
all services are running
space is good
cleared php cache which fixed the issue","","clearing the php cache fixed the issue","","Botond Biro","Error","Netwrix Endpoint Protector","Server","Server Access Error","","","0.2","Closed - Resolved","FcBrasil","Augusto Ferreira","2024-12-30T15:31:40.000Z","2024-12-30T19:35:31.000Z"
