"Id","CaseNumber","Ticket_Record_Type_Name__c","Subject","Description","DevOps_Steps_to_Reproduce__c","What_We_Know__c","Next_Steps__c","Solution_Comment__c","Issue_Type__c","Ticket_Owner_Name__c","Ticket_Type__c","Platform__c","Collector_Code__c","Feature__c","Product_Version__c","Build_Number__c","Age__c","Status","Account_Name__c","Contact_Name__c","CreatedDate","ClosedDate"
"500Qk00000M9JgJIAV","00436576","Support Ticket","EPP Console Not Working","Hello Team,

We are unable to access the Netwrix EPP server from today 11 AM IST.
Could you please look into this as this is our production server.

Please find the link to the EPP server : 
<a href='https://1fxchun.hosted.endpointprotector.com/index.php/' target='_blank'>https://1fxchun.hosted.endpointprotector.com/index.php/</a>

Additionally, Please find the customer's details 
Customer  : CD Cloud Enablers (Corestack)

If additional details is required, please let me know.

Best Regards.","","- Could not conenct to the backend
- performed a restart of the server, the UI came back
- Leroy Luff increased the resources of the server as he said that these are too little to accomodate 400 users","- as they are hosted on our side, I need to connect to the server backend
- wait for their reply that the UI is accessible again","performed a restart of the server, the UI came back","Root Cause Unknown","Alin Anca","Error","Netwrix Endpoint Protector","Server","Server Access Error","","","3.1","Closed - Resolved","CoreStack","Nayan Rajore","2025-02-21T10:46:38.000Z","2025-02-24T13:44:23.000Z"
