"Id","CaseNumber","Ticket_Record_Type_Name__c","Subject","Description","DevOps_Steps_to_Reproduce__c","What_We_Know__c","Next_Steps__c","Solution_Comment__c","Issue_Type__c","Ticket_Owner_Name__c","Ticket_Type__c","Platform__c","Collector_Code__c","Feature__c","Product_Version__c","Build_Number__c","Age__c","Status","Account_Name__c","Contact_Name__c","CreatedDate","ClosedDate"
"500Qk00000GTRJpIAP","00422504","Support Ticket","Server Access Error || Satcom Infotech || || Internal Server ||","Dear Team,

We are unable to access our EPP server console and getting the below error while accessing the EPP console access.

Oops! An Error Occurred
The server returned a ""500 Internal Server Error"".


Something is broken

Please e-mail us at <a href='https://support@endpointprotector.com' target='_blank'>support@endpointprotector.com</a> and let us know what you were doing when this
error occurred. We will fix it as soon as possible. Sorry for any
inconvenience caused.

Regards,
Prasanth","","","","Mysql service was running and did not start even with recovery.
Removed iblogfile and the service started. After server restart the service was still running.","","Andrei Pop","","Netwrix Endpoint Protector","Server","Server Access Error","NONE","","0.0","Closed - Resolved","Satcom Infotech","Prasanth Ganesan","2024-10-01T05:17:56.000Z","2024-10-01T06:00:42.000Z"
