"Id","ParentId","Type","CreatedById","CreatedDate","Body","Title","LinkUrl","RelatedRecordId","InsertedById","LastModifiedDate"
"0D5Qk00000arXxYKAU","500Qk00000Nb86FIAR","TextPost","0054u000008ARZjAAO","2025-04-02T09:43:25.000Z","Description: Hi 
I am unable to access the server Admin Console since I change the DNS settings in Server Management section. I keep getting ""Connection Refused"" error when ever I try to access the server through the browser. Please can you help ASAP.","","","","0054u000008ARZjAAO","2025-04-02T09:43:25.000Z"
"0D5Qk00000arvkzKAA","500Qk00000Nb86FIAR","TextPost","005Qk000001nViEIAU","2025-04-02T11:10:54.000Z","What We've Learned Updated: netplan was rewritten","","","","005Qk000001nViEIAU","2025-04-02T11:10:54.000Z"
"0D5Qk00000aw3LmKAI","500Qk00000Nb86FIAR","TextPost","005Qk000001nViEIAU","2025-04-03T05:15:28.000Z","Next Steps Updated: Created ADO fro dev to check if there is an issue.","","","","005Qk000001nViEIAU","2025-04-03T05:15:28.000Z"
"0D5Qk00000c0WzhKAE","500Qk00000Nb86FIAR","TextPost","005Qk000001nViEIAU","2025-04-17T10:42:22.000Z","Next Steps Updated: 2025.04.07: Created ADO for dev to check if there is an issue.","","","","005Qk000001nViEIAU","2025-04-17T10:42:22.000Z"
