"Id","CaseNumber","Ticket_Record_Type_Name__c","Subject","Description","DevOps_Steps_to_Reproduce__c","What_We_Know__c","Next_Steps__c","Solution_Comment__c","Issue_Type__c","Ticket_Owner_Name__c","Ticket_Type__c","Platform__c","Collector_Code__c","Feature__c","Product_Version__c","Build_Number__c","Age__c","Status","Account_Name__c","Contact_Name__c","CreatedDate","ClosedDate"
"500Qk00000CQ33NIAT","00413396","Support Ticket","Access to EPP","Hi,

I applied the hotfix this morning to the server, but since i have applied the hotfix, the server is unavailable.

Has the web link changed for the EPP instance?

Regards
Phil","","","","Import an old database to a new server.
Root access provided to customer, no further action required. Case closed.","","Andre Le Roux","","Netwrix Endpoint Protector","Server","Server Access Error","NONE","","47.0","Closed - Resolved","Logiq Consulting","Phil Parkes","2024-06-28T09:08:12.000Z","2024-08-14T07:58:44.000Z"
