"Id","CaseNumber","Ticket_Record_Type_Name__c","Subject","Description","DevOps_Steps_to_Reproduce__c","What_We_Know__c","Next_Steps__c","Solution_Comment__c","Issue_Type__c","Ticket_Owner_Name__c","Ticket_Type__c","Platform__c","Collector_Code__c","Feature__c","Product_Version__c","Build_Number__c","Age__c","Status","Account_Name__c","Contact_Name__c","CreatedDate","ClosedDate"
"500Qk00000KLjbKIAT","00431409","Support Ticket","SSO configuration failed","We have configured the SSO settings in Endpoint Protector Dashboard, however when clicked on ""Test"", I got logged out of the portal and got an error ""SSO is not configured properly"". Now I am not able to login to the dashboard to revert the config or obtain the Failover URL. Please help with below : 

Login to Dashboard, by reverting the settings or obtaining the Failover URL.
Configure SSO with Azure correctly.","","Customer configured the SSO settings in Endpoint Protector Dashboard and when they clicked on ""Test"", they got logged out of the portal and got an error ""SSO is not configured properly"". They were not able to login to the dashboard to revert the config or obtain the Failover URL.","We had a remote session in which we removed the SSO configuration via the backend. Customer was able to log into the EPP Server and set up the SSO configuration again, this time also noting down the failover URL.

This case was resolved in remote session.  Case can be closed.","We had a remote session in which we removed the SSO configuration via the backend. Customer was able to log into the EPP Server and set up the SSO configuration again, this time also noting down the failover URL.

This case was resolved in remote session.  Case can be closed.","","Andre Le Roux","Error","Netwrix Endpoint Protector","Server","Server Access Error","NONE","","61.3","Closed - Resolved","Deutsche Telekom Digital Labs India PVT LTD","Ankit Kumar","2025-01-08T06:52:01.000Z","2025-03-10T13:58:23.000Z"
