"Id","CaseNumber","Ticket_Record_Type_Name__c","Subject","Description","DevOps_Steps_to_Reproduce__c","What_We_Know__c","Next_Steps__c","Solution_Comment__c","Issue_Type__c","Ticket_Owner_Name__c","Ticket_Type__c","Platform__c","Collector_Code__c","Feature__c","Product_Version__c","Build_Number__c","Age__c","Status","Account_Name__c","Contact_Name__c","CreatedDate","ClosedDate"
"500Qk00000CcD2DIAV","00413902","Support Ticket","Reports ausgefallen","Sehr geehrter Damen und Herren,
Nach dem Einspielen des Hotfix werden wieder keine Reports versendet. Ein Neustart des Servers wurde ebenfalls durchgeführt.

Mit der Bitte um schnelle Behebung.

Mit freundlichen Grüßen
Alan Wenglord","","","","Deployed: Hotfix adv-2024-002","","Alin Anca","","Netwrix Endpoint Protector","Alerts","Alerts - Other","","","4.8","Closed - Resolved","Stadtwerke Wolfenbüttel GmbH","Alan Wenglord","2024-07-03T10:13:57.000Z","2024-07-08T05:53:07.000Z"
