"Id","CaseNumber","Ticket_Record_Type_Name__c","Subject","Description","DevOps_Steps_to_Reproduce__c","What_We_Know__c","Next_Steps__c","Solution_Comment__c","Issue_Type__c","Ticket_Owner_Name__c","Ticket_Type__c","Platform__c","Collector_Code__c","Feature__c","Product_Version__c","Build_Number__c","Age__c","Status","Account_Name__c","Contact_Name__c","CreatedDate","ClosedDate"
"500Qk00000O4EEhIAN","00442074","Support Ticket","Disk High Utilization Error","Dear Team,

The Endpoint Protector UI console is currently displaying a ""Disk High Utilization"" alert. Although we have already deleted the old audit logs, the alert still persists.

Kindly schedule a call immediately and assist in resolving this issue today.

Best regards,
Dinakaran","","15-04 Customer encounter an issue with  ""Disk High Utilization"" alert. 

Although they have already deleted the old audit logs, the alert still persists.","15-04 We have scheduled a remote session where we have clear their disk usage. 
In the meeting we have successfully removed the shadows older than 30 days and a few older backups .
They will check internally if they would like to increase the disk space.
16-04 Customer returned and they would like to increase the disk space, so we have scheduled a remote session today.
In the meeting we have successfully increase the disk space .","disk usage was cleared and we have also increase the disk space.","","Daniel Anton","Error","Netwrix Endpoint Protector","Server","Server Disk Space","","","1.1","Closed - Resolved","LayaTech","Rajesh Krish","2025-04-15T09:35:46.000Z","2025-04-16T10:50:14.000Z"
