"Id","CaseNumber","Ticket_Record_Type_Name__c","Subject","Description","DevOps_Steps_to_Reproduce__c","What_We_Know__c","Next_Steps__c","Solution_Comment__c","Issue_Type__c","Ticket_Owner_Name__c","Ticket_Type__c","Platform__c","Collector_Code__c","Feature__c","Product_Version__c","Build_Number__c","Age__c","Status","Account_Name__c","Contact_Name__c","CreatedDate","ClosedDate"
"500Qk00000MmtwpIAB","00438347","Support Ticket","Unable to access the server.","Hello Team,

Our customer Genius Consultants Ltd are unable to access their server as the server space is full, please help the customer to free up the space.

<a href='https://b8sond5.hosted.endpointprotector.com' target='_blank'>https://b8sond5.hosted.endpointprotector.com</a>

Thanks,
Pravin.","","","","space cleared on the server","","Botond Biro","Error","Netwrix Endpoint Protector","Server","Server Disk Space","","","1.2","Closed - Resolved","Genius consultants limited","Pravin Bhatuse","2025-03-11T07:16:08.000Z","2025-03-12T13:15:29.000Z"
