"Id","ParentId","Type","CreatedById","CreatedDate","Body","Title","LinkUrl","RelatedRecordId","InsertedById","LastModifiedDate"
"0D5Qk00000W3qqvKAB","500Qk00000LQxDFIA1","TextPost","0054u000008ARZjAAO","2025-02-04T04:54:08.000Z","Description: Hi, Support team 

I am Jay Kwon, Instead of jack, i will follow up the issues related korean customer issued. Pls take care.

I would like to get 5.9.4.1 offline patch, if you have already made.
If not, pls let me know estimate schedule, it will really appreciated it 

Best
Jay","","","","0054u000008ARZjAAO","2025-02-04T04:54:08.000Z"
