"Id","CaseNumber","Ticket_Record_Type_Name__c","Subject","Description","DevOps_Steps_to_Reproduce__c","What_We_Know__c","Next_Steps__c","Solution_Comment__c","Issue_Type__c","Ticket_Owner_Name__c","Ticket_Type__c","Platform__c","Collector_Code__c","Feature__c","Product_Version__c","Build_Number__c","Age__c","Status","Account_Name__c","Contact_Name__c","CreatedDate","ClosedDate"
"500Qk00000JI1faIAD","00429325","Support Ticket","NEA read only access for users","Users are granted read only access in the NEA console, however when trying to open the console the user is presented a message ""error code 5. Access denied""","","User has been given permission to access the NEA console, however when trying to start the console the error ""error code 5. Access denied"" is thrown.
We verified that the user does not have proper permissions applied at the SQL server and needs to be updated","Awaiting customer DB team to create missing permission groups detailed in documentation and customer to test again.","Symptom
The customer is trying to setup read only access. Some users are signing in and getting an error when trying to start the console ""error code 5. Access denied.""

Cause
Users to not have proper permissions to the %SAInstallDir%

Resolution
Added modify access to the %SAInstallDir% and verified uesrs can now start the console and run any functions needed.","Guidance","Ian Ranstrom","Question","Netwrix Enterprise Auditor","StealthAUDIT General","Initial setup","","","34.8","Closed - Resolved","ORIX","Jayne Daulong","2024-12-09T22:37:45.000Z","2025-01-13T19:01:44.000Z"
