"Id","ParentId","Type","CreatedById","CreatedDate","Body","Title","LinkUrl","RelatedRecordId","InsertedById","LastModifiedDate"
"0D5Qk00000VRgvpKAD","500Qk00000L1M7HIAV","TextPost","0054u000008ARZjAAO","2025-01-24T07:50:19.000Z","Description: We got an issue application is not working on 23 Jan 11:00 PM UTC.
have rebooted the windows server than its started working.","","","","0054u000008ARZjAAO","2025-01-24T07:50:19.000Z"
"0D5Qk00000VRwUOKA1","500Qk00000L1M7HIAV","TextPost","0054u000007ow49AAA","2025-01-24T08:51:25.000Z","What We've Learned Updated: USA Timezone?","","","","0054u000007ow49AAA","2025-01-24T08:51:25.000Z"
"0D5Qk00000VRzsRKAT","500Qk00000L1M7HIAV","TextPost","0054u000007ow49AAA","2025-01-24T09:02:40.000Z","What We've Learned Updated: USA Timezone?
No number provided from the contact, and account's number didn't connect: (408) 535-1500","","","","0054u000007ow49AAA","2025-01-24T09:02:40.000Z"
"0D5Qk00000VSj3bKAD","500Qk00000L1M7HIAV","TextPost","0054u000007osjSAAQ","2025-01-24T14:53:38.000Z","Invitation updated. Attendees: Frantz Baptiste, Chandan Trikha","","","","0054u000007osjSAAQ","2025-01-24T14:53:38.000Z"
"0D5Qk00000VSj3ZKAT","500Qk00000L1M7HIAV","TextPost","0054u000007osjSAAQ","2025-01-24T14:53:38.000Z","Invitation updated. Attendees: No attendees listed","","","","0054u000007osjSAAQ","2025-01-24T14:53:38.000Z"
"0D5Qk00000VSj3aKAD","500Qk00000L1M7HIAV","TextPost","0054u000007osjSAAQ","2025-01-24T14:53:38.000Z","Invitation updated. Attendees: Frantz Baptiste","","","","0054u000007osjSAAQ","2025-01-24T14:53:38.000Z"
"0D5Qk00000VTVbFKAX","500Qk00000L1M7HIAV","TextPost","0054u000007osjSAAQ","2025-01-24T17:15:14.000Z","What We've Learned Updated: A user was having issues accessing the Publish Report site, so the user rebooted the application server to resolve the issue.","","","","0054u000007osjSAAQ","2025-01-24T17:15:14.000Z"
