"Id","CaseNumber","Ticket_Record_Type_Name__c","Subject","Description","DevOps_Steps_to_Reproduce__c","What_We_Know__c","Next_Steps__c","Solution_Comment__c","Issue_Type__c","Ticket_Owner_Name__c","Ticket_Type__c","Platform__c","Collector_Code__c","Feature__c","Product_Version__c","Build_Number__c","Age__c","Status","Account_Name__c","Contact_Name__c","CreatedDate","ClosedDate"
"500Qk00000BwqG1IAJ","00412132","Support Ticket","Error Scanning Windows FileShare with Least Privileged permission","Getting the following error when attempting to scan Windows hosts:
error enumerating remote shares: access is denied

Validated the following permissions on Target Host:
Scanning Local Mode
Backup Operators and Power Users 
Back up Files and Directories Local Security Policy (inherited from Backup Operators)","","","","We resolved the issue by changing group membership permissions to Access Control Assistance Operators to reflect the updated LPA recommendations for WinServer 2022 and later.
----
AGR 7/25: in progress","Guidance","Scottie Taylor","","Netwrix Enterprise Auditor","StealthAUDIT General","Initial setup","11.6","","10.9","Closed - Resolved","Sierra Nevada Corporation","Kellen Carl","2024-06-17T19:05:34.000Z","2024-06-28T15:44:18.000Z"
