"Id","CaseNumber","Ticket_Record_Type_Name__c","Subject","Description","DevOps_Steps_to_Reproduce__c","What_We_Know__c","Next_Steps__c","Solution_Comment__c","Issue_Type__c","Ticket_Owner_Name__c","Ticket_Type__c","Platform__c","Collector_Code__c","Feature__c","Product_Version__c","Build_Number__c","Age__c","Status","Account_Name__c","Contact_Name__c","CreatedDate","ClosedDate"
"500Qk00000Hx9FCIAZ","00426200","Support Ticket","Superadmins dont Sync properly user missing","Hallo, 
im missing one personon as super admin.
This person is in a group beeing synced but does not apear as admin.
When i start manal sync every think seems to work also the test connection work properly. How can i make this user appear as an admin?
Kind Regards Damian","","","","cloased as per customer confirmation","","Andrei Pop","","Netwrix Endpoint Protector","Active Directory Sync","Incomplete AD Sync","","","60.9","Closed - Resolved","Kernkraftwerk Gösgen-Däniken AG","Damian Rosamilia","2024-11-06T12:45:17.000Z","2025-01-06T11:11:44.000Z"
