"Id","CaseNumber","Ticket_Record_Type_Name__c","Subject","Description","DevOps_Steps_to_Reproduce__c","What_We_Know__c","Next_Steps__c","Solution_Comment__c","Issue_Type__c","Ticket_Owner_Name__c","Ticket_Type__c","Platform__c","Collector_Code__c","Feature__c","Product_Version__c","Build_Number__c","Age__c","Status","Account_Name__c","Contact_Name__c","CreatedDate","ClosedDate"
"500Qk00000Hi9nQIAR","00425641","Support Ticket","Exported entities extract for a full user report in the Endpoint Protector console not working","Good day Team,



Please assist, we are experiencing this issue again with attempting to extract a full user report from the Netwrix console.
You can reference previous Netwrix Support Ticket #419701 where we queried the same issue.

Kind Regards, 
Shaheed.","","Customer has applied the patch and it seems to have worked because they are able to successfully manually export the Computers report.","Customer has requested the ticket to stay opened until Feb. 29th as their customer is scheduled to run this on the 28th of each month @ 11pm, so can we leave the call opened until the 29th.
Need to check on Feb. 29th.","The problem got solved by applying 5941.","","Adrian Draghici","Unexpected Behavior","Netwrix Endpoint Protector","Device Control","Device Groups","","5941","123.1","Closed - Resolved","FNB - First National Bank","Shaheed Jardine","2024-10-31T12:05:25.000Z","2025-03-03T13:30:52.000Z"
