"Id","ParentId","Type","CreatedById","CreatedDate","Body","Title","LinkUrl","RelatedRecordId","InsertedById","LastModifiedDate"
"0D5Qk00000Pmo3fKAB","500Qk00000Hi9nQIAR","TextPost","0054u000008ARZjAAO","2024-10-31T12:05:26.000Z","Description: Good day Team,



Please assist, we are experiencing this issue again with attempting to extract a full user report from the Netwrix console.
You can reference previous Netwrix Support Ticket #419701 where we queried the same issue.

Kind Regards, 
Shaheed.","","","","0054u000008ARZjAAO","2024-10-31T12:05:26.000Z"
"0D5Qk00000XIMH0KAP","500Qk00000Hi9nQIAR","TextPost","0054u0000093L0nAAE","2025-02-19T14:48:54.000Z","What We've Learned Updated: Customer has applied the patch and it seems to have worked because they are able to successfully manually export the Computers report.","","","","0054u0000093L0nAAE","2025-02-19T14:48:54.000Z"
"0D5Qk00000XIMH1KAP","500Qk00000Hi9nQIAR","TextPost","0054u0000093L0nAAE","2025-02-19T14:48:55.000Z","Next Steps Updated: Customer is  scheduled to run on the 28th of each month @ 11pm, so can we leave the call opened until the 29th, we'll update the call on the 29th if successful or not.","","","","0054u0000093L0nAAE","2025-02-19T14:48:55.000Z"
"0D5Qk00000XIEv0KAH","500Qk00000Hi9nQIAR","TextPost","0054u0000093L0nAAE","2025-02-19T14:51:22.000Z","Next Steps Updated: Customer has requested the ticket to stay opened until Feb. 29th as their customer is scheduled to run this on the 28th of each month @ 11pm, so can we leave the call opened until the 29th.
Need to check on Feb. 29th.","","","","0054u0000093L0nAAE","2025-02-19T14:51:22.000Z"
