"Id","CaseNumber","Ticket_Record_Type_Name__c","Subject","Description","DevOps_Steps_to_Reproduce__c","What_We_Know__c","Next_Steps__c","Solution_Comment__c","Issue_Type__c","Ticket_Owner_Name__c","Ticket_Type__c","Platform__c","Collector_Code__c","Feature__c","Product_Version__c","Build_Number__c","Age__c","Status","Account_Name__c","Contact_Name__c","CreatedDate","ClosedDate"
"500Qk00000CpiwCIAR","00414468","Support Ticket","Different device control rules for a subset of devices","I have used Global access, device section to disable removable media. 
I now realize that I need removable media only disabled on a subset of machines. 
How shall I apply the blockage of removable media so that I can only apply it to a subgroup of laptops where I want to enforce this policy?

Thanks for your help","","","","The customer asked about the Device control rights for groups of computers/users.
They were able to set this up bases on the instructions they got.","","Emil Podar","","Netwrix Endpoint Protector","Device Control","Device Rights","","","1.8","Closed - Resolved","NovoEd","Farnaz Ronaghi","2024-07-09T13:47:39.000Z","2024-07-11T09:57:40.000Z"
