"Id","ParentId","CommentBody","CreatedById","CreatedDate","LastModifiedDate","IsPublished","IsDeleted"
"00aQk000007WIDtIAO","500Qk00000CDTEzIAP","When I tried to call using 3CX, A robot announced that it was forbidden by administrator","005Qk000001nViBIAU","2024-06-24T14:51:19.000Z","2024-06-24T14:51:19.000Z","false","false"
"00aQk000007cvhBIAQ","500Qk00000CDTEzIAP","set up an audit log backup as they had over 20 million logs.
also started a client upgrade job for 40 computers
waiting for feedback on Monday","005Qk000001nViBIAU","2024-06-28T16:39:07.000Z","2024-06-28T16:39:07.000Z","false","false"
"00aQk000009OgLtIAK","500Qk00000CDTEzIAP","the audit log ran 3 days ago and the pages were loading
I suggested decreasing the period logs are kept by the audit log and I am waiting for them to get approvals for the change","005Qk000001nViBIAU","2024-09-30T17:40:29.000Z","2024-09-30T17:40:29.000Z","false","false"
