"Id","ParentId","Type","CreatedById","CreatedDate","Body","Title","LinkUrl","RelatedRecordId","InsertedById","LastModifiedDate"
"0D5Qk00000cZ5tlKAC","500Qk00000OQXAdIAP","TextPost","0054u000008ARZjAAO","2025-04-24T21:34:52.000Z","Description: Hello,

I have a few computers that are allowed USB access which shouldn't be the case. They all have EPP installed and I do not see the computers or the users in a USB bypass policy. 

The strange thing is the computer object does not show up in the EPP console either. Do you know what might be causing this issue?","","","","0054u000008ARZjAAO","2025-04-24T21:34:52.000Z"
"0D5Qk00000cbtJAKAY","500Qk00000OQXAdIAP","TextPost","005Qk000002i2OLIAY","2025-04-25T15:44:18.000Z","What We've Learned Updated: The EPP clients are not able to communicate with the server, and this might be the reason for the USB to be allowed. We answered the customer's questions about the client server communication.","","","","005Qk000002i2OLIAY","2025-04-25T15:44:18.000Z"
"0D5Qk00000cbuiCKAQ","500Qk00000OQXAdIAP","TextPost","005Qk000002i2OLIAY","2025-04-25T15:44:35.000Z","Next Steps Updated: Waiting for the customer's feedback.","","","","005Qk000002i2OLIAY","2025-04-25T15:44:35.000Z"
