"Id","CaseNumber","Ticket_Record_Type_Name__c","Subject","Description","DevOps_Steps_to_Reproduce__c","What_We_Know__c","Next_Steps__c","Solution_Comment__c","Issue_Type__c","Ticket_Owner_Name__c","Ticket_Type__c","Platform__c","Collector_Code__c","Feature__c","Product_Version__c","Build_Number__c","Age__c","Status","Account_Name__c","Contact_Name__c","CreatedDate","ClosedDate"
"500Qk00000NmBdSIAV","00441155","Support Ticket","Script","Hi,

I am looking to obtain the script from the following article and the advise it to contact Support.

Step 11: Please contact the Customer Support department to provide the script.

<a href='https://helpcenter.netwrix.com/bundle/EndpointProtector_5.9.4/page/Content/EndpointProtector/Install/Agent/Intune/macOSDeployment.htm' target='_blank'>https://helpcenter.netwrix.com/bundle/EndpointProtector_5.9.4/page/Content/EndpointProtector/Install/Agent/Intune/macOSDeployment.htm</a>","","The customer asked us to send the change IP script","The change IP script was sent to the customer.

Checking if the ticket can be closed.","the script was sent to the customer","","Emil Podar","Question","Netwrix Endpoint Protector","Device Control","Device Rights","","","9.8","Closed - Resolved","Kerry Group Services International Limited","Lorcan O'Sullivan","2025-04-07T14:51:05.000Z","2025-04-17T10:45:04.000Z"
