"Id","ParentId","Type","CreatedById","CreatedDate","Body","Title","LinkUrl","RelatedRecordId","InsertedById","LastModifiedDate"
"0D5Qk00000RruDEKAZ","500Qk00000Ir7c7IAB","TextPost","0054u000008ARZjAAO","2024-11-27T15:14:47.000Z","Description: Hello team,

We are facing an issue where two admins from the admin group synced with EPP still appear as Usertype: EPP and not an AD one, they are also unable to use the password on the AD to login. I will attach a print for you.

Best regards,","","","","0054u000008ARZjAAO","2024-11-27T15:14:47.000Z"
"0D5Qk00000SMZmKKAX","500Qk00000Ir7c7IAB","TextPost","005Qk000001nViBIAU","2024-12-05T19:38:29.000Z","What We've Learned Updated: 2 AD users are not syncing correctly and are not able to log in using the AD password.
Initial troubleshooting was performed by the partner with a negative outcome.","","","","005Qk000001nViBIAU","2024-12-05T19:38:29.000Z"
"0D5Qk00000SMkXVKA1","500Qk00000Ir7c7IAB","TextPost","005Qk000001nViBIAU","2024-12-05T19:38:46.000Z","Next Steps Updated: SSH into the server and delete the users from the DB and try the sync again","","","","005Qk000001nViBIAU","2024-12-05T19:38:46.000Z"
