"Id","ParentId","Type","CreatedById","CreatedDate","Body","Title","LinkUrl","RelatedRecordId","InsertedById","LastModifiedDate"
"0D5Qk00000VuGqdKAF","500Qk00000LKigoIAD","TextPost","0054u000008ARZjAAO","2025-01-31T21:47:49.000Z","Description: Hello, we have followed all of the documentation for installing endpoint protector on macs.  It installs but we are unable to get it to apply the provided configuration and connect to the server.  Is it possible to setup a troubleshooting call to resolve our issue?

The VM died when I went to appliance->server info","","","","0054u000008ARZjAAO","2025-01-31T21:47:49.000Z"
"0D5Qk00000W1sDvKAJ","500Qk00000LKigoIAD","TextPost","005Qk000001nViKIAU","2025-02-03T19:34:59.000Z","What We've Learned Updated: Customer used different script than the JAMF ones. Provided correct scripts.","","","","005Qk000001nViKIAU","2025-02-03T19:34:59.000Z"
"0D5Qk00000W1mtTKAR","500Qk00000LKigoIAD","TextPost","005Qk000001nViKIAU","2025-02-03T19:35:27.000Z","Next Steps Updated: 03Feb: Waiting on customer to mass re-deploy the agents and see if they connect to the EPP server now.","","","","005Qk000001nViKIAU","2025-02-03T19:35:27.000Z"
"0D5Qk00000Wb9H5KAJ","500Qk00000LKigoIAD","TextPost","005Qk000001nViKIAU","2025-02-10T16:03:04.000Z","<p>Checked.</p>","","","","005Qk000001nViKIAU","2025-02-10T16:03:04.000Z"
