"Id","ParentId","Type","CreatedById","CreatedDate","Body","Title","LinkUrl","RelatedRecordId","InsertedById","LastModifiedDate"
"0D5Qk00000dTRTYKA4","500Qk00000OqemmIAB","TextPost","005Qk000002AJWTIA4","2025-05-06T15:31:34.000Z","Description: Security scan is detecting that port 81 http is open on the server even though Access Analyzer is using https.","","","","005Qk000002AJWTIA4","2025-05-06T15:31:34.000Z"
"0D5Qk00000dTVhdKAG","500Qk00000OqemmIAB","TextPost","005Qk000002AJWTIA4","2025-05-06T15:34:13.000Z","Steps to Reproduce Updated: Customer running security scan that detects port 81 is open on HTTP even though the product has been moved to port 481 HTTPS.","","","","005Qk000002AJWTIA4","2025-05-06T15:34:13.000Z"
"0D5Qk00000dTJXuKAO","500Qk00000OqemmIAB","TextPost","005Qk000002AJWTIA4","2025-05-06T15:34:47.000Z","What We've Learned Updated: IIS still had port 81 opened even though we are using port 481 HTTPS.
Disabled port 81 in IIS and awaiting security scan to confirm issue is resolved.","","","","005Qk000002AJWTIA4","2025-05-06T15:34:47.000Z"
"0D5Qk00000dTJXvKAO","500Qk00000OqemmIAB","TextPost","005Qk000002AJWTIA4","2025-05-06T15:34:47.000Z","Next Steps Updated: Awaiting customer security scan","","","","005Qk000002AJWTIA4","2025-05-06T15:34:47.000Z"
"0D5Qk00000dxRIGKA2","500Qk00000OqemmIAB","TextPost","005Qk000002AJWTIA4","2025-05-12T12:49:08.000Z","What We've Learned Updated: --------
05/12/2025
--------
Customer confirmed that the scan came back ok after the last run, but they want to run one more scan on the 14th to double check.

IIS still had port 81 opened even though we are using port 481 HTTPS.
Disabled port 81 in IIS and awaiting security scan to confirm issue is resolved.","","","","005Qk000002AJWTIA4","2025-05-12T12:49:08.000Z"
