"Id","CaseNumber","Ticket_Record_Type_Name__c","Subject","Description","DevOps_Steps_to_Reproduce__c","What_We_Know__c","Next_Steps__c","Solution_Comment__c","Issue_Type__c","Ticket_Owner_Name__c","Ticket_Type__c","Platform__c","Collector_Code__c","Feature__c","Product_Version__c","Build_Number__c","Age__c","Status","Account_Name__c","Contact_Name__c","CreatedDate","ClosedDate"
"500Qk00000MP1DxIAL","00437334","Support Ticket","Not able to access Published Reports","Published Reports do not open.","The account used to run the Netwrix Enterprise Auditor Web Server service does not have access to the Enterprise Auditor database.","The customer has recently upgraded NEA. It appears that the account used to Access NEA didn't had permissions on SQL server. This KB article was shared with customer after initial probing:

https://helpcenter.netwrix.com/bundle/z-kb-articles-salesforce/page/kA0Qk0000000Qs9KAE.html","Close the case as issue has been resolved.","Symptom
When you were trying to access the Web Reporting console of Netwrix Enterprise Auditor, the page would not open.

Resolution
As you mentioned that you have recently upgraded the Netwrix Enterprise Auditor and after that you were unable to access the reporting module, following the steps mentioned in this KB article resolved the issue for you:

Unable to View Published Reports in Web Console","Incorrect configuration: Netwrix server","Saqib Sharif","Error","Netwrix Enterprise Auditor","StealthAUDIT General","NEA Web Report Console","11.6","11.6.0.126","0.1","Closed - Resolved","Dubai Petroleum","Syed Tabish","2025-02-28T03:38:15.000Z","2025-02-28T06:24:31.000Z"
