"Id","CaseNumber","Ticket_Record_Type_Name__c","Subject","Description","DevOps_Steps_to_Reproduce__c","What_We_Know__c","Next_Steps__c","Solution_Comment__c","Issue_Type__c","Ticket_Owner_Name__c","Ticket_Type__c","Platform__c","Collector_Code__c","Feature__c","Product_Version__c","Build_Number__c","Age__c","Status","Account_Name__c","Contact_Name__c","CreatedDate","ClosedDate"
"500Qk00000MrqqDIAR","00438625","Support Ticket","Set up of Web UI - NEA Published Reports","Need some assistance with setting up correct access to the web interface","","1) One thing that we did not fix was the URL in the ""Publish Reports"" desktop icon in your environment.  You want it to point to the correct Published Reports link as found in your NEA > Settings > Reporting > Website URL configuration.  Please see the following Netwrix Help Center document and scroll down to the section = ""Update Website URLs"":
Securing the Web Console

https://helpcenter.netwrix.com/bundle/EnterpriseAuditor_11.6/page/Content/EnterpriseAuditor/Install/Application/Reports/Secure.htm#_Update_Website_URLs

2) This morning, we added one of your AD accounts with a Report Viewer Role in SA/NEA > Settings> Access.  The second time we clicked the ""Save"" button and now your new Report Viewer user can view reports when they log into SA/NEA Published Reports.","","1) One thing that we did not fix was the URL in the ""Publish Reports"" desktop icon in your environment.  You want it to point to the correct Published Reports link as found in your NEA > Settings > Reporting > Website URL configuration.  Please see the following Netwrix Help Center document and scroll down to the section = ""Update Website URLs"":

Securing the Web Console

https://helpcenter.netwrix.com/bundle/EnterpriseAuditor_11.6/page/Content/EnterpriseAuditor/Install/Application/Reports/Secure.htm#_Update_Website_URLs

2) This morning, we added one of your AD accounts with a Report Viewer Role in SA/NEA > Settings> Access.  The second time we clicked the ""Save"" button and now your new Report Viewer user can view reports when they log into SA/NEA Published Reports.","Guidance","Mike Candon","Question","Netwrix Enterprise Auditor","StealthAUDIT General","NEA Web Report Console","11.5","","12.8","Closed - Resolved","Eaton Vance Corp","Jeffrey Schenkman","2025-03-12T20:51:58.000Z","2025-03-25T16:44:29.000Z"
