"Id","ParentId","Type","CreatedById","CreatedDate","Body","Title","LinkUrl","RelatedRecordId","InsertedById","LastModifiedDate"
"0D5Qk00000Xw41sKAB","500Qk00000MP1DxIAL","TextPost","0054u000008ARZjAAO","2025-02-28T03:38:17.000Z","Description: Published Reports do not open.","","","","0054u000008ARZjAAO","2025-02-28T03:38:17.000Z"
"0D5Qk00000Xw5FiKAJ","500Qk00000MP1DxIAL","TextPost","005Qk00000214EvIAI","2025-02-28T03:52:13.000Z","What We've Learned Updated: EMEA Customer","","","","005Qk00000214EvIAI","2025-02-28T03:52:13.000Z"
"0D5Qk00000XwHbyKAF","500Qk00000MP1DxIAL","TextPost","005Qk00000214EvIAI","2025-02-28T06:22:14.000Z","Next Steps Updated: Close the case as issue has been resolved.","","","","005Qk00000214EvIAI","2025-02-28T06:22:14.000Z"
"0D5Qk00000XwHbxKAF","500Qk00000MP1DxIAL","TextPost","005Qk00000214EvIAI","2025-02-28T06:22:14.000Z","What We've Learned Updated: The customer has recently upgraded NEA. It appears that the account used to Access NEA didn't had permissions on SQL server. This KB article was shared with customer after initial probing:

https://helpcenter.netwrix.com/bundle/z-kb-articles-salesforce/page/kA0Qk0000000Qs9KAE.html","","","","005Qk00000214EvIAI","2025-02-28T06:22:14.000Z"
"0D5Qk00000XwHbwKAF","500Qk00000MP1DxIAL","TextPost","005Qk00000214EvIAI","2025-02-28T06:22:14.000Z","Steps to Reproduce Updated: The customer has reea","","","","005Qk00000214EvIAI","2025-02-28T06:22:14.000Z"
"0D5Qk00000XwMl7KAF","500Qk00000MP1DxIAL","TextPost","005Qk00000214EvIAI","2025-02-28T06:24:01.000Z","Steps to Reproduce Updated: The account used to run the Netwrix Enterprise Auditor Web Server service does not have access to the Enterprise Auditor database.","","","","005Qk00000214EvIAI","2025-02-28T06:24:01.000Z"
