"Id","ParentId","Type","CreatedById","CreatedDate","Body","Title","LinkUrl","RelatedRecordId","InsertedById","LastModifiedDate"
"0D5Qk00000bwzMXKAY","500Qk00000O7ZpfIAF","TextPost","0054u000007ow49AAA","2025-04-16T15:27:49.000Z","Description: SSL certificate issue when accessing published reports","","","","0054u000007ow49AAA","2025-04-16T15:27:49.000Z"
"0D5Qk00000bxCfpKAE","500Qk00000O7ZpfIAF","TextPost","0054u000007ow49AAA","2025-04-16T15:34:50.000Z","Steps to Reproduce Updated: Access published reports to se a warning","","","","0054u000007ow49AAA","2025-04-16T15:34:50.000Z"
"0D5Qk00000bxBNMKA2","500Qk00000O7ZpfIAF","TextPost","0054u000007ow49AAA","2025-04-16T15:34:54.000Z","Steps to Reproduce Updated: Access published reports to see a warning","","","","0054u000007ow49AAA","2025-04-16T15:34:54.000Z"
"0D5Qk00000bx1hyKAA","500Qk00000O7ZpfIAF","TextPost","0054u000007ow49AAA","2025-04-16T15:35:34.000Z","What We've Learned Updated: Same issue as with previous NTM ticket probably cert is not where it supposed to be","","","","0054u000007ow49AAA","2025-04-16T15:35:34.000Z"
"0D5Qk00000bwwoxKAA","500Qk00000O7ZpfIAF","TextPost","0054u000007ow49AAA","2025-04-16T15:35:52.000Z","Next Steps Updated: Meeting as soon as I confirm what exactly it affects AIC or PR","","","","0054u000007ow49AAA","2025-04-16T15:35:52.000Z"
"0D5Qk00000c0rswKAA","500Qk00000O7ZpfIAF","TextPost","0054u000007ow49AAA","2025-04-17T13:30:10.000Z","Invitation updated. Attendees: No attendees listed","","","","0054u000007ow49AAA","2025-04-17T13:30:10.000Z"
"0D5Qk00000c0rsxKAA","500Qk00000O7ZpfIAF","TextPost","0054u000007ow49AAA","2025-04-17T13:30:10.000Z","Invitation updated. Attendees: Ilya Kotov","","","","0054u000007ow49AAA","2025-04-17T13:30:10.000Z"
"0D5Qk00000c0rsyKAA","500Qk00000O7ZpfIAF","TextPost","0054u000007ow49AAA","2025-04-17T13:30:10.000Z","Invitation updated. Attendees: Ilya Kotov, Antonie Olivier","","","","0054u000007ow49AAA","2025-04-17T13:30:10.000Z"
