"Id","ParentId","Type","CreatedById","CreatedDate","Body","Title","LinkUrl","RelatedRecordId","InsertedById","LastModifiedDate"
"0D5Qk00000REtJjKAL","500Qk00000IVObaIAH","TextPost","0054u000008ARZjAAO","2024-11-19T11:20:42.000Z","Description: IDM Team unable login to StealthAudit using PCDAAIDMR01 due to this ID exist only in Local AD not inside the system. 
Username PCDAAIDMR01 created to reset and maintain user access.

Please advise if need recreate username or we just can reset password to solve the issue. 

Fyi, there are on going activity performed by server team to integrate child AD servers to the new servers. Not really sure if this activity that caused this issue. 
We also do not have visibility on the details activity to share with you. 

FYI, multiple users unable to login the the StealthAudit at this moment and required for password reset if possible.","","","","0054u000008ARZjAAO","2024-11-19T11:20:42.000Z"
"0D5Qk00000RFDtdKAH","500Qk00000IVObaIAH","TextPost","00570000003KXurAAG","2024-11-19T13:44:19.000Z","<p>Account Country <b>Malaysia</b></p><p> </p>","","","","00570000003KXurAAG","2024-11-19T13:44:19.000Z"
"0D5Qk00000RmWuPKAV","500Qk00000IVObaIAH","TextPost","005Qk00000214EvIAI","2024-11-26T10:12:00.000Z","What We've Learned Updated: The issue is present internally at the customer end and not our application end","","","","005Qk00000214EvIAI","2024-11-26T10:12:00.000Z"
"0D5Qk00000RmrPCKAZ","500Qk00000IVObaIAH","TextPost","005Qk00000214EvIAI","2024-11-26T11:37:22.000Z","<p>Since the issue was resolved by the customer&#39;s team internally and the issue doesn&#39;t seem to be linked with our product, the Ticket closing format from TextExpander was not followed.</p>","","","","005Qk00000214EvIAI","2024-11-26T11:37:22.000Z"
