"Id","CaseNumber","Ticket_Record_Type_Name__c","Subject","Description","DevOps_Steps_to_Reproduce__c","What_We_Know__c","Next_Steps__c","Solution_Comment__c","Issue_Type__c","Ticket_Owner_Name__c","Ticket_Type__c","Platform__c","Collector_Code__c","Feature__c","Product_Version__c","Build_Number__c","Age__c","Status","Account_Name__c","Contact_Name__c","CreatedDate","ClosedDate"
"500Qk00000ItCB7IAN","00428422","Support Ticket","Upload EPP VM to Azure Blob","Liebe Kollegen, 
Unser Kunde Nexpert löst gerade seine On-Premise-Architektur auf und zieht in die Azure-Cloud um. 
Siehe PPI-02591 und RF-0699
Bitte mit Herrn Holst Kontakt aufnehmen, um einen Termin für die Migration in Azure Blob zu vereinbaren. 

VG
Maguy","","","","Migrated with System Backup V2 from the On prem server, to the Azure hosted server.
Licenses were transfered, and the customer gave his approval to close the ticket.","","Alin Anca","","Netwrix Endpoint Protector","Server","Server Migration","","","42.0","Closed - Resolved","Nexpert AG","Harald Holst","2024-11-28T13:21:14.000Z","2025-01-09T13:31:53.000Z"
