"Id","CaseNumber","Ticket_Record_Type_Name__c","Subject","Description","DevOps_Steps_to_Reproduce__c","What_We_Know__c","Next_Steps__c","Solution_Comment__c","Issue_Type__c","Ticket_Owner_Name__c","Ticket_Type__c","Platform__c","Collector_Code__c","Feature__c","Product_Version__c","Build_Number__c","Age__c","Status","Account_Name__c","Contact_Name__c","CreatedDate","ClosedDate"
"500Qk00000F2RrZIAV","00419392","Support Ticket","Case 00030551 Feedback after migration error","Hey Guys we are waiting for a feedback since 3 month now.
Could you please tell us when we will get a solution? 
Kind regards
Fabian Max
apoprojekt","","","","Customer confirmed this can be closed.
UPDATE: Customer reopened the ticket in January but did not respond to any follow-up. Ticket will be closed regarding ticket hygiene.","","Alin Anca","Error","Netwrix Endpoint Protector","Server","Server Migration","NONE","","195.8","Closed - Resolved","APOPROJEKT GMBH","Fabian Max","2024-08-28T13:56:19.000Z","2025-03-12T09:11:52.000Z"
