"Id","CaseNumber","Ticket_Record_Type_Name__c","Subject","Description","DevOps_Steps_to_Reproduce__c","What_We_Know__c","Next_Steps__c","Solution_Comment__c","Issue_Type__c","Ticket_Owner_Name__c","Ticket_Type__c","Platform__c","Collector_Code__c","Feature__c","Product_Version__c","Build_Number__c","Age__c","Status","Account_Name__c","Contact_Name__c","CreatedDate","ClosedDate"
"500Qk00000Dh2WwIAJ","00416373","Support Ticket","Import Systemadministratoren in den Systemeinstellungen über Active Directory","Hallo,

ich hatte vor kurzem bereit ein Ticket zu dem obigen Fall angefragt und mir wurde in diesem Fall auch geholfen. Nun ist mit aber aufgefallen, dass wenn ich Gruppen mit Mitgliedern hinzufüge die schon mal als Systemadministrator über das AD gesynct wurden, diese ein zweites Mal nicht mehr mit in die Liste mit aufgenommen werden.

Kann man dies in der Software so zurücksetzen, dass die Benutzer wieder als Systemadministratoren unter System Konfiguration --> System Einstellungen --> Active Directory Authentifizierung hinzugefügt werden können?

Vielen Dank vorab und
Freundliche Grüße
F.Bartl","","","","deleted the users that had the deleted flag = 1","","Alin Anca","","Netwrix Endpoint Protector","Device Control","Device Settings","","","1.8","Closed - Resolved","IHK Region Stuttgart","Florian Bartl","2024-07-29T14:04:39.000Z","2024-07-31T08:12:09.000Z"
