"Id","ParentId","Type","CreatedById","CreatedDate","Body","Title","LinkUrl","RelatedRecordId","InsertedById","LastModifiedDate"
"0D5Qk00000XmMTLKA3","500Qk00000MKOxZIAX","TextPost","0054u000008ARZjAAO","2025-02-26T13:52:40.000Z","Description: Hi,

The endpoint protector admin portal is not accessible. Getting a 'This site can’t be reached' on the page. Please investigate

<a href='https://ajsl9rw.hosted.endpointprotector.com/' target='_blank'>https://ajsl9rw.hosted.endpointprotector.com/</a>","","","","0054u000008ARZjAAO","2025-02-26T13:52:40.000Z"
"0D5Qk00000XmUXaKAN","500Qk00000MKOxZIAX","TextPost","005Qk000001nVi3IAE","2025-02-26T14:59:40.000Z","What We've Learned Updated: The endpoint protector admin portal is not accessible.

The EPP server is hosted by us.","","","","005Qk000001nVi3IAE","2025-02-26T14:59:40.000Z"
"0D5Qk00000XmYsoKAF","500Qk00000MKOxZIAX","TextPost","005Qk000001nVi3IAE","2025-02-26T15:00:16.000Z","Next Steps Updated: We will try to restart the server and then to access it and verify if the services are up and running","","","","005Qk000001nVi3IAE","2025-02-26T15:00:16.000Z"
"0D5Qk00000ZhKtmKAF","500Qk00000MKOxZIAX","TextPost","005Qk000001nVi3IAE","2025-03-19T15:33:36.000Z","Next Steps Updated: We will try to restart the server and then to access it and verify if the services are up and running

The server was restarted and the UI was accessible again.","","","","005Qk000001nVi3IAE","2025-03-19T15:33:36.000Z"
