"Id","CaseNumber","Ticket_Record_Type_Name__c","Subject","Description","DevOps_Steps_to_Reproduce__c","What_We_Know__c","Next_Steps__c","Solution_Comment__c","Issue_Type__c","Ticket_Owner_Name__c","Ticket_Type__c","Platform__c","Collector_Code__c","Feature__c","Product_Version__c","Build_Number__c","Age__c","Status","Account_Name__c","Contact_Name__c","CreatedDate","ClosedDate"
"500Qk00000NrJaLIAV","00441430","Support Ticket","Password Reset root user WEB-UI","Password got lost for WEB-UI access. We need support to reset the password.","","Contacted the client via 3CX to remote in.
Connected remote to the SSH, they also made a snapshot first.
Went on and applied the procedure 4 from the backend and changed the password for the root admin.
Then we tested the login and he could get in without a problem and also he could change it too.
Agreed to close the case.","Closing ticket as resolved.","Issue solved after changing the password.
Client could get in successfully.","","Marian Ilies","Error","Netwrix Endpoint Protector","EPP Other","Other","","","0.0","Closed - Resolved","Barthelmeß EDV-Service GmbH","Alexander Support","2025-04-09T10:51:16.000Z","2025-04-09T11:29:34.000Z"
