"Id","CaseNumber","Ticket_Record_Type_Name__c","Subject","Description","DevOps_Steps_to_Reproduce__c","What_We_Know__c","Next_Steps__c","Solution_Comment__c","Issue_Type__c","Ticket_Owner_Name__c","Ticket_Type__c","Platform__c","Collector_Code__c","Feature__c","Product_Version__c","Build_Number__c","Age__c","Status","Account_Name__c","Contact_Name__c","CreatedDate","ClosedDate"
"500Qk00000ODzizIAD","00442558","Support Ticket","Customer portal access","Hello Team, one of our customer choice international. planning to do certification on Endpoint protector. she register on netwrix customer portal - <a href='https://gayatri.rashinkar@choicetechlab.com' target='_blank'>gayatri.rashinkar@choicetechlab.com</a>. but not able to find training on customer - customer training. kindly help email id <a href='https://gayatri.rashinkar@choicetechlab.com' target='_blank'>gayatri.rashinkar@choicetechlab.com</a>","","21 April
- involved customer success and the AMplify Success team to resolve the customers query

23 April
- Alexandra Bolfa confirmed that they have taken over the issue, and that the case can be closed from the support side.","23 April
- based on the confirmation from Alexandra Bolfa, I will proceed with a soft close of the ticket.","Based on the confirmation from Alexandra Bolfa, I will proceed with a soft close of the ticket.","Account Permission Issue","Alin Anca","Question","Netwrix Endpoint Protector","EPP Other","Other","","","18.0","Closed - Resolved","Choice Group","umesh shetty","2025-04-19T05:50:05.000Z","2025-05-07T06:24:02.000Z"
