"Id","CaseNumber","Ticket_Record_Type_Name__c","Subject","Description","DevOps_Steps_to_Reproduce__c","What_We_Know__c","Next_Steps__c","Solution_Comment__c","Issue_Type__c","Ticket_Owner_Name__c","Ticket_Type__c","Platform__c","Collector_Code__c","Feature__c","Product_Version__c","Build_Number__c","Age__c","Status","Account_Name__c","Contact_Name__c","CreatedDate","ClosedDate"
"500Qk00000IM1SxIAL","00427186","Support Ticket","Unable to connect to EPP ORACLE VirutalBox (HIGH PRIORITY)","Hi Team,

Greetings,

Myself Kantikirit Vuppalanchi and I am from Volksoft Consulting Networking Team. Wanted to inform you that we are unable to login into the EPP ORACLE VirtualBox and connect.

Please let us know when can we connect with you to get this issue resolved.

We are available from 09:00 - 18:00 (Mon - Sat).

Yesterday we have accidentally sent an email to <a href='https://support@endpointprotector.com' target='_blank'>support@endpointprotector.com</a>, but we realized that emails are to be sent to <a href='https://techsupport@netwrix.com' target='_blank'>techsupport@netwrix.com</a>. Please look into this issue at HIGH PRIORITY","","","","Access to Epp was restored.","","Andrei Pop","","Netwrix Endpoint Protector","EPP Other","Other","NONE","","7.0","Closed - Resolved","Volksoft Consulting Pvt. Ltd","","2024-11-15T05:57:40.000Z","2024-11-22T05:41:33.000Z"
