"Id","ParentId","Type","CreatedById","CreatedDate","Body","Title","LinkUrl","RelatedRecordId","InsertedById","LastModifiedDate"
"0D5Qk00000cqlZHKAY","500Qk00000OWLrbIAH","TextPost","0054u000008ARZjAAO","2025-04-28T06:43:13.000Z","Description: need to reset password from backend","","","","0054u000008ARZjAAO","2025-04-28T06:43:13.000Z"
"0D5Qk00000cqopKKAQ","500Qk00000OWLrbIAH","TextPost","005Qk000003xRAXIA2","2025-04-28T06:47:20.000Z","What We've Learned Updated: 28/04/2025 Client is requesting a password reset from the backend.","","","","005Qk000003xRAXIA2","2025-04-28T06:47:20.000Z"
"0D5Qk00000cqkDpKAI","500Qk00000OWLrbIAH","TextPost","005Qk000003xRAXIA2","2025-04-28T06:47:37.000Z","Next Steps Updated: 28/04/2025 Will have to schedule a remote session.","","","","005Qk000003xRAXIA2","2025-04-28T06:47:37.000Z"
"0D5Qk00000cqqcYKAQ","500Qk00000OWLrbIAH","TextPost","005Qk000003xRAXIA2","2025-04-28T06:49:48.000Z","Invitation updated. Attendees: Marian Ilies","","","","005Qk000003xRAXIA2","2025-04-28T06:49:48.000Z"
"0D5Qk00000cqqcXKAQ","500Qk00000OWLrbIAH","TextPost","005Qk000003xRAXIA2","2025-04-28T06:49:48.000Z","Invitation updated. Attendees: No attendees listed","","","","005Qk000003xRAXIA2","2025-04-28T06:49:48.000Z"
"0D5Qk00000cqqcZKAQ","500Qk00000OWLrbIAH","TextPost","005Qk000003xRAXIA2","2025-04-28T06:49:48.000Z","Invitation updated. Attendees: Marian Ilies, prerana yadav","","","","005Qk000003xRAXIA2","2025-04-28T06:49:48.000Z"
"0D5Qk00000crEF3KAM","500Qk00000OWLrbIAH","TextPost","005Qk000003xRAXIA2","2025-04-28T10:07:07.000Z","What We've Learned Updated: 28/04/2025 Client is requesting a password reset from the backend.

28/04/2025 - Connected remote to the backend with the client and assisted with changing the password by following the procedure 4 from the backup procedures book.

Tested aftewards and it is working accordingly. She could login successfully.","","","","005Qk000003xRAXIA2","2025-04-28T10:07:07.000Z"
"0D5Qk00000cr00zKAA","500Qk00000OWLrbIAH","TextPost","005Qk000003xRAXIA2","2025-04-28T10:07:21.000Z","Next Steps Updated: 28/04/2025 Will have to schedule a remote session.

28/04/2025  Closing ticket as resolved.","","","","005Qk000003xRAXIA2","2025-04-28T10:07:21.000Z"
