"Id","CaseNumber","Ticket_Record_Type_Name__c","Subject","Description","DevOps_Steps_to_Reproduce__c","What_We_Know__c","Next_Steps__c","Solution_Comment__c","Issue_Type__c","Ticket_Owner_Name__c","Ticket_Type__c","Platform__c","Collector_Code__c","Feature__c","Product_Version__c","Build_Number__c","Age__c","Status","Account_Name__c","Contact_Name__c","CreatedDate","ClosedDate"
"500Qk00000C14aXIAR","00412289","Support Ticket","Could you update the progress for Ticket# 00410118?","Hi Support Team,


I sent you email for it to you but it seems not to reach you. We need to plan it if this issue is fixed later than we expected because it is serious one in Korean maket.

Please understand it generously.


Have a nice day!
Thank you for your time.


Best Regards,
Jack Jung","","","","duplicate 00410118","","Daniel Anton","","Netwrix Endpoint Protector","EPP Other","Other","","","0.4","Closed - Resolved","CoSoSys Korea","Support Netwrix","2024-06-19T01:42:10.000Z","2024-06-19T11:05:09.000Z"
