"Id","ParentId","Type","CreatedById","CreatedDate","Body","Title","LinkUrl","RelatedRecordId","InsertedById","LastModifiedDate"
"0D5Qk00000ZhNH9KAN","500Qk00000N6YcuIAF","TextPost","0054u000008ARZjAAO","2025-03-19T16:04:22.000Z","Description: Hello! The customer - LR Prokuratura (Office of the Prosecutor-General of the Republic of Latvia).
We are experiencing an issue that I have encountered before, and now another user in the system is facing the same problem.

The user logs into the system using a local account. After logging in, the system prompts them to change their password. However, this action is not possible. When the user copies their current password into the required field, the system responds with an error stating that the password is incorrect.

However, the password is correct—it is the same one the user successfully used to log in, as shown in the attached screenshot.

Could you please advise on why this is happening and how to resolve it?","","","","0054u000008ARZjAAO","2025-03-19T16:04:22.000Z"
"0D5Qk00000Zl1ePKAR","500Qk00000N6YcuIAF","TextPost","005Qk000001nVi3IAE","2025-03-20T12:56:43.000Z","What We've Learned Updated: Customer encounter an issue with the Password Change for a user.","","","","005Qk000001nVi3IAE","2025-03-20T12:56:43.000Z"
"0D5Qk00000Zl1T0KAJ","500Qk00000N6YcuIAF","TextPost","005Qk000001nVi3IAE","2025-03-20T12:57:30.000Z","Next Steps Updated: We have gathered all the details required to schedule a remote session to assist them in reseting the password.","","","","005Qk000001nVi3IAE","2025-03-20T12:57:30.000Z"
"0D5Qk00000aCy8dKAC","500Qk00000N6YcuIAF","TextPost","005Qk000001nVi3IAE","2025-03-24T10:39:15.000Z","Next Steps Updated: We have gathered all the details required to schedule a remote session to assist them in reseting the password.

In the session we have successfully change the password for the affected user.","","","","005Qk000001nVi3IAE","2025-03-24T10:39:15.000Z"
