"Id","CaseNumber","Ticket_Record_Type_Name__c","Subject","Description","DevOps_Steps_to_Reproduce__c","What_We_Know__c","Next_Steps__c","Solution_Comment__c","Issue_Type__c","Ticket_Owner_Name__c","Ticket_Type__c","Platform__c","Collector_Code__c","Feature__c","Product_Version__c","Build_Number__c","Age__c","Status","Account_Name__c","Contact_Name__c","CreatedDate","ClosedDate"
"500Qk00000KsvqcIAB","00432989","Support Ticket","Please Provide Download Link for 5.9.4.1","Dear Netwrix Support,

please provide a download link for the Offline Patch 5.9.4.1 (HWA-EPP4-U0066).

We’re currently on 5.9.4.0 (MP-HWA-EPP4-U0065) running on Ubuntu 22.04.2 LTS l.
Server-ID: NXWQWFOJ

Thank you very much!","","","","Closed - solved by sending the 5941 offline patch.","","Adrian Draghici","Request","Netwrix Endpoint Protector","Server","Server LiveUpdate","NONE","-","33.9","Closed - Resolved","Rhein-Neckar-Zeitung","EDV Abteilung","2025-01-21T14:40:22.000Z","2025-02-24T12:56:52.000Z"
