"Id","CaseNumber","Ticket_Record_Type_Name__c","Subject","Description","DevOps_Steps_to_Reproduce__c","What_We_Know__c","Next_Steps__c","Solution_Comment__c","Issue_Type__c","Ticket_Owner_Name__c","Ticket_Type__c","Platform__c","Collector_Code__c","Feature__c","Product_Version__c","Build_Number__c","Age__c","Status","Account_Name__c","Contact_Name__c","CreatedDate","ClosedDate"
"500Qk00000KshkSIAR","00432985","Support Ticket","6.2.3.1010","Dear netwrix support
We have issue with Live update on server and I need offline patch for 5.9.4.1 version
This is our server in China, and the issue is well known with error: An error occurred. Hash does not match, and always we fix it with offline patch
Thank you in advance for your support","Upgrade the server via Live update","Upgrade error for the version 5.9.4.1.
They requested an offline patch for it","remove error","Removed the error from the backend.","Backend Server Fix","Alin Anca","Request","Netwrix Endpoint Protector","Server","Server LiveUpdate","","","2.0","Closed - Resolved","BMTS Technology GmbH & Co. KG","Novak Vucetic","2025-01-21T14:27:37.000Z","2025-01-23T14:43:22.000Z"
