"Id","CaseNumber","Ticket_Record_Type_Name__c","Subject","Description","DevOps_Steps_to_Reproduce__c","What_We_Know__c","Next_Steps__c","Solution_Comment__c","Issue_Type__c","Ticket_Owner_Name__c","Ticket_Type__c","Platform__c","Collector_Code__c","Feature__c","Product_Version__c","Build_Number__c","Age__c","Status","Account_Name__c","Contact_Name__c","CreatedDate","ClosedDate"
"500Qk00000FZqzJIAT","00420586","Support Ticket","Y0185-APP0443-S: Access Denied on Azure AD Inventory scan.","StealthAudit is trying to connect to <a href='https://ALLSTATE365.ONMICROSOFT.COM' target='_blank'>ALLSTATE365.ONMICROSOFT.COM</a> from Y0185-APP0443-S but we are getting the following:
""Connecting to <a href='https://ALLSTATE365.ONMICROSOFT.COM' target='_blank'>ALLSTATE365.ONMICROSOFT.COM</a> using eee0e1ad-4c1a-43b7-858c-65720965b491: ACCESS DENIED""
""<a href='https://ALLSTATE365.ONMICROSOFT.COM' target='_blank'>ALLSTATE365.ONMICROSOFT.COM</a>eee0e1ad-4c1a-43b7-858c-65720965b491ACCESS DENIED profile: Azure App Connection""                

Have requested confirmation of secret from the ADI team.","","","","Wrong credential profile configured. Currently, only the Application (client) ID and Client Secret value are supported to authenticate the Azure AD/Entra ID.
Modern authentication with a certificate is not supported by AZUREADINVENTORY DC","Incorrect configuration: Netwrix product","Aleksandr Timofeev","","Netwrix Enterprise Auditor","StealthAUDIT for AzureAD","Credentials","11.6","","48.0","Closed - Resolved","Allstate Insurance Company","Stealth Audit","2024-09-10T17:16:56.000Z","2024-10-28T16:16:13.000Z"
