"Id","ParentId","Type","CreatedById","CreatedDate","Body","Title","LinkUrl","RelatedRecordId","InsertedById","LastModifiedDate"
"0D5Qk00000caXxLKAU","500Qk00000ORN7aIAH","TextPost","0054u000008ARZjAAO","2025-04-25T06:48:55.000Z","Description: When running the scan, the data is retrieved from the target server successfully. However, the report is not getting generated.
Can we please connect over a call and close this issue.","","","","0054u000008ARZjAAO","2025-04-25T06:48:55.000Z"
"0D5Qk00000cqC66KAE","500Qk00000ORN7aIAH","TextPost","005Qk00000214EvIAI","2025-04-28T00:28:12.000Z","Steps to Reproduce Updated: - Generate a report with Path or File Name longer than allowed. File Name Limit: 260 chars, Path Limit: 248 chars.","","","","005Qk00000214EvIAI","2025-04-28T00:28:12.000Z"
"0D5Qk00000cqCihKAE","500Qk00000ORN7aIAH","TextPost","005Qk00000214EvIAI","2025-04-28T00:29:34.000Z","Next Steps Updated: Awaiting customer's response of this case.","","","","005Qk00000214EvIAI","2025-04-28T00:29:34.000Z"
"0D5Qk00000cqCigKAE","500Qk00000ORN7aIAH","TextPost","005Qk00000214EvIAI","2025-04-28T00:29:34.000Z","What We've Learned Updated: As per the logs shared by the customer, they are running a Windows Job group job to generate reports for Local Administrators. The following error is observed in logs:

The specified path, file name, or both are too long. The fully qualified file name must be less than 260 characters, and the directory name must be less than 248 characters."" while generating report""    Local Administrators 

The customer has been asked to check the Report Name/Title and Path of report's storage if they exceed character limit.","","","","005Qk00000214EvIAI","2025-04-28T00:29:34.000Z"
"0D5Qk00000cqpqCKAQ","500Qk00000ORN7aIAH","TextPost","005Qk00000214EvIAI","2025-04-28T06:47:47.000Z","Invitation updated. Attendees: No attendees listed","","","","005Qk00000214EvIAI","2025-04-28T06:47:47.000Z"
"0D5Qk00000cqpqDKAQ","500Qk00000ORN7aIAH","TextPost","005Qk00000214EvIAI","2025-04-28T06:47:48.000Z","Invitation updated. Attendees: Saqib Sharif","","","","005Qk00000214EvIAI","2025-04-28T06:47:48.000Z"
"0D5Qk00000cqpqEKAQ","500Qk00000ORN7aIAH","TextPost","005Qk00000214EvIAI","2025-04-28T06:47:48.000Z","Invitation updated. Attendees: Saqib Sharif, Mahima Bopche","","","","005Qk00000214EvIAI","2025-04-28T06:47:48.000Z"
"0D5Qk00000cucGNKAY","500Qk00000ORN7aIAH","TextPost","005Qk00000214EvIAI","2025-04-29T07:13:05.000Z","Next Steps Updated: I will follow up the customer on Friday.","","","","005Qk00000214EvIAI","2025-04-29T07:13:05.000Z"
"0D5Qk00000cucGMKAY","500Qk00000ORN7aIAH","TextPost","005Qk00000214EvIAI","2025-04-29T07:13:05.000Z","What We've Learned Updated: As per the logs shared by the customer, they are running a Windows Job group job to generate reports for Local Administrators. The following error is observed in logs:

The specified path, file name, or both are too long. The fully qualified file name must be less than 260 characters, and the directory name must be less than 248 characters."" while generating report""    Local Administrators 

The customer has been asked to check the Report Name/Title and Path of report's storage if they exceed character limit.

29/04/2025 Meeting:
The job itself was nested inside so many job folders/directories.
When we moved the job two directories above in the hierarchy and ran it, the reports were generated fine, and no error was observed.","","","","005Qk00000214EvIAI","2025-04-29T07:13:05.000Z"
