"Id","ParentId","Type","CreatedById","CreatedDate","Body","Title","LinkUrl","RelatedRecordId","InsertedById","LastModifiedDate"
"0D5Qk00000Z08zuKAB","500Qk00000MoBZxIAN","TextPost","0054u000008ARZjAAO","2025-03-11T16:57:45.000Z","Description: We're seeing failed logins from the server hosting Netwrix Enterprise Auditor in our SIEM and that's the only thing this server is running. Seems like they started yesterday when I was on the server doing some things in Netwrix Enterprise Auditor but I can't figure out what might be causing it. Was wondering if there is anything we can check in the logs in NEA that might explain what is happening. 

The logins are showing as my ID and any jobs in NEA should be running with a service account and not my account. I did try changing a setting on a reporting feature yesterday and I have changed it back but the logins are still occurring.","","","","0054u000008ARZjAAO","2025-03-11T16:57:45.000Z"
"0D5Qk00000Z0fz3KAB","500Qk00000MoBZxIAN","TextPost","0054u000007osjSAAQ","2025-03-11T18:09:49.000Z","Invitation updated. Attendees: Frantz Baptiste","","","","0054u000007osjSAAQ","2025-03-11T18:09:49.000Z"
"0D5Qk00000Z0fz2KAB","500Qk00000MoBZxIAN","TextPost","0054u000007osjSAAQ","2025-03-11T18:09:49.000Z","Invitation updated. Attendees: No attendees listed","","","","0054u000007osjSAAQ","2025-03-11T18:09:49.000Z"
"0D5Qk00000Z0fz4KAB","500Qk00000MoBZxIAN","TextPost","0054u000007osjSAAQ","2025-03-11T18:09:50.000Z","Invitation updated. Attendees: Frantz Baptiste, William Dammeier","","","","0054u000007osjSAAQ","2025-03-11T18:09:50.000Z"
"0D5Qk00000Z0drSKAR","500Qk00000MoBZxIAN","TextPost","0054u000006gpoAAAQ","2025-03-11T18:20:01.000Z","<p>try to time a job run with when the alert happens.</p><p>Should be able to track it back to the job profile.</p><p> </p>","","","","0054u000006gpoAAAQ","2025-03-11T18:20:01.000Z"
"0D5Qk00000ZDvSbKAL","500Qk00000MoBZxIAN","TextPost","0054u000007osjSAAQ","2025-03-14T23:21:37.000Z","What We've Learned Updated: The customer is receiving a failed login alert for his account in his SIEM, and the alert is from the NEA server.","","","","0054u000007osjSAAQ","2025-03-14T23:21:37.000Z"
