"Id","ParentId","CommentBody","CreatedById","CreatedDate","LastModifiedDate","IsPublished","IsDeleted"
"00aQk0000086bbNIAQ","500Qk00000DNjTDIA1","In today's meeting, we talked about the upgrade.
We make a copy of the job folder and the web config file
We took some screenshots of the current settings.
The customer could not download the software under My-Products; there was no product to download.
I provide a direct link to download the application
In the next meeting, we will uninstall the StealthAUDIT 11.0 version and install the 11.6 version.
We will also update AIC and Activity Monitor to the latest version.","0054u000007osjSAAQ","2024-07-23T18:19:07.000Z","2024-07-23T18:19:07.000Z","false","false"
"00aQk000008dadJIAQ","500Qk00000DNjTDIA1","In today's meeting, we resolved the issue with the Published Report by adding the customer's account as an administrator to the Access.
We discovered that the FS_BrokenInheritance job has not been run since the last meeting. It is scheduled to run on the 24th of this month.","0054u000007osjSAAQ","2024-08-20T18:00:44.000Z","2024-08-20T18:00:44.000Z","false","false"
"00aQk000008tBuHIAU","500Qk00000DNjTDIA1","I upgraded the customer from the StealthAUDIT 11.0 version to the 11.6 version.
I also upgraded the AIC and the Activity Monitor to the latest version.","0054u000007osjSAAQ","2024-09-03T17:45:46.000Z","2024-09-03T17:45:46.000Z","false","false"
