"Id","CaseNumber","Ticket_Record_Type_Name__c","Subject","Description","DevOps_Steps_to_Reproduce__c","What_We_Know__c","Next_Steps__c","Solution_Comment__c","Issue_Type__c","Ticket_Owner_Name__c","Ticket_Type__c","Platform__c","Collector_Code__c","Feature__c","Product_Version__c","Build_Number__c","Age__c","Status","Account_Name__c","Contact_Name__c","CreatedDate","ClosedDate"
"500Qk00000E7X0oIAF","00417406","Support Ticket","Upgrade to 11.6","I would like to schedule a time to update to the latest version. This would be for the Ent Auditor and Activity Monitor
I need to schedule a change request so I would like to get a time for next week. Also our jobs run over the weekend (Thursday - Sunday) so I would like to do this Monday or Tuesday.","","","","**Upgraded**
Netwrix Enterprise Auditor v11.6.0.88
Netwrix AIC v11.6.0.21
Netwrix FSAA Proxy v11.6.0.28
Netwrix Activity Monitor (and agents) v7.1.151","Proactive Upgrade","Tay Caliguiri","","Netwrix Enterprise Auditor","StealthAUDIT General","Upgrade","11.5","","6.1","Closed - Resolved","KPMG Management Services LP","Jason Skidmore","2024-08-07T13:27:44.000Z","2024-08-13T15:57:09.000Z"
