"Id","ParentId","Type","CreatedById","CreatedDate","Body","Title","LinkUrl","RelatedRecordId","InsertedById","LastModifiedDate"
"0D5Qk00000VqKdnKAF","500Qk00000LIEhyIAH","TextPost","0054u000006goF5AAI","2025-01-30T23:47:12.000Z","Description: Discovered during session, current version 11.5.0.203.","","","","0054u000006goF5AAI","2025-01-30T23:47:12.000Z"
"0D5Qk00000VsFtvKAF","500Qk00000LIEhyIAH","TextPost","0054u000007osjSAAQ","2025-01-31T14:22:53.000Z","Invitation updated. Attendees: No attendees listed","","","","0054u000007osjSAAQ","2025-01-31T14:22:53.000Z"
"0D5Qk00000VsFtwKAF","500Qk00000LIEhyIAH","TextPost","0054u000007osjSAAQ","2025-01-31T14:22:54.000Z","Invitation updated. Attendees: Frantz Baptiste","","","","0054u000007osjSAAQ","2025-01-31T14:22:54.000Z"
"0D5Qk00000VsFtxKAF","500Qk00000LIEhyIAH","TextPost","0054u000007osjSAAQ","2025-01-31T14:22:54.000Z","Invitation updated. Attendees: Frantz Baptiste, Brian Hom","","","","0054u000007osjSAAQ","2025-01-31T14:22:54.000Z"
"0D5Qk00000aEQywKAG","500Qk00000LIEhyIAH","TextPost","0054u000007osjSAAQ","2025-03-24T18:16:39.000Z","What We've Learned Updated: The customer needs assistance to upgrade to the latest version of the NEA.","","","","0054u000007osjSAAQ","2025-03-24T18:16:39.000Z"
"0D5Qk00000aEPdDKAW","500Qk00000LIEhyIAH","TextPost","0054u000007osjSAAQ","2025-03-24T18:17:37.000Z","Next Steps Updated: I will follow up with the customer to ensure there are no post-upgrade issues.","","","","0054u000007osjSAAQ","2025-03-24T18:17:37.000Z"
