"Id","CaseNumber","Ticket_Record_Type_Name__c","Subject","Description","DevOps_Steps_to_Reproduce__c","What_We_Know__c","Next_Steps__c","Solution_Comment__c","Issue_Type__c","Ticket_Owner_Name__c","Ticket_Type__c","Platform__c","Collector_Code__c","Feature__c","Product_Version__c","Build_Number__c","Age__c","Status","Account_Name__c","Contact_Name__c","CreatedDate","ClosedDate"
"500Qk00000HKTaUIAX","00424673","Support Ticket","Upgrading to the latest version Netwrix Enterprise Auditor","Hello, 
I would like to upgrade the version of Netwrix Enterprise Auditor,  Netwrix Access Information Center, Netwrix Active Monitor, Netwrix Sensitive Data Discovery to the latest version. 

Thank you,
Bao Luu.","","Assistance needed for NEA/AIC patching","Awaiting next job runs to ID any issues.","Upgraded the current version of Stealth application(s) running in the Environment:

FROM:
Netwrix Enterprise Auditor (NEA)              11.6.0.69
NEA Access Information (AIC)                  11.6.0.12
NEA Sensitive Data (SDD)                         11.6.0.11

TO:
Netwrix Enterprise Auditor (NEA)              11.6.0.117
NEA Access Information (AIC)                  11.6.0.25
NEA Sensitive Data (SDD)                         11.6.0.13

Netwrix Enterprise Auditor vl1.6 > Installation > Installation & Configuration Overview > Enterprise Auditor Console Upgrade
https://helpcenter.netwrix.com/bundle/EnterpriseAuditor_11.6/page/Content/EnterpriseAuditor/Install/Application/Upgrade/Overview.htm

Netwrix Access Information Center 11.6 > Installation Overview > Upgrade Procedure https://helpcenter.netwrix.com/bundle/AIC_11.6/page/Content/Access/InformationCenter/Installation/Upgrade.htm

We added a Weekly Schedule tasks for the AD Activity job other than on Thursday when it will run in concession with the Overall AD job group.","Guidance","Dusty Grayson","","Netwrix Enterprise Auditor","StealthAUDIT General","Upgrade","11.6","117","16.3","Closed - Resolved","Exeter Finance LLC","Bao Luu","2024-10-22T13:26:23.000Z","2024-11-07T21:32:10.000Z"
