"Id","ParentId","CommentBody","CreatedById","CreatedDate","LastModifiedDate","IsPublished","IsDeleted"
"00aQk0000086DArIAM","500Qk00000DOAJpIAP","Sounds like the config file is missing the piece for the AIC or its misconfigured.
Check both AIC and reports config files.","0054u000006gpoAAAQ","2024-07-23T14:33:55.000Z","2024-07-23T14:33:55.000Z","false","false"
"00aQk0000086u7lIAA","500Qk00000DOAJpIAP","We reviewed the config file in today's meeting and noticed it was corrupted.
We uninstalled AIC and installed the newest version of the Access Information Center.
After reinstalling the AIC, the customer was able to load it through the access tab from the Report page.","0054u000007osjSAAQ","2024-07-23T21:36:54.000Z","2024-07-23T21:36:54.000Z","false","false"
