"Id","CaseNumber","Ticket_Record_Type_Name__c","Subject","Description","DevOps_Steps_to_Reproduce__c","What_We_Know__c","Next_Steps__c","Solution_Comment__c","Issue_Type__c","Ticket_Owner_Name__c","Ticket_Type__c","Platform__c","Collector_Code__c","Feature__c","Product_Version__c","Build_Number__c","Age__c","Status","Account_Name__c","Contact_Name__c","CreatedDate","ClosedDate"
"500Qk00000Czqu2IAB","00414883","Support Ticket","Patch NEA 11.6.0.69 to latest build","Patch to the latest build of 11.6 that corrects issues with the FS SEEK SCAN for Differential scans to function correctly","Reduced the Scan depth and enabled the needed OCR","Patched to later build of NEA, AIC,SDD","Open new case for the FS SEEK scan time outs.","Symptom:
File System Sensitive Data (SDD)   aka (SEEK) scans are not completing with the needed Differential enabled. 

Cause:
Bug in the application.

Resolution:
Patch to a build containing the noted correction.","Guidance","Dusty Grayson","","Netwrix Enterprise Auditor","StealthAUDIT General","Upgrade","11.6","69","104.2","Closed - Resolved","Northern Bank & Trust Company","Donald Fortini","2024-07-12T14:33:41.000Z","2024-10-24T19:38:58.000Z"
