"Id","ParentId","Type","CreatedById","CreatedDate","Body","Title","LinkUrl","RelatedRecordId","InsertedById","LastModifiedDate"
"0D5Qk00000YOuPbKAL","500Qk00000MbKj8IAF","TextPost","00570000003KXurAAG","2025-03-05T20:54:49.000Z","Description: Will need to patch from: 
Netwrix Enterprise Auditor (NEA)             11.6.0.43
NEA Access Information (AIC)                  11.6.0.6  

To the latest for both applications.","","","","00570000003KXurAAG","2025-03-05T20:54:49.000Z"
"0D5Qk00000YP3cSKAT","500Qk00000MbKj8IAF","TextPost","00570000003KXurAAG","2025-03-05T20:56:23.000Z","Invitation updated. Attendees: No attendees listed","","","","00570000003KXurAAG","2025-03-05T20:56:23.000Z"
"0D5Qk00000YP3cTKAT","500Qk00000MbKj8IAF","TextPost","00570000003KXurAAG","2025-03-05T20:56:23.000Z","Invitation updated. Attendees: Dusty Grayson","","","","00570000003KXurAAG","2025-03-05T20:56:23.000Z"
"0D5Qk00000YP3cUKAT","500Qk00000MbKj8IAF","TextPost","00570000003KXurAAG","2025-03-05T20:56:23.000Z","Invitation updated. Attendees: Dusty Grayson, Jim Callison","","","","00570000003KXurAAG","2025-03-05T20:56:23.000Z"
"0D5Qk00000Z19cAKAR","500Qk00000MbKj8IAF","TextPost","00570000003KXurAAG","2025-03-11T20:57:05.000Z","Next Steps Updated: Awaiting Meeting","","","","00570000003KXurAAG","2025-03-11T20:57:05.000Z"
"0D5Qk00000Z1QXPKA3","500Qk00000MbKj8IAF","TextPost","00570000003KXurAAG","2025-03-11T20:58:03.000Z","What We've Learned Updated: Will be referancing the following.

Netwrix Enterprise Auditor v11.6 > Installation Installation & Configuration Overview > Enterprise Auditor Console Upgrade
https://helpcenter.netwrix.com/bundle/EnterpriseAuditor_11.6/page/Content/EnterpriseAuditor/Install/Application/Upgrade/Overview.htm 

Netwrix Access Information Center 11.6 > Installation Overview > Upgrade Procedure
https://helpcenter.netwrix.com/bundle/AIC_11.6/page/Content/Access/InformationCenter/Installation/Upgrade.htm","","","","00570000003KXurAAG","2025-03-11T20:58:03.000Z"
"0D5Qk00000Z5J5PKAV","500Qk00000MbKj8IAF","TextPost","00570000003KXurAAG","2025-03-12T20:29:12.000Z","Steps to Reproduce Updated: Reproduce Not needed this is an upgrade case.","","","","00570000003KXurAAG","2025-03-12T20:29:12.000Z"
