"Id","ParentId","Type","CreatedById","CreatedDate","Body","Title","LinkUrl","RelatedRecordId","InsertedById","LastModifiedDate"
"0D5Qk00000VQ0EeKAL","500Qk00000L0CN0IAN","TextPost","00570000003KXurAAG","2025-01-23T21:57:51.000Z","Description: Netwrix Enterprise Auditor (NEA) 11.6.0.79
Netwrix Activity Monitor (NAM)   7.0.3153","","","","00570000003KXurAAG","2025-01-23T21:57:51.000Z"
"0D5Qk00000VQEFkKAP","500Qk00000L0CN0IAN","TextPost","00570000003KXurAAG","2025-01-23T21:58:55.000Z","Invitation updated. Attendees: Dusty Grayson","","","","00570000003KXurAAG","2025-01-23T21:58:55.000Z"
"0D5Qk00000VQEFlKAP","500Qk00000L0CN0IAN","TextPost","00570000003KXurAAG","2025-01-23T21:58:55.000Z","Invitation updated. Attendees: Dusty Grayson, ian rojo","","","","00570000003KXurAAG","2025-01-23T21:58:55.000Z"
"0D5Qk00000VQEFjKAP","500Qk00000L0CN0IAN","TextPost","00570000003KXurAAG","2025-01-23T21:58:55.000Z","Invitation updated. Attendees: No attendees listed","","","","00570000003KXurAAG","2025-01-23T21:58:55.000Z"
