"Id","CaseNumber","Ticket_Record_Type_Name__c","Subject","Description","DevOps_Steps_to_Reproduce__c","What_We_Know__c","Next_Steps__c","Solution_Comment__c","Issue_Type__c","Ticket_Owner_Name__c","Ticket_Type__c","Platform__c","Collector_Code__c","Feature__c","Product_Version__c","Build_Number__c","Age__c","Status","Account_Name__c","Contact_Name__c","CreatedDate","ClosedDate"
"500Qk00000FjJCMIA3","00420979","Support Ticket","Upgrade sb_11.5 to nea_11.6","upgrade prod. suite from 11.5 to 11.6 (all)","","","","Issue
client wanted to upgrade NEA to latest version



Resolution
had preflight meeting where we gather pre-upgrade configurations and logs
upgrade meeting where we upgraded NEA

upgraded NAM in a following meeting
-will be on it's own ticket","Proactive Upgrade","Joshua Sexton","","Netwrix Enterprise Auditor","StealthAUDIT General","Upgrade","11.6","","24.1","Closed - Resolved","Daimler Trucks North America LLC","john anunsen","2024-09-13T14:33:40.000Z","2024-10-07T17:53:23.000Z"
