"Id","CaseNumber","Ticket_Record_Type_Name__c","Subject","Description","DevOps_Steps_to_Reproduce__c","What_We_Know__c","Next_Steps__c","Solution_Comment__c","Issue_Type__c","Ticket_Owner_Name__c","Ticket_Type__c","Platform__c","Collector_Code__c","Feature__c","Product_Version__c","Build_Number__c","Age__c","Status","Account_Name__c","Contact_Name__c","CreatedDate","ClosedDate"
"500Qk00000PAvt3IAD","00445159","Support Ticket","Upgrade Access Analyzer to the latest version","Upgrade Access Analyzer from version 11.6.0.76 to the latest version.","NA - upgrade request","Customer would like to upgrade from version 11.6.0.76 to latest version of 12.0","Awaiting pre-flight meeting","Symptom
Proactive upgrade of Access analyzer from version 11.6.0.76 to version 12.0..0.1080


Resolution
Upgraded Netwrix Access Analyzer to version 12.0.0.1080.
Upgraded Access Information Center to version 12.0.0.51.
Tested functionality and migrated schemas to new version.","Proactive Upgrade","Ian Ranstrom","Request","Netwrix Enterprise Auditor","StealthAUDIT General","Upgrade","11.6","11.6.0.76","7.9","Closed - Resolved","Jones Family Office","Carmichael Ragbir","2025-05-14T20:17:21.000Z","2025-05-22T17:52:19.000Z"
