"Id","CaseNumber","Ticket_Record_Type_Name__c","Subject","Description","DevOps_Steps_to_Reproduce__c","What_We_Know__c","Next_Steps__c","Solution_Comment__c","Issue_Type__c","Ticket_Owner_Name__c","Ticket_Type__c","Platform__c","Collector_Code__c","Feature__c","Product_Version__c","Build_Number__c","Age__c","Status","Account_Name__c","Contact_Name__c","CreatedDate","ClosedDate"
"500Qk00000GMZVlIAP","00422379","Support Ticket","Request Health Check and Upgrade","Did working session with Sales Engineer and he suggested an upgrade be performed. StealthAudit is working but has minor reporting issues.","","","","Problem
Customer requested proactive upgrade.

Cause
Customer requested upgrade of NEA, AIC and sensitive data module.

Resolution
Upgrade completes successfully","Proactive Upgrade","Ian Ranstrom","","Netwrix Enterprise Auditor","StealthAUDIT General","Upgrade","11.5","","12.9","Closed - Resolved","Saginaw Chippewa Indian Tribe","Amy Gates","2024-09-27T19:34:39.000Z","2024-10-10T17:54:31.000Z"
