"Id","ParentId","Type","CreatedById","CreatedDate","Body","Title","LinkUrl","RelatedRecordId","InsertedById","LastModifiedDate"
"0D5Qk00000bIhvpKAC","500Qk00000NmB3xIAF","TextPost","0054u000008ARZjAAO","2025-04-07T14:12:33.000Z","Description: Putting this request in to implement a pre-flight for upgrading our Auditor platforms in DEV and PROD to version 12,0. (Pre-Flight)","","","","0054u000008ARZjAAO","2025-04-07T14:12:33.000Z"
"0D5Qk00000bJ1oBKAS","500Qk00000NmB3xIAF","TextPost","0054u000007osjSAAQ","2025-04-07T16:02:46.000Z","Invitation updated. Attendees: No attendees listed","","","","0054u000007osjSAAQ","2025-04-07T16:02:46.000Z"
"0D5Qk00000bJ1oDKAS","500Qk00000NmB3xIAF","TextPost","0054u000007osjSAAQ","2025-04-07T16:02:47.000Z","Invitation updated. Attendees: Frantz Baptiste, Eugene Johnson","","","","0054u000007osjSAAQ","2025-04-07T16:02:47.000Z"
"0D5Qk00000bJ1oCKAS","500Qk00000NmB3xIAF","TextPost","0054u000007osjSAAQ","2025-04-07T16:02:47.000Z","Invitation updated. Attendees: Frantz Baptiste","","","","0054u000007osjSAAQ","2025-04-07T16:02:47.000Z"
"0D5Qk00000bplVMKAY","500Qk00000NmB3xIAF","TextPost","0050g000006QqyEAAS","2025-04-14T17:13:40.000Z","Description Updated: Upgrade NAA To 12.0 in the lower dev environment. 
Upgrade to prod will be handled on a separate after operation is confirmed in Dev.
-----------------------------
Putting this request in to implement a pre-flight for upgrading our Auditor platforms in DEV and PROD to version 12,0. (Pre-Flight)","","","","0050g000006QqyEAAS","2025-04-14T17:13:40.000Z"
