"Id","CaseNumber","Ticket_Record_Type_Name__c","Subject","Description","DevOps_Steps_to_Reproduce__c","What_We_Know__c","Next_Steps__c","Solution_Comment__c","Issue_Type__c","Ticket_Owner_Name__c","Ticket_Type__c","Platform__c","Collector_Code__c","Feature__c","Product_Version__c","Build_Number__c","Age__c","Status","Account_Name__c","Contact_Name__c","CreatedDate","ClosedDate"
"500Qk00000LKmR0IAL","00434354","Support Ticket","NEA CU Upgrade","I advised the customer to upgrade NEA to the latest version because the SharePoint Permission scan takes over 15 days and is aborted before completion. The scan used to take between 3 to 5 days to complete.","","The customer is having a performance issue on SharePoint.
It takes over 15 days to scan SPAA (Permission scan)
The customer is on the 11.6.0.11 version
I advise the customer to upgrade to the latest version.","Upgrade to the latest version","We upgraded NEA to the latest version
We upgraded AIC to the newest version
We upgraded Sensitive Data Add-On to the latest version
We upgraded Activity Monitor to the latest version
We upgraded the Proxy to the latest version","Proactive Upgrade","Frantz Baptiste","Performance","Netwrix Enterprise Auditor","StealthAUDIT General","Upgrade","11.6","11.6.0.132","13.0","Closed - Resolved","Point32Health Services, Inc.","Peter Sterianos","2025-01-31T22:02:43.000Z","2025-02-13T21:40:39.000Z"
