"Id","CaseNumber","Ticket_Record_Type_Name__c","Subject","Description","DevOps_Steps_to_Reproduce__c","What_We_Know__c","Next_Steps__c","Solution_Comment__c","Issue_Type__c","Ticket_Owner_Name__c","Ticket_Type__c","Platform__c","Collector_Code__c","Feature__c","Product_Version__c","Build_Number__c","Age__c","Status","Account_Name__c","Contact_Name__c","CreatedDate","ClosedDate"
"500Qk00000N2SEIIA3","00439078","Support Ticket","Clicking ""Deploy"" is not working","We are receiving reports from numerous end users that when they click on ""Deploy"" for new flash drives, nothing happens. We also noticed that some workstations we were actually able to troubleshoot are showing a last check-in time that does not match with what the admin console is reporting.","","Epp client is not communicating with the server.
Logs show timeout cURL error 28.
Unable to ping the IP 160.87.0.221 mentioned by the customer.

We have whitelisted the 160.87.0.221 address on AWS, the clients are now communicating with the server.

There is still an issue with opening the EL app from the File Explorer, we asked on the solution-engineers teams chat and asked the customer to collect diagnostics from the computer this error reproduces.","CHecking with devop regarding the 160.87.0.221 ip from the customer.

We are waiting for the customer to collect the log files, and for our engineers to get an answer on the teams chat.","Our AWS security features have blocked the IP used by a large number of computers and we have to whitelist the entire 160.87.0.0/24 range. After this change, the computers started to communicate with the EPP server, and the deployment of EasyLock is working.","","Iosif Muntean","Unexpected Behavior","Netwrix Endpoint Protector","EasyLock / Enforced Ecryption","EasyLock - Other","","","21.4","Closed - Resolved","UCI Health","Raymond Huisar","2025-03-18T00:01:33.000Z","2025-04-08T10:15:36.000Z"
