"Id","CaseNumber","Ticket_Record_Type_Name__c","Subject","Description","DevOps_Steps_to_Reproduce__c","What_We_Know__c","Next_Steps__c","Solution_Comment__c","Issue_Type__c","Ticket_Owner_Name__c","Ticket_Type__c","Platform__c","Collector_Code__c","Feature__c","Product_Version__c","Build_Number__c","Age__c","Status","Account_Name__c","Contact_Name__c","CreatedDate","ClosedDate"
"500Qk00000CNNEjIAP","00413243","Support Ticket","EPP client hotfix v6.2.2.2005 for Security Advisory – ADV-2024-002","Hello,

We received an email with notification about EPP vulnerability and successfully shared the offline patch with the customer.
But how we understand, customer also should update the EPP client version to 6.2.2.2005.
Currently we cannot find this EPP client version.
Can you please share it answering this email?","","","","Customer confirmed this can be closed.","","Andrei Pop","","Netwrix Endpoint Protector","Server","Server Security Vulnerability","NONE","","33.9","Closed - Resolved","CoreWin Distributor","Danylo Didenko","2024-06-27T13:30:07.000Z","2024-07-31T11:52:37.000Z"
