"Id","CaseNumber","Ticket_Record_Type_Name__c","Subject","Description","DevOps_Steps_to_Reproduce__c","What_We_Know__c","Next_Steps__c","Solution_Comment__c","Issue_Type__c","Ticket_Owner_Name__c","Ticket_Type__c","Platform__c","Collector_Code__c","Feature__c","Product_Version__c","Build_Number__c","Age__c","Status","Account_Name__c","Contact_Name__c","CreatedDate","ClosedDate"
"500Qk00000GjL41IAF","00423132","Support Ticket","Customer found vulnerabilities in the EPP test server using AWS Security Hub","Hello,

Customer name is PrivatBank.
Customer reported that they found many vulnerabilities in the EPP test server using AWS Security Hub.
All security patches were installed in the Live Update.
Attaching vulnerability list.","","solved with the backend procedure 60","close the case","backend proc 60","","Daniel Anton","","Netwrix Endpoint Protector","Server","Server Security Vulnerability","","","120.7","Closed - Resolved","Privat Bank","Danylo Didenko","2024-10-07T15:18:31.000Z","2025-02-05T07:30:15.000Z"
