"Id","ParentId","Type","CreatedById","CreatedDate","Body","Title","LinkUrl","RelatedRecordId","InsertedById","LastModifiedDate"
"0D5Qk00000dUtIMKA0","500Qk00000OrNALIA3","TextPost","0054u000008ARZjAAO","2025-05-06T18:57:20.000Z","Description: We are currently on server version 5.9.4.1, and the most updated Windows Client we can download is 6.2.4.1, but only the x32 and x64 versions.

Are these clients fully functional and supported on Windows 10 and 11 systems running on ARM procssors?

We don't have any currently so I can't test, but we have groups asking to purchase them and I want to make sure our security software is supported on them before giving the okay.","","","","0054u000008ARZjAAO","2025-05-06T18:57:20.000Z"
"0D5Qk00000dUwEmKAK","500Qk00000OrNALIA3","TextPost","005Qk000001nViKIAU","2025-05-06T19:17:57.000Z","What We've Learned Updated: Checked with Eduard, not supported.","","","","005Qk000001nViKIAU","2025-05-06T19:17:57.000Z"
"0D5Qk00000dVBCNKA4","500Qk00000OrNALIA3","TextPost","005Qk000001nViKIAU","2025-05-06T20:57:34.000Z","Next Steps Updated: Asked if there are any future plans to support ARM processors in Eng Chat.","","","","005Qk000001nViKIAU","2025-05-06T20:57:34.000Z"
"0D5Qk00000dXrVuKAK","500Qk00000OrNALIA3","TextPost","005Qk000001nViKIAU","2025-05-07T15:22:37.000Z","Next Steps Updated: Waiting on customer.
---
Asked if there are any future plans to support ARM processors in Eng Chat.","","","","005Qk000001nViKIAU","2025-05-07T15:22:37.000Z"
"0D5Qk00000dXd9fKAC","500Qk00000OrNALIA3","TextPost","005Qk000001nViKIAU","2025-05-07T15:22:52.000Z","What We've Learned Updated: Informed customer that we have plans to implement this compatibility in the EPP clients in the future. This is currently spiked and will be available in a future release, but not in 5.9.4.3.
---
Checked with Eduard, not supported.","","","","005Qk000001nViKIAU","2025-05-07T15:22:52.000Z"
