"Id","CaseNumber","Ticket_Record_Type_Name__c","Subject","Description","DevOps_Steps_to_Reproduce__c","What_We_Know__c","Next_Steps__c","Solution_Comment__c","Issue_Type__c","Ticket_Owner_Name__c","Ticket_Type__c","Platform__c","Collector_Code__c","Feature__c","Product_Version__c","Build_Number__c","Age__c","Status","Account_Name__c","Contact_Name__c","CreatedDate","ClosedDate"
"500Qk00000O6q9RIAR","00442233","Support Ticket","Error while accessing some of the websites.","We have not blocked the following urls on Netwrix but are getting errors while accessing the application via terminal(curl). We have an issue like this with many urls including some of the google documents hence need to fix at the earliest. 
<a href='https://plugins-artifacts.gradle.org' target='_blank'>https://plugins-artifacts.gradle.org</a>
<a href='https://services.gradle.org/' target='_blank'>https://services.gradle.org/</a>","","Customer encounter an error while accessing some URLs when EPP client is enabled. 

Multiple URLs are not accessible, and we haven’t blocked them on EPP.
They are using Client Version 3.0.4.1006, MAC.","17-04 We have requested additional details regarding the issue that they are encountering .

18-04 Customer returned that the issue persist with the options enabled, so we recommend to disabled them.
22-04 They returned that after disabling the DPI bypass options the issue disappeared.
We have assist them with their questions regarding certificates and default templates for CAP policies,","solved","Caching/Indexing Issue","Daniel Anton","Error","Netwrix Endpoint Protector","Client","EPP Client - Other","","","13.9","Closed - Resolved","WTEX Fintech Private Limited (KreditPe)","Sujith Nair","2025-04-16T07:53:12.000Z","2025-04-30T06:40:26.000Z"
