"Id","CaseNumber","Ticket_Record_Type_Name__c","Subject","Description","DevOps_Steps_to_Reproduce__c","What_We_Know__c","Next_Steps__c","Solution_Comment__c","Issue_Type__c","Ticket_Owner_Name__c","Ticket_Type__c","Platform__c","Collector_Code__c","Feature__c","Product_Version__c","Build_Number__c","Age__c","Status","Account_Name__c","Contact_Name__c","CreatedDate","ClosedDate"
"500Qk00000KlSADIA3","00432678","Support Ticket","Shortcut keys to check client to server connectivity status","Good afternoon

Not so long ago I was advised of a series of shorcut keys that you could press on your keyboard in EPP to check the Client to Server connectivity status. Please can you remind me what the keys are.

Many thanks

Mohamed","","","","The shortcut keys to press on your keyboard in EPP to check the  Client to Server connectivity status is as follows:
For Mac press: command+option+i
For Windows press: ctlr+alt+i","","Ramon Torres","Question","Netwrix Endpoint Protector","Client","EPP Client - Other","","","0.0","Closed - Resolved","Preston City Council","Mohamed Karolia","2025-01-17T14:40:49.000Z","2025-01-17T15:28:26.000Z"
