"Id","ParentId","Type","CreatedById","CreatedDate","Body","Title","LinkUrl","RelatedRecordId","InsertedById","LastModifiedDate"
"0D5Qk00000YP3wCKAT","500Qk00000MbRmCIAV","TextPost","0054u000008ARZjAAO","2025-03-05T21:36:33.000Z","Description: We’ve found two hidden shares on different Nasuni filers we’re unable to audit via FSAA / SDD.  We found only because audit info was requested specifically for these to share.  The auditing tasks are tied to requests and are important to us.  I’ve harvested logs and related info from one filer and attached to this message.  Let me know if there’s additional info you may need to get this troubleshot or working.","","","","0054u000008ARZjAAO","2025-03-05T21:36:33.000Z"
"0D5Qk00000YPgljKAD","500Qk00000MbRmCIAV","TextPost","005Qk00000214EvIAI","2025-03-06T00:14:45.000Z","What We've Learned Updated: US Customer. Assigning ticket to Dusty Grayson as per technical support notes.","","","","005Qk00000214EvIAI","2025-03-06T00:14:45.000Z"
"0D5Qk00000YPheUKAT","500Qk00000MbRmCIAV","TextPost","005Qk00000214EvIAI","2025-03-06T00:15:00.000Z","<p>SLA was breached before I joined my shift</p>","","","","005Qk00000214EvIAI","2025-03-06T00:15:00.000Z"
"0D5Qk00000YPRDZKA5","500Qk00000MbRmCIAV","TextPost","0054u000006gpoAAAQ","2025-03-06T00:18:14.000Z","<p>I think we will need to verify that they have any options in the query that may be hiding those shares.</p><p> </p><p></p>","","","","0054u000006gpoAAAQ","2025-03-06T00:18:14.000Z"
"0D5Qk00000YRPBeKAP","500Qk00000MbRmCIAV","TextPost","00570000003KXurAAG","2025-03-06T13:42:06.000Z","<p>Netwrix StealthAUDIT v11.5 &gt; Target Environment Configuration &gt; <b>Nasuni Edge Appliance Configuration</b> </p><p> <a href=""https://helpcenter.netwrix.com/bundle/StealthAUDIT_11.5/page/Content/Configuration/Nasuni_Config/Nasuni_Edge_Appliance_Config_Overview.htm"" alt=""https://helpcenter.netwrix.com/bundle/StealthAUDIT_11.5/page/Content/Configuration/Nasuni_Config/Nasuni_Edge_Appliance_Config_Overview.htm"" target=""_blank"">https://helpcenter.netwrix.com/bundle/StealthAUDIT_11.5/page/Content/Configuration/Nasuni_Config/Nasuni_Edge_Appliance_Config_Overview.htm</a> </p><p> </p><p>Netwrix StealthAUDIT v11.5 &gt; Target Environment Configuration &gt; Nasuni Edge Appliance Configuration &gt; <b>Nasuni Edge Appliance Configuration for Access Auditing</b></p><p> <a href=""https://helpcenter.netwrix.com/bundle/StealthAUDIT_11.5/page/Content/Configuration/Nasuni_Config/Nasuni_Edge_Appliance_Config_Access_Audit.htm"" alt=""https://helpcenter.netwrix.com/bundle/StealthAUDIT_11.5/page/Content/Configuration/Nasuni_Config/Nasuni_Edge_Appliance_Config_Access_Audit.htm"" target=""_blank"">https://helpcenter.netwrix.com/bundle/StealthAUDIT_11.5/page/Content/Configuration/Nasuni_Config/Nasuni_Edge_Appliance_Config_Access_Audit.htm</a> </p><p> </p><p>Netwrix StealthAUDIT v11.5 &gt; Target Environment Configuration &gt; Nasuni Edge Appliance Configuration &gt; <b>StealthAUDIT 0-FS_Nasuni Job</b></p><p> <a href=""https://helpcenter.netwrix.com/bundle/StealthAUDIT_11.5/page/Content/Configuration/Nasuni_Config/StealthAUDIT_0_FS_Nasuni_Job.htm"" alt=""https://helpcenter.netwrix.com/bundle/StealthAUDIT_11.5/page/Content/Configuration/Nasuni_Config/StealthAUDIT_0_FS_Nasuni_Job.htm"" target=""_blank"">https://helpcenter.netwrix.com/bundle/StealthAUDIT_11.5/page/Content/Configuration/Nasuni_Config/StealthAUDIT_0_FS_Nasuni_Job.htm</a> </p><p> </p><p>Netwrix StealthAUDIT v11.5 &gt; Solutions &gt; File System Solution &gt; FileSystem Job Group &gt; 0.Collection Job Group &gt; <b>0-FS_Nasuni Job</b></p><p> <a href=""https://helpcenter.netwrix.com/bundle/StealthAUDIT_11.5/page/Content/StealthAUDIT/Job_Groups/FS_Job_Group/0.Collection/0-FS_Nasuni_Job.htm"" alt=""https://helpcenter.netwrix.com/bundle/StealthAUDIT_11.5/page/Content/StealthAUDIT/Job_Groups/FS_Job_Group/0.Collection/0-FS_Nasuni_Job.htm"" target=""_blank"">https://helpcenter.netwrix.com/bundle/StealthAUDIT_11.5/page/Content/StealthAUDIT/Job_Groups/FS_Job_Group/0.Collection/0-FS_Nasuni_Job.htm</a> </p><p> </p>","","","","00570000003KXurAAG","2025-03-06T13:42:06.000Z"
"0D5Qk00000YSGRGKA5","500Qk00000MbRmCIAV","TextPost","0050g000006QqyEAAS","2025-03-06T16:19:41.000Z","<p>@Dusty Grayson​  Please inquire about what the issue and fix was.</p>","","","","0050g000006QqyEAAS","2025-03-06T16:19:41.000Z"
"0D5Qk00000YWEn9KAH","500Qk00000MbRmCIAV","TextPost","00570000003KXurAAG","2025-03-06T22:47:52.000Z","What We've Learned Updated: Configuration setting on the Nasuni side","","","","00570000003KXurAAG","2025-03-06T22:47:52.000Z"
"0D5Qk00000YWDLyKAP","500Qk00000MbRmCIAV","TextPost","00570000003KXurAAG","2025-03-06T22:48:18.000Z","Next Steps Updated: Closing ticket per Customer correction.","","","","00570000003KXurAAG","2025-03-06T22:48:18.000Z"
