"Id","ParentId","Type","CreatedById","CreatedDate","Body","Title","LinkUrl","RelatedRecordId","InsertedById","LastModifiedDate"
"0D5Qk00000UOyddKAD","500Qk00000KKSr6IAH","TextPost","0054u000008ARZjAAO","2025-01-07T20:14:36.000Z","Description: Within StealthAudit the custom report is completing without error but going into the report details shows no current data/activity.","","","","0054u000008ARZjAAO","2025-01-07T20:14:36.000Z"
"0D5Qk00000UOv1NKAT","500Qk00000KKSr6IAH","TextPost","0054u000007MiY9AAK","2025-01-07T20:27:29.000Z","<p>@Mike Candon​ Not enough information provided. Very unlikely there is a custom report for SAM. We&#39;ll want to review the job in NEA that corresponds to the data they are receiving (an export of the entire job would be helpful since it&#39;s custom) as well as confirmation that SAM is picking up the data (via search).</p>","","","","0054u000007MiY9AAK","2025-01-07T20:27:29.000Z"
"0D5Qk00000USh2kKAD","500Qk00000KKSr6IAH","TextPost","0054u000007MiY9AAK","2025-01-08T17:52:29.000Z","<p>This customer doesn&#39;t appear to be licensed for File System Reports in NEA, just File Activity in NAM. This may be left over from their 2020 demo?</p><p> </p><p>In the FSAC System scan log I see the following errors:</p><p><i>ERROR	TDCThread	TDCThread.LoadSourceItf	&quot;No DC installed to handle source : FILESYSTEMACCESS&quot;	</i></p><p><i>ERROR	TDCThread	TDCThread.PrepareForTask	&quot;The &#39;FILESYSTEMACCESS&#39; data collector has not been installed&quot;	</i></p><p> </p><p>And then confirmed via the Support Portal &quot;My Products Tool&quot;:</p><p><img src=""sfdc://069Qk00000JGucqIAD"" alt=""2025-01-08 12_48_57-Netwrix - Myproductstool Supportwebuser""></img></p>","","","","0054u000007MiY9AAK","2025-01-08T17:52:29.000Z"
"0D5Qk00000UX9VIKA1","500Qk00000KKSr6IAH","TextPost","005Qk00000276ifIAA","2025-01-09T16:29:06.000Z","<p>+++++</p><p>2024_0108/0109 email exchange:</p><p>+++++</p><p>When we have potentially identified a feature or functionality issue, we should have the customer check their licensing for StealthAudit/NEA. </p><p> </p><p>It is also interesting that this Report is left over from a Demo from 2020.</p>","","","","005Qk00000276ifIAA","2025-01-09T16:29:06.000Z"
"0D5Qk00000UkeCZKAZ","500Qk00000KKSr6IAH","TextPost","005Qk00000276ifIAA","2025-01-13T17:17:39.000Z","<p>What We&#39;ve Learned Updated: I should have asked you to open StealthAudit (NEA) and navigate to &quot;Help&quot; &gt; &quot;About&quot; and scroll down to the &quot;File System&quot; Licensed Features:</p><p>&quot;File System&quot;</p><p>&quot;File System Actions&quot;</p><p>&quot;File System Reports&quot;</p><p>+++++</p><p>1) It seems as though you may not be licensed for File System Reports in NEA but only File Activity in NAM. The report may be left over from a 2020 demo that was conducted for you?</p><p>2) In the FSAC System scan log we see the following errors:</p><p> </p><p>&quot;FileSystemGROUP_FileSystemGROUP_0.CollectionJOB_1-FSAC System ScansOUTPUT1-FSAC System Scans_Log&quot;</p><p>+++++</p><p>ERROR TDCThread TDCThread.LoadSourceItf &quot;No DC installed to handle source : FILESYSTEMACCESS&quot;</p><p>ERROR TDCThread TDCThread.PrepareForTask &quot;The &#39;FILESYSTEMACCESS&#39; data collector has not been installed&quot;</p><p>+++++</p><p> </p><p>+++++</p><p>+++++</p><p>2024_0108/0109 email exchange:</p><p>+++++</p><p>When we have potentially identified a feature or functionality issue, we should have the customer check their licensing for StealthAudit/NEA.</p><p>It is also interesting that this Report is left over from a Demo from 2020.</p>","","","","005Qk00000276ifIAA","2025-01-13T17:17:39.000Z"
