"Id","ParentId","Type","CreatedById","CreatedDate","Body","Title","LinkUrl","RelatedRecordId","InsertedById","LastModifiedDate"
"0D5Qk00000Z09c0KAB","500Qk00000MoAxCIAV","TextPost","0054u000008ARZjAAO","2025-03-11T16:25:32.000Z","Description: i would like to generate a report and email it, of changes made to a group, i.e adding and deleting members","","","","0054u000008ARZjAAO","2025-03-11T16:25:32.000Z"
"0D5Qk00000ZDaJzKAL","500Qk00000MoAxCIAV","TextPost","0054u000007osjSAAQ","2025-03-14T21:23:24.000Z","Invitation updated. Attendees: Frantz Baptiste","","","","0054u000007osjSAAQ","2025-03-14T21:23:24.000Z"
"0D5Qk00000ZDaJyKAL","500Qk00000MoAxCIAV","TextPost","0054u000007osjSAAQ","2025-03-14T21:23:24.000Z","Invitation updated. Attendees: No attendees listed","","","","0054u000007osjSAAQ","2025-03-14T21:23:24.000Z"
"0D5Qk00000ZDaK0KAL","500Qk00000MoAxCIAV","TextPost","0054u000007osjSAAQ","2025-03-14T21:23:25.000Z","Invitation updated. Attendees: Frantz Baptiste, ian rojo","","","","0054u000007osjSAAQ","2025-03-14T21:23:25.000Z"
"0D5Qk00000cPpVSKA0","500Qk00000MoAxCIAV","TextPost","0054u000007osjSAAQ","2025-04-22T19:00:45.000Z","What We've Learned Updated: The customer is looking to create a personalized report for their client.","","","","0054u000007osjSAAQ","2025-04-22T19:00:45.000Z"
"0D5Qk00000d2TQzKAM","500Qk00000MoAxCIAV","TextPost","0054u000007osjSAAQ","2025-04-30T21:41:30.000Z","<p>I verified the column name in AD/Attribute Editor to add the additional column.</p><p>I added the Attribute to the ADI custom attribute and ran a full scan.</p><p>I modified the Report by adding an additional column.</p>","","","","0054u000007osjSAAQ","2025-04-30T21:41:30.000Z"
"0D5Qk00000dVF1UKAW","500Qk00000MoAxCIAV","TextPost","0054u000007osjSAAQ","2025-05-06T21:39:08.000Z","<p>The customer said he&#39;s waiting for the client to let him know if the Report is good before we can close the ticket.</p>","","","","0054u000007osjSAAQ","2025-05-06T21:39:08.000Z"
"0D5Qk00000e1clvKAA","500Qk00000MoAxCIAV","TextPost","0054u000007osjSAAQ","2025-05-13T13:28:59.000Z","Next Steps Updated: Close ticket","","","","0054u000007osjSAAQ","2025-05-13T13:28:59.000Z"
"0D5Qk00000e1V3dKAE","500Qk00000MoAxCIAV","TextPost","0054u000007osjSAAQ","2025-05-13T13:35:27.000Z","Steps to Reproduce Updated: Expand the job
Expand Configure
Click on Report
Click on Create","","","","0054u000007osjSAAQ","2025-05-13T13:35:27.000Z"
