"Id","CaseNumber","Ticket_Record_Type_Name__c","Subject","Description","DevOps_Steps_to_Reproduce__c","What_We_Know__c","Next_Steps__c","Solution_Comment__c","Issue_Type__c","Ticket_Owner_Name__c","Ticket_Type__c","Platform__c","Collector_Code__c","Feature__c","Product_Version__c","Build_Number__c","Age__c","Status","Account_Name__c","Contact_Name__c","CreatedDate","ClosedDate"
"500Qk00000NmvGWIAZ","00441214","Support Ticket","Assistance creating custom report","We need assistance creating a custom report to find all files older than 10 years with the file extension .db (Report will need file path, last accessed date, created date, and file size). We are using StealthAUDIT 11.5","NA - Custom report request","----------
04/14/2025
----------
Customer was provided documentation on creating custom jobs but indicated it was not helpful. The customer also indicated they cannot incur any cost that a proserv engagement would require.","Awaiting customer response.","Issue:
Need a custom report that finds all files older than 10 years with the file extension .db.
The report should show the file path, last access date, created date, and file size.


Resolution:
Implementation engineer Devon Anderson was able to create the report needed and provide it.","Guidance","Ian Ranstrom","Question","Netwrix Enterprise Auditor","StealthAUDIT General","Custom Reports","11.5","","10.9","Closed - Resolved","Crestron Electronics","Brian Ashton","2025-04-07T19:00:20.000Z","2025-04-18T16:06:28.000Z"
