"Id","CaseNumber","Ticket_Record_Type_Name__c","Subject","Description","DevOps_Steps_to_Reproduce__c","What_We_Know__c","Next_Steps__c","Solution_Comment__c","Issue_Type__c","Ticket_Owner_Name__c","Ticket_Type__c","Platform__c","Collector_Code__c","Feature__c","Product_Version__c","Build_Number__c","Age__c","Status","Account_Name__c","Contact_Name__c","CreatedDate","ClosedDate"
"500Qk00000DR4CyIAL","00415764","Support Ticket","BSOD with EPP agent 6.2.2.2 - (Windows)","Hello!

One of our customer notice that one computer starts to BSOD after new EPP version deployment. 

Any info from other Customers with this BSOD message? File involved: <a href='https://cssdlp20.sys' target='_blank'>cssdlp20.sys</a>
What are the next steps to understand the cause of this problem?","","","","Update from Customer:

""Hello!
You can close the ticket. Customer told that after last version installation computers working without BSOD.""
""","","Alin Anca","","Netwrix Endpoint Protector","Client","Client - BSOD","NONE","","87.0","Closed - Resolved","Riga International Airport","Martins Kupsis","2024-07-23T14:27:07.000Z","2024-10-18T15:20:48.000Z"
