"Id","CaseNumber","Ticket_Record_Type_Name__c","Subject","Description","DevOps_Steps_to_Reproduce__c","What_We_Know__c","Next_Steps__c","Solution_Comment__c","Issue_Type__c","Ticket_Owner_Name__c","Ticket_Type__c","Platform__c","Collector_Code__c","Feature__c","Product_Version__c","Build_Number__c","Age__c","Status","Account_Name__c","Contact_Name__c","CreatedDate","ClosedDate"
"500Qk00000JAuduIAD","00429092","Support Ticket","Customer not able to access Customer Portal","Christian has signed up to the customer Portal but does not receive the confirmation email allowing him to complete the sign up. He has checked SPAM and nothing appears. Email is : lehr@lehr.at","","Customer is not receiving the confirmation email when trying to access the customer portal.
Checked and the account is activated","Waiting for customer to check if he can access to the portal now, or if he need to reset the password.","Symptom
Customer not able to access Customer Portal


Resolution
Provided new password","","Emiliano Krainuk","Error","PingCastle","Website and Documentation","Customer Portal","","","28.2","Closed - Resolved","Ing. LEHR Christian","Christian Lehr","2024-12-06T09:53:10.000Z","2025-01-03T14:13:47.000Z"
