"Id","CaseNumber","Ticket_Record_Type_Name__c","Subject","Description","DevOps_Steps_to_Reproduce__c","What_We_Know__c","Next_Steps__c","Solution_Comment__c","Issue_Type__c","Ticket_Owner_Name__c","Ticket_Type__c","Platform__c","Collector_Code__c","Feature__c","Product_Version__c","Build_Number__c","Age__c","Status","Account_Name__c","Contact_Name__c","CreatedDate","ClosedDate"
"500Qk00000C7r2NIAR","00412617","Support Ticket","EPP Agent for Ubuntu","Dear Sir or Madam,

We would like to distribute the EPP Agent on Ubuntu.
We have already received and successfully tested version 2.2.0.60000 for this purpose.

Could you please let us know if this is the latest version for 
Ubuntu 20.04 (Focal)
Ubuntu 22.04 (Jammy) 
Ubuntu 24.04 (Noble)
and whether it is supported on the above-mentioned systems.

If a newer version is available, please provide the setup files.

Regards

Anatoli Lorenz","","","","Provided different Linux agent builds and target release date for 5940 release.","","Alin Decean","","Netwrix Endpoint Protector","EPP Other","Client Requests","","","3.8","Closed - Resolved","BMW Group AG","Anatoli Lorenz","2024-06-21T14:53:25.000Z","2024-06-25T11:02:09.000Z"
