"Id","CaseNumber","Ticket_Record_Type_Name__c","Subject","Description","DevOps_Steps_to_Reproduce__c","What_We_Know__c","Next_Steps__c","Solution_Comment__c","Issue_Type__c","Ticket_Owner_Name__c","Ticket_Type__c","Platform__c","Collector_Code__c","Feature__c","Product_Version__c","Build_Number__c","Age__c","Status","Account_Name__c","Contact_Name__c","CreatedDate","ClosedDate"
"500Qk00000Comk5IAB","00414398","Support Ticket","AD Usermodifications job error","I am getting this
Invalid object name 'dbo.SA_ADActivity_EventsView'.
Unexpected exception: Encountered error: ""Sequence contains no matching element"" while generating report","","","","[Issue]
Customer is receiving error when trying to run AD Activity reports.

[Root Cause]
Customer is not currently licensed for AD Activity

[Resolution]
Customer disabled the AD Activity job group in NEA and I showed him how to pull most of the data he was looking for with the ADI > 2-Ad_Changes job.","License: non-technical question","Tay Caliguiri","","Netwrix Enterprise Auditor","StealthAUDIT for Active Directory","Activity","11.6","","1.7","Closed - Resolved","ShelterPoint Life","Paul Wasek","2024-07-09T03:29:08.000Z","2024-07-10T19:19:59.000Z"
