"Id","ParentId","Type","CreatedById","CreatedDate","Body","Title","LinkUrl","RelatedRecordId","InsertedById","LastModifiedDate"
"0D5Qk00000anF9yKAE","500Qk00000NYJe6IAH","TextPost","0054u000008ARZjAAO","2025-04-01T07:54:36.000Z","Description: A job called Shell_AD_Trust_Validation job fails due to the below error:
'Invalid length parameter passed to the LEFT or SUBSTRING function. The statement has been terminated'. Need help in getting the issue resolved.","","","","0054u000008ARZjAAO","2025-04-01T07:54:36.000Z"
"0D5Qk00000anQUkKAM","500Qk00000NYJe6IAH","TextPost","0054u000007ow49AAA","2025-04-01T09:57:14.000Z","Steps to Reproduce Updated: Generating the report gives the failure error","","","","0054u000007ow49AAA","2025-04-01T09:57:14.000Z"
"0D5Qk00000ao4nWKAQ","500Qk00000NYJe6IAH","TextPost","0054u000007ow49AAA","2025-04-01T15:05:36.000Z","What We've Learned Updated: Probably SQL script issues","","","","0054u000007ow49AAA","2025-04-01T15:05:36.000Z"
"0D5Qk00000ao4nXKAQ","500Qk00000NYJe6IAH","TextPost","0054u000007ow49AAA","2025-04-01T15:05:36.000Z","Next Steps Updated: Log analysis","","","","0054u000007ow49AAA","2025-04-01T15:05:36.000Z"
