"Id","ParentId","CommentBody","CreatedById","CreatedDate","LastModifiedDate","IsPublished","IsDeleted"
"00aQk000007KY1VIAW","500Qk00000Bl0JIIAZ","The customer requested the call at 8 pm IST today (14th of June) if it is possible. My slots next week also do not work for them","0054u000008AYYTAA4","2024-06-14T03:02:44.000Z","2024-06-14T04:02:04.000Z","false","false"
"00aQk000007oiWTIAY","500Qk00000Bl0JIIAZ","The customer called in asking for an urgent call as they wanted an update on the ticket.
They requested a call to the number +919738447520.","005Qk000000WWJJIA4","2024-07-09T11:51:42.000Z","2024-07-09T11:51:42.000Z","false","false"
"00aQk000007yJrnIAE","500Qk00000Bl0JIIAZ","The customer requested the call for the upgrade process on July 19th at 2 PM IST","0054u000008AYYTAA4","2024-07-16T23:17:52.000Z","2024-07-16T23:18:15.000Z","false","false"
"00aQk000007yeEfIAI","500Qk00000Bl0JIIAZ","last week the customer had planned an upgrade during APAC working hours, this week it is during EMEA working hours.
Make sure that a meeting is planned before the upgrade, and ensure they plan ahead for available time.","0054u000006goPuAAI","2024-07-17T09:22:14.000Z","2024-07-17T09:22:14.000Z","false","false"
"00aQk000008AMU5IAO","500Qk00000Bl0JIIAZ","The client demands meeting here and now.
They have some post-upgrade issues, most of which could be solved if they read actual instructions.
Meeting plan:

Review post-upgrade environment
Take notes of any errors
Attempt to solve some of them
Ensure that they have published reports working
Ensure their setting for emails are properly set.","0054u000007ow49AAA","2024-07-26T11:34:07.000Z","2024-07-26T11:34:07.000Z","false","false"
"00aQk000008AfzlIAC","500Qk00000Bl0JIIAZ","Odd that SA was upgraded to NEA 11.6.0.86 but AIC was not.

Data Collection  SG_LocalAdmins job did not seem to light up with what the Custom SOX Policy Center >> ITGC SOX >> Test job>> [Table name  SG_LocalAdmins_Result_AsMemberOf] reporting was trying to report on.","00570000003KXurAAG","2024-07-26T15:43:19.000Z","2024-07-26T15:43:19.000Z","false","false"
"00aQk000008FkE1IAK","500Qk00000Bl0JIIAZ","Meeting plan:

Look at their Weak Passwords job, check if the default table has the data they need
If not, suggest creating a custom job, or pulling data from some other job into a custom report","0054u000007ow49AAA","2024-07-31T09:43:02.000Z","2024-07-31T09:43:02.000Z","false","false"
"00aQk000008p06DIAQ","500Qk00000Bl0JIIAZ","client followed up via vm. will notify engineer assigned.","0054u000007ouL8AAI","2024-08-29T23:08:42.000Z","2024-08-29T23:08:42.000Z","false","false"
