"Id","ParentId","Type","CreatedById","CreatedDate","Body","Title","LinkUrl","RelatedRecordId","InsertedById","LastModifiedDate"
"0D5Qk00000Wnh9VKAR","500Qk00000LkbOfIAJ","TextPost","0054u000008ARZjAAO","2025-02-11T15:11:21.000Z","Description: Hi,

Can you please provide documentation on the following:

DEV and QA: Migrate to new Database from SQL 2016 to SQL 2022
PROD: Migrate to new Server from Windows 2016 to Windows 2019. Migrate to new database from SQL 2016 to SQL 2022.","","","","0054u000008ARZjAAO","2025-02-11T15:11:21.000Z"
"0D5Qk00000XEfn1KAD","500Qk00000LkbOfIAJ","TextPost","0054u000007osjSAAQ","2025-02-18T17:53:29.000Z","What We've Learned Updated: The customer needs information on how to migrate his application server","","","","0054u000007osjSAAQ","2025-02-18T17:53:29.000Z"
"0D5Qk00000XF6OhKAL","500Qk00000LkbOfIAJ","TextPost","0054u000007osjSAAQ","2025-02-18T17:55:48.000Z","What We've Learned Updated: The customer needs information on how to migrate his SQL server","","","","0054u000007osjSAAQ","2025-02-18T17:55:48.000Z"
