"Id","ParentId","Type","CreatedById","CreatedDate","Body","Title","LinkUrl","RelatedRecordId","InsertedById","LastModifiedDate"
"0D5Qk00000bwO21KAE","500Qk00000O6yzpIAB","TextPost","0054u000008ARZjAAO","2025-04-16T10:33:15.000Z","Description: Hello,
I would like to follow up on a previously opened case (Case ID: 00439580). However, when I try to view the details of this case, I encounter a screen and content like the one attached.
Could you please fix this?

Best Regards","","","","0054u000008ARZjAAO","2025-04-16T10:33:15.000Z"
"0D5Qk00000bwQ6hKAE","500Qk00000O6yzpIAB","TextPost","005Qk000001nVi3IAE","2025-04-16T10:48:47.000Z","What We've Learned Updated: 16-04 Customer encounter an issue with his logs, where another user is displayed than the one connected.","","","","005Qk000001nVi3IAE","2025-04-16T10:48:47.000Z"
"0D5Qk00000bwUV3KAM","500Qk00000O6yzpIAB","TextPost","005Qk000001nVi3IAE","2025-04-16T10:49:15.000Z","Next Steps Updated: 16-04 We will schedule a remote session for tomorrow, to check the details .","","","","005Qk000001nVi3IAE","2025-04-16T10:49:15.000Z"
