"Id","CaseNumber","Ticket_Record_Type_Name__c","Subject","Description","DevOps_Steps_to_Reproduce__c","What_We_Know__c","Next_Steps__c","Solution_Comment__c","Issue_Type__c","Ticket_Owner_Name__c","Ticket_Type__c","Platform__c","Collector_Code__c","Feature__c","Product_Version__c","Build_Number__c","Age__c","Status","Account_Name__c","Contact_Name__c","CreatedDate","ClosedDate"
"500Qk00000ICLvzIAH","00426765","Support Ticket","Issue attachement New outlook version","Dear,

We have a policy to limit the Teams Attachement. We are now using the new outlook client and our Team policy is also applied to Outlook (the issue is not present with the previous outlook client)

regards","","","","Customer Resolved the issue and provided this feedback:

""You can close the ticket, I fix the issue with a DPI bypass of outlook.office.com
 For information, new outlook client is not recognize by Endpoint as an Outlook app but as an edge browser.""","","Andre Le Roux","","Netwrix Endpoint Protector","Content-Aware Protection","CAP Policies","NONE","","1.1","Closed - Resolved","QUALITY ASSISTANCE S.A.","Guillaume Mainil","2024-11-12T12:56:32.000Z","2024-11-13T14:54:09.000Z"
