"Id","CaseNumber","Ticket_Record_Type_Name__c","Subject","Description","DevOps_Steps_to_Reproduce__c","What_We_Know__c","Next_Steps__c","Solution_Comment__c","Issue_Type__c","Ticket_Owner_Name__c","Ticket_Type__c","Platform__c","Collector_Code__c","Feature__c","Product_Version__c","Build_Number__c","Age__c","Status","Account_Name__c","Contact_Name__c","CreatedDate","ClosedDate"
"500Qk00000FeyJOIAZ","00420767","Support Ticket","Schedules are not launching","Schedules fail to execute.
Task Scheduler shows Event ID's 203 and 101, Operational Code: Launch Failure.
I have gone over permissions in article <a href='https://helpcenter.netwrix.com/bundle/z-kb-articles-salesforce/page/kA04u0000000I7rCAE.html' target='_blank'>https://helpcenter.netwrix.com/bundle/z-kb-articles-salesforce/page/kA04u0000000I7rCAE.html</a> and confirmed account is in the Administrators group.
The account has Log On As Batch Job granted in User RIghts Assignment in Local Policies of Local Security Policy.
The account has full control on C:WindowsTasks (folder is empty)
The account has full control on C:WindowsSystem32\Tasks (folder has the jobs scheduled)
LogsApplication suggests ""Login failed for user""","","","","Granted permissions on DB for the service account. Issue resolved.","Guidance","Saqib Sharif","","Netwrix Enterprise Auditor","StealthAUDIT for NetApp","Credentials","11.6","","0.9","Closed - Resolved","Thales Group Australia","Matthew Heaton-Harris","2024-09-12T05:31:59.000Z","2024-09-13T02:02:27.000Z"
