"Id","ParentId","Type","CreatedById","CreatedDate","Body","Title","LinkUrl","RelatedRecordId","InsertedById","LastModifiedDate"
"0D5Qk00000XiLhXKAV","500Qk00000MHjIeIAL","TextPost","0054u000008ARZjAAO","2025-02-25T16:03:49.000Z","Description: Hi,

I would like to schedule a meeting to discuss the following risk identified by Pingcastle: Hardened Paths have been modified to lower the security level.

The agenda for the meeting would be to review and discuss how to remediate this risk from our AD.

Please let me know your availability for Thursday 27th February.

Kind Regards,

Atif Rashid","","","","0054u000008ARZjAAO","2025-02-25T16:03:49.000Z"
"0D5Qk00000aIpQvKAK","500Qk00000MHjIeIAL","TextPost","0054u000007Mdn4AAC","2025-03-25T18:34:48.000Z","Next Steps Updated: Wait for customer that mentioned this is still in review with their architect team to understand the risk impact of implementing these changes.","","","","0054u000007Mdn4AAC","2025-03-25T18:34:48.000Z"
"0D5Qk00000aIrERKA0","500Qk00000MHjIeIAL","TextPost","0054u000007Mdn4AAC","2025-03-25T18:35:57.000Z","What We've Learned Updated: Customer wanted to discuss the risk Hardened Paths have been modified to lower the security level, identified by Pingcastle","","","","0054u000007Mdn4AAC","2025-03-25T18:35:57.000Z"
