"Id","CaseNumber","Ticket_Record_Type_Name__c","Subject","Description","DevOps_Steps_to_Reproduce__c","What_We_Know__c","Next_Steps__c","Solution_Comment__c","Issue_Type__c","Ticket_Owner_Name__c","Ticket_Type__c","Platform__c","Collector_Code__c","Feature__c","Product_Version__c","Build_Number__c","Age__c","Status","Account_Name__c","Contact_Name__c","CreatedDate","ClosedDate"
"500Qk00000N61DtIAJ","00439303","Support Ticket","Use CustomRules","Hi
Fisrt of all i'm sorry to create a new ticket.
I've checked the custom rules in <a href='https://PingCastle.exe' target='_blank'>PingCastle.exe</a>.config but i need some support to add a custom rule on DoListObject to increase oradad level.
Could you help me ?
Best regards","","Customer need to add a custom rule on DoListObject - This can't be done in Auditor version. Just Pro or Enterprise.","Wait for Account Manager to contact the customer to talk about the Pro license.","This can't be done in Auditor version. Just Pro or Enterprise.
Contacted account manager to talk about Pro license","","Emiliano Krainuk","Question","PingCastle","PC Standard","PingCastle General","3.2.0.1","","16.2","Closed - Resolved","Thales Group","Julien Maltaverne","2025-03-19T12:23:44.000Z","2025-04-04T17:17:16.000Z"
