"Id","ParentId","Type","CreatedById","CreatedDate","Body","Title","LinkUrl","RelatedRecordId","InsertedById","LastModifiedDate"
"0D5Qk00000bUOyrKAG","500Qk00000NtzVRIAZ","TextPost","0054u000008ARZjAAO","2025-04-10T10:52:56.000Z","Description: Hi,

I would like to arrange a call with your technical support to discuss two risks identified by our latest Pingcastle vulnerability report:

'Number of Admins in Protected Groups'

'LDAP authentication without signature enforcement was allowed'

I would like to understand how we would go ahead and proceed with the remediation in our environment and also to understand the risk impact of such changes.","","","","0054u000008ARZjAAO","2025-04-10T10:52:56.000Z"
"0D5Qk00000bosBvKAI","500Qk00000NtzVRIAZ","TextPost","005Qk000004DRJRIA4","2025-04-14T11:38:19.000Z","Invitation updated. Attendees: No attendees listed","","","","005Qk000004DRJRIA4","2025-04-14T11:38:19.000Z"
"0D5Qk00000bosBxKAI","500Qk00000NtzVRIAZ","TextPost","005Qk000004DRJRIA4","2025-04-14T11:38:19.000Z","Invitation updated. Attendees: Shaheryar Ali Tahir, Rejaul Uddin, atif rashid, Joe Dibley","","","","005Qk000004DRJRIA4","2025-04-14T11:38:19.000Z"
"0D5Qk00000bosBwKAI","500Qk00000NtzVRIAZ","TextPost","005Qk000004DRJRIA4","2025-04-14T11:38:19.000Z","Invitation updated. Attendees: Shaheryar Ali Tahir, Rejaul Uddin","","","","005Qk000004DRJRIA4","2025-04-14T11:38:19.000Z"
