"Id","CaseNumber","Ticket_Record_Type_Name__c","Subject","Description","DevOps_Steps_to_Reproduce__c","What_We_Know__c","Next_Steps__c","Solution_Comment__c","Issue_Type__c","Ticket_Owner_Name__c","Ticket_Type__c","Platform__c","Collector_Code__c","Feature__c","Product_Version__c","Build_Number__c","Age__c","Status","Account_Name__c","Contact_Name__c","CreatedDate","ClosedDate"
"500Qk00000Kq25eIAB","00432837","Support Ticket","Licence","after updating pingcastle from version 3.2.0.1 to 3.3.0.1, the license is no longer recognized. Does this have anything to do with the update or the takeover of the product by netwrix? WTF???","customer does not have a license for pingcastle","The customer's business under went a name change and a license was not applied to the account under either name.  Action by legal is required to correct this.  A temporary 30-day license was issued on 20-March.

---------
sales confirmed that we do not have any active license for this customer, case can be closed","legal will need to be involved to help obtain the assignment agreement

sales confirmed that we do not have any active license for this customer, case can be closed","fulfillment confirmed that we do not have any active license for this customer, case can be closed--------
provided a valid license under the old company name after involving sales leadership","","Brandon West","Unexpected Behavior","PingCastle","PC Standard","PingCastle General","3.3","","70.1","Closed - Resolved","Gutenberg Rechenzentrum GmbH & Co.","Dirk Maass","2025-01-20T10:10:16.000Z","2025-03-31T13:06:48.000Z"
