"Id","CaseNumber","Ticket_Record_Type_Name__c","Subject","Description","DevOps_Steps_to_Reproduce__c","What_We_Know__c","Next_Steps__c","Solution_Comment__c","Issue_Type__c","Ticket_Owner_Name__c","Ticket_Type__c","Platform__c","Collector_Code__c","Feature__c","Product_Version__c","Build_Number__c","Age__c","Status","Account_Name__c","Contact_Name__c","CreatedDate","ClosedDate"
"500Qk00000NNvgHIAT","00440144","Support Ticket","Brave Browser Application Blocking & Email Alert for Unauthorized Data Transfers","Hello Team,

We are currently exploring ways to achieve the following in Netwrix Endpoint Protector:

Brave Browser Application Blocking – We would like to understand if and how we can block the Brave browser on endpoints using Netwrix Endpoint Protector.

Email Alert for Unauthorized Data Transfers – Is it possible to configure an alert if data is being sent outside of authorized domains? If so, could you please provide guidance on setting this up? user is using Gmail and we have enabled Webmail Protection.","","Gave the client detailed responses for both Brave and Email alerts.
Agreed to close the case.","Sent note with instructions for the Brave app but I need to take a look more for the alerts.","Closing ticket as resolved.","","Marian Ilies","Question","Netwrix Endpoint Protector","Server","EPP Server - Other","NONE","","0.2","Closed - Resolved","BD Software Distribution Pvt Ltd","Pravin B.","2025-03-27T07:11:53.000Z","2025-03-27T12:29:45.000Z"
