"Id","ParentId","Type","CreatedById","CreatedDate","Body","Title","LinkUrl","RelatedRecordId","InsertedById","LastModifiedDate"
"0D5Qk00000SKkv7KAD","500Qk00000J8GXhIAN","TextPost","0054u000008ARZjAAO","2024-12-05T13:02:37.000Z","Description: Hi Team,
Customer facing the internet connectivity issue when enabled the DPI setting.

I have disabled the DPI setting and checked the Internet connection, It was working smoothly. But when enabling the DPI, the users are facing the internet slowness issue.

Regards,
Prasanth","","","","0054u000008ARZjAAO","2024-12-05T13:02:37.000Z"
"0D5Qk00000TPm8pKAD","500Qk00000J8GXhIAN","TextPost","005Qk000001nViEIAU","2024-12-20T09:45:38.000Z","What We've Learned Updated: The issue is related to a VPN connection. (VPN app name pritunl)
When enabling the VPN and a CAP policy is assigned the issue is present.","","","","005Qk000001nViEIAU","2024-12-20T09:45:38.000Z"
"0D5Qk00000TPg0OKAT","500Qk00000J8GXhIAN","TextPost","005Qk000001nViEIAU","2024-12-20T09:47:23.000Z","Next Steps Updated: We enabled the Stealthy DPI option and the customer will confirm if the issue remains.

Next step is to enable all DPI bypass options to see if the issue remains.

Next, Updating the EPp client from 6.2.3.1 to 6.2.4.0 and collecting logs.","","","","005Qk000001nViEIAU","2024-12-20T09:47:23.000Z"
