"Id","ParentId","Type","CreatedById","CreatedDate","Body","Title","LinkUrl","RelatedRecordId","InsertedById","LastModifiedDate"
"0D5Qk00000aPWKwKAO","500Qk00000NNvgHIAT","TextPost","0054u000008ARZjAAO","2025-03-27T07:11:54.000Z","Description: Hello Team,

We are currently exploring ways to achieve the following in Netwrix Endpoint Protector:

Brave Browser Application Blocking – We would like to understand if and how we can block the Brave browser on endpoints using Netwrix Endpoint Protector.

Email Alert for Unauthorized Data Transfers – Is it possible to configure an alert if data is being sent outside of authorized domains? If so, could you please provide guidance on setting this up? user is using Gmail and we have enabled Webmail Protection.","","","","0054u000008ARZjAAO","2025-03-27T07:11:54.000Z"
"0D5Qk00000aPUjgKAG","500Qk00000NNvgHIAT","TextPost","005Qk000003xRAXIA2","2025-03-27T08:20:52.000Z","What We've Learned Updated: Client wishes to block the Brave application and also to set up mail CAP policy alerts.","","","","005Qk000003xRAXIA2","2025-03-27T08:20:52.000Z"
"0D5Qk00000aPlYTKA0","500Qk00000NNvgHIAT","TextPost","005Qk000003xRAXIA2","2025-03-27T08:21:20.000Z","Next Steps Updated: Sent note with instructions for the Brave app but I need to take a look more for the alerts.","","","","005Qk000003xRAXIA2","2025-03-27T08:21:20.000Z"
"0D5Qk00000aQ4t0KAC","500Qk00000NNvgHIAT","TextPost","005Qk000003xRAXIA2","2025-03-27T12:27:53.000Z","What We've Learned Updated: Gave the client detailed responses for both Brave and Email alerts.
Agreed to close the case.","","","","005Qk000003xRAXIA2","2025-03-27T12:27:53.000Z"
