"Id","CaseNumber","Ticket_Record_Type_Name__c","Subject","Description","DevOps_Steps_to_Reproduce__c","What_We_Know__c","Next_Steps__c","Solution_Comment__c","Issue_Type__c","Ticket_Owner_Name__c","Ticket_Type__c","Platform__c","Collector_Code__c","Feature__c","Product_Version__c","Build_Number__c","Age__c","Status","Account_Name__c","Contact_Name__c","CreatedDate","ClosedDate"
"500Qk00000KaMePIAV","00431979","Support Ticket","Unable to Access EPP Portal","Hi Team,

I hope this message finds you well. I am currently unable to reach the EPP portal. Could you please investigate this issue at your earliest convenience?

Thank you for your assistance.

Regards,
Deepti","","","","We identified a config file that was missing some lines regarding the SSL. 
We added back those lines and we could access the URL","","Adrian Draghici","Error","Netwrix Endpoint Protector","Server","EPP Server - Other","","5940","1.0","Closed - Resolved","Klarna","Deepti Singh","2025-01-14T09:06:20.000Z","2025-01-15T10:08:27.000Z"
