"Id","ParentId","Type","CreatedById","CreatedDate","Body","Title","LinkUrl","RelatedRecordId","InsertedById","LastModifiedDate"
"0D5Qk00000bz9rIKAQ","500Qk00000O8xGRIAZ","TextPost","0054u000008ARZjAAO","2025-04-17T00:10:40.000Z","Description: Dear Support,

We are working to assess and improve the IT obsolescence management practices, particularly regarding security risks and regulatory compliance.
Socredo is using you product « Netwrix Endpoint Protector ». 
The server version is 5.9.4.1.
The client version is 6.2.4.2000. 

The application is installed on a virtual machine running Ubuntu 18.04.6 LTS.
This distribution is considered obsolete.
We would like to migrate to a more recent and supported version. 

Could you please get back to us with your technical recommendations?

Regards.","","","","0054u000008ARZjAAO","2025-04-17T00:10:40.000Z"
"0D5Qk00000c09wgKAA","500Qk00000O8xGRIAZ","TextPost","005Qk000001nViEIAU","2025-04-17T06:45:41.000Z","What We've Learned Updated: 2025.04.17: The customer would like to migrate to a more recent and supported version.","","","","005Qk000001nViEIAU","2025-04-17T06:45:41.000Z"
"0D5Qk00000c09whKAA","500Qk00000O8xGRIAZ","TextPost","005Qk000001nViEIAU","2025-04-17T06:45:41.000Z","Next Steps Updated: 2025.04.17: Shared steps to import and migrate the server to a new VM.","","","","005Qk000001nViEIAU","2025-04-17T06:45:41.000Z"
