"Id","CaseNumber","Ticket_Record_Type_Name__c","Subject","Description","DevOps_Steps_to_Reproduce__c","What_We_Know__c","Next_Steps__c","Solution_Comment__c","Issue_Type__c","Ticket_Owner_Name__c","Ticket_Type__c","Platform__c","Collector_Code__c","Feature__c","Product_Version__c","Build_Number__c","Age__c","Status","Account_Name__c","Contact_Name__c","CreatedDate","ClosedDate"
"500Qk00000Lh92NIAR","00435275","Support Ticket","Supervision for the upgrade to 5.9.4.1. for the Production Environment","Hi Team,

Booking.com team is planning to upgrade the EPP server (production) to 5.9.4.1.
Can you please advise on the availability to supervise the upgrade and make the nginx/ database checks once the upgrade is completed? Booking.com team would like to have this performed tomorrow 11th February during the afternoon (CET: Amsterdam time).

Thank you,

Oana Nemes | Team Lead, Customer Success
Endpoint Protector by CoSoSys, now part of Netwrix
DLP | Device Control | Content Aware Protection | eDiscovery | Enforced Encryption
www.endpointprotector.com","","Customer would like to update the EPP Server to 5941","A remote session will be scheduled for tomorrow/day after tomorrow

The update was applied correctly. Waiting for the customer to run some tests during the next days and confirm if everything works as expected","The server was updated, no issues were encountered.","","Emil Podar","Request","Netwrix Endpoint Protector","Server","EPP Server - Other","","","4.0","Closed - Resolved","Booking.com","Serhat Demir","2025-02-10T14:54:25.000Z","2025-02-14T15:38:39.000Z"
