"Id","CaseNumber","Ticket_Record_Type_Name__c","Subject","Description","DevOps_Steps_to_Reproduce__c","What_We_Know__c","Next_Steps__c","Solution_Comment__c","Issue_Type__c","Ticket_Owner_Name__c","Ticket_Type__c","Platform__c","Collector_Code__c","Feature__c","Product_Version__c","Build_Number__c","Age__c","Status","Account_Name__c","Contact_Name__c","CreatedDate","ClosedDate"
"500Qk00000MirojIAB","00438174","Support Ticket","The License for Demonstration Has Expired","Hi 
The license for the demonstration has expired. 
Please assist us in extending the license. (This system is used for customer demonstrations and internal testing.)
Thank you for your support.

Best regards,","","","","Received license from sales.","","Andrei Pop","Question","Netwrix Endpoint Protector","Server","EPP Server - Other","NONE","","1.2","Closed - Resolved","Fongecloud Information Technology Ltd. (RangeCloud)","Jay Mai","2025-03-09T03:26:18.000Z","2025-03-10T08:27:32.000Z"
