"Id","CaseNumber","Ticket_Record_Type_Name__c","Subject","Description","DevOps_Steps_to_Reproduce__c","What_We_Know__c","Next_Steps__c","Solution_Comment__c","Issue_Type__c","Ticket_Owner_Name__c","Ticket_Type__c","Platform__c","Collector_Code__c","Feature__c","Product_Version__c","Build_Number__c","Age__c","Status","Account_Name__c","Contact_Name__c","CreatedDate","ClosedDate"
"500Qk00000Nh3n2IAB","00440999","Support Ticket","Smart Groups","Hi

We have just enabled Smart Groups in EPP.

We have created a Smart group, and set the Dynamic Rule for a group of computer. We have whitelisted a device against the Smart Group.

How do we view which computers are assigned to this Smart Group

Regards","","The customer asked how the Smart Groups work","I explained the customer how the Smart Groups are working and I asked for a meeting in order to discuss further if they have additional questions","The question was answered","Other","Emil Podar","Question","Netwrix Endpoint Protector","Server","EPP Server - Other","","","31.0","Closed - Resolved","Logiq Consulting","Phil Parkes","2025-04-04T14:34:23.000Z","2025-05-05T14:45:43.000Z"
