"Id","ParentId","Type","CreatedById","CreatedDate","Body","Title","LinkUrl","RelatedRecordId","InsertedById","LastModifiedDate"
"0D5Qk00000byYmcKAE","500Qk00000O8bW4IAJ","TextPost","0054u000008ARZjAAO","2025-04-16T20:58:10.000Z","Description: I have generated a new cert, and uploaded it and the corresponding key to the server. However, the certificate is installed without the accompying root certificate and issueing certificate authorities that were part of the certificate chain that I pasted into the server admin web page, which results in an untrusted certificate error being presented when accessing the site. Is there a separate place to upload certificate authorities? how do I get the entire certificate, including the CAs, imported into the server?","","","","0054u000008ARZjAAO","2025-04-16T20:58:10.000Z"
"0D5Qk00000c1uLiKAI","500Qk00000O8bW4IAJ","TextPost","005Qk000001nViHIAU","2025-04-17T16:59:31.000Z","Next Steps Updated: As they were facing issues importing the certificate, I scheduled a remote session in order to assist them.","","","","005Qk000001nViHIAU","2025-04-17T16:59:31.000Z"
"0D5Qk00000c1uLhKAI","500Qk00000O8bW4IAJ","TextPost","005Qk000001nViHIAU","2025-04-17T16:59:31.000Z","What We've Learned Updated: The customer would like to replace the TLS Certificate","","","","005Qk000001nViHIAU","2025-04-17T16:59:31.000Z"
"0D5Qk00000c1j8oKAA","500Qk00000O8bW4IAJ","TextPost","005Qk000001nViHIAU","2025-04-17T17:00:17.000Z","Invitation updated. Attendees: No attendees listed","","","","005Qk000001nViHIAU","2025-04-17T17:00:17.000Z"
"0D5Qk00000c1j8pKAA","500Qk00000O8bW4IAJ","TextPost","005Qk000001nViHIAU","2025-04-17T17:00:17.000Z","Invitation updated. Attendees: Emil Podar","","","","005Qk000001nViHIAU","2025-04-17T17:00:17.000Z"
"0D5Qk00000c1j8qKAA","500Qk00000O8bW4IAJ","TextPost","005Qk000001nViHIAU","2025-04-17T17:00:18.000Z","Invitation updated. Attendees: Emil Podar, Jeff Schemp","","","","005Qk000001nViHIAU","2025-04-17T17:00:18.000Z"
