"Id","CaseNumber","Ticket_Record_Type_Name__c","Subject","Description","DevOps_Steps_to_Reproduce__c","What_We_Know__c","Next_Steps__c","Solution_Comment__c","Issue_Type__c","Ticket_Owner_Name__c","Ticket_Type__c","Platform__c","Collector_Code__c","Feature__c","Product_Version__c","Build_Number__c","Age__c","Status","Account_Name__c","Contact_Name__c","CreatedDate","ClosedDate"
"500Qk00000J8GXhIAN","00428976","Support Ticket","Reg: DPI is affecting the users internet connectivity || GIIFT || || Implementation ||","Hi Team,
Customer facing the internet connectivity issue when enabled the DPI setting.

I have disabled the DPI setting and checked the Internet connection, It was working smoothly. But when enabling the DPI, the users are facing the internet slowness issue.

Regards,
Prasanth","","The issue is related to a VPN connection. (VPN app name pritunl)
When enabling the VPN and a CAP policy is assigned the issue is present.","We enabled the Stealthy DPI option and the customer will confirm if the issue remains.

Next step is to enable all DPI bypass options to see if the issue remains.

Next, Updating the EPp client from 6.2.3.1 to 6.2.4.0 and collecting logs.","Stealthy DPI option enabled.","","Andrei Pop","Performance","Netwrix Endpoint Protector","Server","EPP Server - Other","NONE","","27.9","Closed - Resolved","Satcom Infotech","Prasanth Ganesan","2024-12-05T13:02:37.000Z","2025-01-02T09:37:55.000Z"
