"Id","CaseNumber","Ticket_Record_Type_Name__c","Subject","Description","DevOps_Steps_to_Reproduce__c","What_We_Know__c","Next_Steps__c","Solution_Comment__c","Issue_Type__c","Ticket_Owner_Name__c","Ticket_Type__c","Platform__c","Collector_Code__c","Feature__c","Product_Version__c","Build_Number__c","Age__c","Status","Account_Name__c","Contact_Name__c","CreatedDate","ClosedDate"
"500Qk00000IVMrVIAX","00427484","Support Ticket","Probleme Endpointprotector nach Austausch Switch","Hallo und guten Morgen,

nach einer Netzwerkumstellung (durch Austausch von Switches hat sich das Gateway geändert) haben wir Probleme mit dem Endpointprotector! Weder die IP noch das Gateway lassen sich ändern!

Wir bekommen immer folgende Fehlermeldung:

 


Können sie uns weiterhelfen? Wir hätten gerne einen deutschsprachigen Support.


Mit freundlichen Grüßen 

i. A. Thorsten Weiler","","","","Changed the Grub file according to procedure 63. Ticket solved","","Alin Anca","","Netwrix Endpoint Protector","Server","EPP Server - Other","","","1.1","Closed - Resolved","Stadtwerke Homburg GmbH","Thorsten Weiler","2024-11-19T10:17:02.000Z","2024-11-20T12:57:15.000Z"
