"Id","CaseNumber","Ticket_Record_Type_Name__c","Subject","Description","DevOps_Steps_to_Reproduce__c","What_We_Know__c","Next_Steps__c","Solution_Comment__c","Issue_Type__c","Ticket_Owner_Name__c","Ticket_Type__c","Platform__c","Collector_Code__c","Feature__c","Product_Version__c","Build_Number__c","Age__c","Status","Account_Name__c","Contact_Name__c","CreatedDate","ClosedDate"
"500Qk00000CmwcHIAR","00414333","Support Ticket","Not Able to DLP Console from Web","Hi Team,

We have a critical issue with EPP that we cannot access DLP Console from Web. We checked the logs from server and this thing started yesterday 2:30 pm.

Can we have urgent call on this matter? Because this will impact our business user.

Thanks,
Parin","","","","Customer reverted to Snapshot.","","Flaviu Moldovan","","Netwrix Endpoint Protector","Server","EPP Server - Other","","","0.9","Closed - Resolved","Canada Guaranty","Parinkumar Patel","2024-07-08T15:46:26.000Z","2024-07-09T14:32:49.000Z"
