"Id","ParentId","Type","CreatedById","CreatedDate","Body","Title","LinkUrl","RelatedRecordId","InsertedById","LastModifiedDate"
"0D5Qk00000RusZdKAJ","500Qk00000IsrTDIAZ","TextPost","0054u000008ARZjAAO","2024-11-28T08:19:28.000Z","Description: Hi Support,

I hope this email finds you well.

I am writing to request Non-Production (NFR) licenses for the following Stealth Products: Netwrix Enterprise Auditor, Stealth Defend, and Stealth Intercept. Our team is currently evaluating various security solutions.
Kindly treat as urgent.
Looking forward to your prompt response.

Best Regards.","","","","0054u000008ARZjAAO","2024-11-28T08:19:28.000Z"
"0D5Qk00000SQD9pKAH","500Qk00000IsrTDIAZ","TextPost","0054u000007ow49AAA","2024-12-06T16:27:12.000Z","What We've Learned Updated: Request for non-prod testlab license for Partner","","","","0054u000007ow49AAA","2024-12-06T16:27:12.000Z"
"0D5Qk00000SQ7oQKAT","500Qk00000IsrTDIAZ","TextPost","0054u000007ow49AAA","2024-12-06T16:27:28.000Z","Next Steps Updated: Connected the customer and client, waiting for the results","","","","0054u000007ow49AAA","2024-12-06T16:27:28.000Z"
"0D5Qk00000SQAwvKAH","500Qk00000IsrTDIAZ","TextPost","0054u000007ow49AAA","2024-12-06T16:27:43.000Z","Next Steps Updated: Connected the customer and AO, waiting for the results","","","","0054u000007ow49AAA","2024-12-06T16:27:43.000Z"
