"Id","ParentId","Type","CreatedById","CreatedDate","Body","Title","LinkUrl","RelatedRecordId","InsertedById","LastModifiedDate"
"0D5Qk00000SqXLJKA3","500Qk00000JPkXmIAL","TextPost","0054u000008ARZjAAO","2024-12-12T14:08:45.000Z","Description: We are getting a message saying license will expire in 23 days. Can someone look it to this? Thanks","","","","0054u000008ARZjAAO","2024-12-12T14:08:45.000Z"
"0D5Qk00000Sqr2lKAB","500Qk00000JPkXmIAL","TextPost","005Qk000002b4gDIAQ","2024-12-12T15:12:30.000Z","Description Updated: Netwrix Enterprise Auditor license will soon expire. 
A license file needs to be renewed.","","","","005Qk000002b4gDIAQ","2024-12-12T15:12:30.000Z"
"0D5Qk00000Sr1Y4KAJ","500Qk00000JPkXmIAL","TextPost","005Qk000002b4gDIAQ","2024-12-12T15:13:27.000Z","What We've Learned Updated: Customer was provided a license July this year as per this ticket:
00412062 - License issue

Support sent a license request to licensing@netwrix.com.","","","","005Qk000002b4gDIAQ","2024-12-12T15:13:27.000Z"
"0D5Qk00000SquAKKAZ","500Qk00000JPkXmIAL","TextPost","005Qk000002b4gDIAQ","2024-12-12T15:13:42.000Z","Next Steps Updated: Support is waiting for an update from the license request email thread with licensing@netwrix.com.","","","","005Qk000002b4gDIAQ","2024-12-12T15:13:42.000Z"
"0D5Qk00000Sr1I6KAJ","500Qk00000JPkXmIAL","TextPost","005Qk000002b4gDIAQ","2024-12-12T15:14:27.000Z","Next Steps Updated: Support is waiting for an update from the license request email thread with licensing@netwrix.com. 

As such, placing ticket into postponed reply.","","","","005Qk000002b4gDIAQ","2024-12-12T15:14:27.000Z"
