"Id","ParentId","Type","CreatedById","CreatedDate","Body","Title","LinkUrl","RelatedRecordId","InsertedById","LastModifiedDate"
"0D5Qk00000e4bTXKAY","500Qk00000P8mieIAB","TextPost","0054u000008ARZjAAO","2025-05-14T05:17:27.000Z","Description: Hello Team customer raise a query for DLP SSL certification installation. 
need you suggestion. 
Following up on our recent discussion, I would appreciate your prompt support in configuring the domain certificate within the DLP platform. This is a critical part of our current security enhancement activities, and timely completion is essential.
Kindly prioritize this request and share your guidance at the earliest convenience.
Thank you for your cooperation.","","","","0054u000008ARZjAAO","2025-05-14T05:17:27.000Z"
"0D5Qk00000e4sviKAA","500Qk00000P8mieIAB","TextPost","005Qk000001nVi3IAE","2025-05-14T06:14:22.000Z","What We've Learned Updated: 14-05 customer require assistance with the installation of an SSL certification for the DLP platform.
We have informed them that we cannot generate them and guided him on how to import the certificate","","","","005Qk000001nVi3IAE","2025-05-14T06:14:22.000Z"
"0D5Qk00000e4pvcKAA","500Qk00000P8mieIAB","TextPost","005Qk000001nVi3IAE","2025-05-14T06:14:37.000Z","Next Steps Updated: 14-05 Waiting for customer to test.","","","","005Qk000001nVi3IAE","2025-05-14T06:14:37.000Z"
"0D5Qk00000ewKigKAE","500Qk00000P8mieIAB","TextPost","005Qk000001nVi3IAE","2025-05-21T12:55:01.000Z","What We've Learned Updated: 14-05 customer require assistance with the installation of an SSL certification for the DLP platform.
We have informed them that we cannot generate them and guided him on how to import the certificate

21-05. In the meeting we have performed the following troubleshooting steps:
tried to access the backend of the server through the EPP VM console
we have restarted the machine and the issue persisted
tried to access the GRUB menu and each time we select to access the console or the boot option the page was returning to the first page
we have shut down the old machine and create a new one
on the new machine we have used the same IP as the previous one
added the ssl certificate and we were able to access the EPP UI with both option (IP and FQDN) 
next step was to upload the license
we update the EPP server to the latest version 5.9.4.1
As we agreed this case will be closed since the issue has been fixed.","","","","005Qk000001nVi3IAE","2025-05-21T12:55:01.000Z"
"0D5Qk00000ewVRGKA2","500Qk00000P8mieIAB","TextPost","005Qk000001nVi3IAE","2025-05-21T12:55:33.000Z","Next Steps Updated: 14-05 Waiting for customer to test.

21-05 Solved in the remote session.","","","","005Qk000001nVi3IAE","2025-05-21T12:55:33.000Z"
