"Id","CaseNumber","Ticket_Record_Type_Name__c","Subject","Description","DevOps_Steps_to_Reproduce__c","What_We_Know__c","Next_Steps__c","Solution_Comment__c","Issue_Type__c","Ticket_Owner_Name__c","Ticket_Type__c","Platform__c","Collector_Code__c","Feature__c","Product_Version__c","Build_Number__c","Age__c","Status","Account_Name__c","Contact_Name__c","CreatedDate","ClosedDate"
"500Qk00000F2RoIIAV","00419388","Support Ticket","Customer got Error during installation of EPP server PoC","Hello,

Customer name is Enamine.
They got Error during installation of EPP server during PoC process.
Can you please join the remote session tomorrow to look into this issue?
I will attach the screenshot of the error.","","","","The 2-nd network adapter was not enabled","","Adrian Stanca","","Netwrix Endpoint Protector","Server","Server Health","","","5.9","Closed - Resolved","Enamine","Danylo Didenko","2024-08-28T13:40:41.000Z","2024-09-03T10:37:11.000Z"
