"Id","ParentId","Type","CreatedById","CreatedDate","Body","Title","LinkUrl","RelatedRecordId","InsertedById","LastModifiedDate"
"0D5Qk00000XxJA7KAN","500Qk00000MPT2AIAX","TextPost","0054u000008ARZjAAO","2025-02-28T10:50:05.000Z","Description: Hello,

I created a feature request a long time ago - before the switch to the netwrix portal.
I am not sure if this feature request has ""survived"" the transission to Netwrix.
Therefore I would like to ask what the status of this feature request is?
Attached you will find my mail from May 2024.

Thank you in advance!","","","","0054u000008ARZjAAO","2025-02-28T10:50:05.000Z"
"0D5Qk00000XxYuHKAV","500Qk00000MPT2AIAX","TextPost","005Qk000001nVi3IAE","2025-02-28T13:55:09.000Z","What We've Learned Updated: Customer had a few questions regarding a case that they raised a couple of months ago.","","","","005Qk000001nVi3IAE","2025-02-28T13:55:09.000Z"
"0D5Qk00000XxWFhKAN","500Qk00000MPT2AIAX","TextPost","005Qk000001nVi3IAE","2025-02-28T13:55:23.000Z","Next Steps Updated: We provided them the requested details.","","","","005Qk000001nVi3IAE","2025-02-28T13:55:23.000Z"
