"Id","ParentId","Type","CreatedById","CreatedDate","Body","Title","LinkUrl","RelatedRecordId","InsertedById","LastModifiedDate"
"0D5Qk00000PYPB3KAP","500Qk00000HG0GnIAL","TextPost","005Qk000001nViEIAU","2024-10-28T13:10:59.000Z","Steps to Reproduce Updated: 1. Setup External Storage for SFTP.
2. Save the setting and wait 3 minutes.
3. Test connection. Wrong credentials error appears.","","","","005Qk000001nViEIAU","2024-10-28T13:10:59.000Z"
"0D5Qk00000PYL7PKAX","500Qk00000HG0GnIAL","TextPost","005Qk000001nViEIAU","2024-10-28T13:11:40.000Z","What We've Learned Updated: User used to connect to the SFTP have the right top create files and folders in the SFTP.","","","","005Qk000001nViEIAU","2024-10-28T13:11:40.000Z"
"0D5Qk00000PYV6LKAX","500Qk00000HG0GnIAL","TextPost","005Qk000001nViEIAU","2024-10-28T13:11:58.000Z","Next Steps Updated: Checnking with R&D","","","","005Qk000001nViEIAU","2024-10-28T13:11:58.000Z"
