"Id","CaseNumber","Ticket_Record_Type_Name__c","Subject","Description","DevOps_Steps_to_Reproduce__c","What_We_Know__c","Next_Steps__c","Solution_Comment__c","Issue_Type__c","Ticket_Owner_Name__c","Ticket_Type__c","Platform__c","Collector_Code__c","Feature__c","Product_Version__c","Build_Number__c","Age__c","Status","Account_Name__c","Contact_Name__c","CreatedDate","ClosedDate"
"500Qk00000NgOOtIAN","00440956","Support Ticket","Alerts menu","Hi,

I would like to use Alerts. However, I cannot see the menu in my Endpoint Protector.
Could you please tell me how can I make it available?

Best Regards,
Junichi","","Wants to use alerts.","Asked if the user i supperadmin.","enhanced CPU and RAM of the server, then we are able to access now.","Insufficient hardware resources","Andrei Pop","Question","Netwrix Endpoint Protector","Alerts","Alerts Configuration","NONE","","10.9","Closed - Resolved","Allied Telesis K.K","Junichi Katagiri","2025-04-04T07:50:45.000Z","2025-04-15T04:58:09.000Z"
