"Id","CaseNumber","Ticket_Record_Type_Name__c","Subject","Description","DevOps_Steps_to_Reproduce__c","What_We_Know__c","Next_Steps__c","Solution_Comment__c","Issue_Type__c","Ticket_Owner_Name__c","Ticket_Type__c","Platform__c","Collector_Code__c","Feature__c","Product_Version__c","Build_Number__c","Age__c","Status","Account_Name__c","Contact_Name__c","CreatedDate","ClosedDate"
"500Qk00000H3vzHIAR","00423976","Support Ticket","Reg: Email Alert is not received || POC || || PRAELLA ||","Hi Team,

We have configured the Email server settings on the EPP console and got the test email sent notification on the dashboard when saved the settings but test email is not received as we expected.

Please look into this case and resolve the reported issue asap.

Regards,
Prasanth","","","","Reported issue has been resolved.

Thanks for your prompt support.

Please close this ticket from your end.","","Andre Le Roux","","Netwrix Endpoint Protector","Alerts","Alerts Configuration","NONE","","19.6","Closed - Resolved","Satcom Infotech","Prasanth Ganesan","2024-10-15T15:33:51.000Z","2024-11-04T05:53:32.000Z"
