"Id","CaseNumber","Ticket_Record_Type_Name__c","Subject","Description","DevOps_Steps_to_Reproduce__c","What_We_Know__c","Next_Steps__c","Solution_Comment__c","Issue_Type__c","Ticket_Owner_Name__c","Ticket_Type__c","Platform__c","Collector_Code__c","Feature__c","Product_Version__c","Build_Number__c","Age__c","Status","Account_Name__c","Contact_Name__c","CreatedDate","ClosedDate"
"500Qk00000K30MXIAZ","00430918","Support Ticket","Urgent - EasyLock Enforced Encryption - Expired","Hello,
We recently did the license extension for the EPP product, however, today we are noticing EasyLock Enforced Encryption - Expired warning on the license page and users are reporting that they could not use EasyLock

Can this be reviewed as soon as possible?

Regards,
Karan","","the license file they received did not include their EasyLock licenses.
Andrew sent an email to the proper team and we are waiting for their reply","waiting for the responsible team to reply to the email Andrew Miller sent","the new license file solved the easylock issue.","","Eduard Nut","Unexpected Behavior","Netwrix Endpoint Protector","EasyLock / Enforced Ecryption","EasyLock License","","","1.0","Closed - Resolved","Bennett Jones Services Limited","Karan Bhagat","2024-12-30T18:05:23.000Z","2024-12-31T17:40:42.000Z"
