"Id","CaseNumber","Ticket_Record_Type_Name__c","Subject","Description","DevOps_Steps_to_Reproduce__c","What_We_Know__c","Next_Steps__c","Solution_Comment__c","Issue_Type__c","Ticket_Owner_Name__c","Ticket_Type__c","Platform__c","Collector_Code__c","Feature__c","Product_Version__c","Build_Number__c","Age__c","Status","Account_Name__c","Contact_Name__c","CreatedDate","ClosedDate"
"500Qk00000J89b3IAB","00428970","Support Ticket","Unconstrained delegation","Despite multiple Ping Castle runs and adjustments, 8 accounts still show unconstrained delegation. We've applied the same changes as other accounts, but some remain on the list for unknown reasons.","","8 users are showing unconstrained delegation","Wait for customer to test what I sent and send information required.","Symptom
accounts showing unconstrained delegation.


Resolution
 Explained that they will need to review each account and verify if they have any sort of delegation applied. Then they should remove or restrict it appropriately. 
Customer asked to close the case and will be back if needed.","Data validation / interpretation","Emiliano Krainuk","Unexpected Behavior","PingCastle","PC Enterprise","PingCastle General","3.3","","7.3","Closed - Resolved","St. Elizabeth Healthcare","Jonathan Johnson","2024-12-05T12:01:50.000Z","2024-12-12T19:34:07.000Z"
