"Id","ParentId","Type","CreatedById","CreatedDate","Body","Title","LinkUrl","RelatedRecordId","InsertedById","LastModifiedDate"
"0D5Qk00000ScwhIKAR","500Qk00000JJ23BIAT","TextPost","0054u000008ARZjAAO","2024-12-10T07:43:25.000Z","Description: Hello Team!
We are currently facing a problem with the RAM Usage of one of our endpoint servers.
All our endpoint servers got 12 GB of Ram free, but one is capped to ~12GB.
Could you please help us regarding this problem.

Kind regards,
David Patscheider

Barmherzige Brüder Austria","","","","0054u000008ARZjAAO","2024-12-10T07:43:25.000Z"
"0D5Qk00000Sj8gvKAB","500Qk00000JJ23BIAT","TextPost","005Qk000001nViEIAU","2024-12-11T08:47:45.000Z","What We've Learned Updated: The usage was due to the device duplicates.
The server is now using less ram.","","","","005Qk000001nViEIAU","2024-12-11T08:47:45.000Z"
"0D5Qk00000SjDInKAN","500Qk00000JJ23BIAT","TextPost","005Qk000001nViEIAU","2024-12-11T08:48:10.000Z","Next Steps Updated: The customer will monitor the server for a few days.","","","","005Qk000001nViEIAU","2024-12-11T08:48:10.000Z"
