"Id","ParentId","Type","CreatedById","CreatedDate","Body","Title","LinkUrl","RelatedRecordId","InsertedById","LastModifiedDate"
"0D5Qk00000QyzucKAB","500Qk00000INm6PIAT","TextPost","0054u000008ARZjAAO","2024-11-15T19:15:53.000Z","Description: null","","","","0054u000008ARZjAAO","2024-11-15T19:15:53.000Z"
"0D5Qk00000R0Pj2KAF","500Qk00000INm6PIAT","TextPost","005Qk000001nVi2IAE","2024-11-15T21:03:33.000Z","What We've Learned Updated: - hosted on Azure","","","","005Qk000001nVi2IAE","2024-11-15T21:03:33.000Z"
"0D5Qk00000R0ZHxKAN","500Qk00000INm6PIAT","TextPost","005Qk000001nVi2IAE","2024-11-15T21:23:01.000Z","Description Updated: the customer wanted to change the certificate because it expired, and afterwards the server was unaccesible.","","","","005Qk000001nVi2IAE","2024-11-15T21:23:01.000Z"
"0D5Qk00000R0bpjKAB","500Qk00000INm6PIAT","TextPost","005Qk000001nVi2IAE","2024-11-15T21:23:29.000Z","Next Steps Updated: connect with the customer
change the certificate from the backend","","","","005Qk000001nVi2IAE","2024-11-15T21:23:29.000Z"
"0D5Qk00000RHaGlKAL","500Qk00000INm6PIAT","TextPost","0054u000007ouL8AAI","2024-11-19T21:56:17.000Z","<p>@Botond Biro​ client left vm at <b>00427586 </b> to follow up </p>","","","","0054u000007ouL8AAI","2024-11-19T22:15:28.000Z"
"0D5Qk00000TwvLqKAJ","500Qk00000INm6PIAT","TextPost","005Qk000001nVi2IAE","2024-12-30T16:58:41.000Z","<p>I was asked by Augustina on the escalated case to discuss with Cristian Halmajan regarding the availability of the dev team during the holiday season.</p><p>Cristian informed me that they are available until 17:00 RO time, and until 18:00 normally.</p><p>I emailed the customer to schedule a call when someone from the dev team is available to join the call.<img src=""sfdc://069Qk00000Iv41NIAR"" alt=""Screenshot 2024-12-30 at 18.56.43""></img><img src=""sfdc://069Qk00000IuyC8IAJ"" alt=""Screenshot 2024-12-30 at 18.56.23""></img></p>","","","","005Qk000001nVi2IAE","2024-12-30T16:58:41.000Z"
"0D5Qk00000TwxVMKAZ","500Qk00000INm6PIAT","TextPost","005Qk000001nVi2IAE","2024-12-30T17:16:05.000Z","What We've Learned Updated: - hosted on Azure
- connected with the customer
- restored a backup, but the server is still not accessible, even tho all services are working","","","","005Qk000001nVi2IAE","2024-12-30T17:16:05.000Z"
"0D5Qk00000TwreiKAB","500Qk00000INm6PIAT","TextPost","005Qk000001nVi2IAE","2024-12-30T17:16:26.000Z","Next Steps Updated: schedule a remote session with the customer and someone from the dev team","","","","005Qk000001nVi2IAE","2024-12-30T17:16:26.000Z"
