"Id","CaseNumber","Ticket_Record_Type_Name__c","Subject","Description","DevOps_Steps_to_Reproduce__c","What_We_Know__c","Next_Steps__c","Solution_Comment__c","Issue_Type__c","Ticket_Owner_Name__c","Ticket_Type__c","Platform__c","Collector_Code__c","Feature__c","Product_Version__c","Build_Number__c","Age__c","Status","Account_Name__c","Contact_Name__c","CreatedDate","ClosedDate"
"500Qk00000JdzDZIAZ","00430182","Support Ticket","Help needed for adding EPP admins via Active Directory Authentication/ Sync AD Administrators","Hi Team,

Regina Maria team reached out to me mentioning that they tried to add a new EPP admin to the AD Administrators Group, but that was unsuccessful (""Am mai incercat sa adaug un nou coleg ca admin in platforma via AD Sync, dar nu functioneaza."").
Server version is 5.9.4.1.

When replying, please also add following email address: it.security@reginamaria.ro

Please let us know if other details would be needed here.

Thank you,

Oana Nemes | Team Lead, Customer Success
Endpoint Protector by CoSoSys, now part of Netwrix
DLP | Device Control | Content Aware Protection | eDiscovery | Enforced Encryption
www.endpointprotector.com  
(+40) 264-593 110","","","","Case solved in remote session","","Andre Le Roux","Unexpected Behavior","Netwrix Endpoint Protector","Active Directory Sync","AD Sync - Other","NONE","","27.9","Closed - Resolved","Regina Maria","Cristian Voicu","2024-12-18T11:51:51.000Z","2025-01-15T09:04:18.000Z"
