"Id","ParentId","Type","CreatedById","CreatedDate","Body","Title","LinkUrl","RelatedRecordId","InsertedById","LastModifiedDate"
"0D5Qk00000RrmSdKAJ","500Qk00000Ir5qRIAR","TextPost","0054u000008ARZjAAO","2024-11-27T14:27:59.000Z","Description: Hello,

I am having an issue with my Seek jobs. I am getting a database error. 

See Error Below
Error during processing:  Could not load file or assembly '<a href='https://System.Data' target='_blank'>System.Data</a>.SQLite, Version=1.0.117.0, Culture=neutral, PublicKeyToken=db937bc2d44ff139' or one of its dependencies. The located assembly's manifest definition does not match the assembly reference. (Exception from HRESULT: 0x80131040)","","","","0054u000008ARZjAAO","2024-11-27T14:27:59.000Z"
"0D5Qk00000S6BXHKA3","500Qk00000Ir5qRIAR","TextPost","0054u000007MiY9AAK","2024-12-02T16:35:53.000Z","<p>There is a KB for how to solve this, but also an open escalation to investigate why this is happening.</p><p> </p><p><b>KB:</b> <a href=""https://nwxcorp.lightning.force.com/lightning/r/General__kav/ka0Qk0000006fq5IAA/view?ws=%2Flightning%2Fr%2FCase%2F500Qk00000IEbQOIA1%2Fview"" alt=""https://nwxcorp.lightning.force.com/lightning/r/General__kav/ka0Qk0000006fq5IAA/view?ws=%2Flightning%2Fr%2FCase%2F500Qk00000IEbQOIA1%2Fview"" target=""_blank"">https://nwxcorp.lightning.force.com/lightning/r/General__kav/ka0Qk0000006fq5IAA/view?ws=%2Flightning%2Fr%2FCase%2F500Qk00000IEbQOIA1%2Fview</a></p><p> </p><p><b>Escalation Ticket:</b> <a href=""https://nwxcorp.lightning.force.com/lightning/r/Case/500Qk00000IL4G1IAL/view?ws=%2Flightning%2Fr%2FCase%2F500Qk00000IEbQOIA1%2Fview"" alt=""https://nwxcorp.lightning.force.com/lightning/r/Case/500Qk00000IL4G1IAL/view?ws=%2Flightning%2Fr%2FCase%2F500Qk00000IEbQOIA1%2Fview"" target=""_blank"">00427172</a></p>","","","","0054u000007MiY9AAK","2024-12-02T16:35:53.000Z"
"0D5Qk00000S7U3jKAF","500Qk00000Ir5qRIAR","TextPost","00570000003KXurAAG","2024-12-02T20:23:27.000Z","Next Steps Updated: Apply Knowledge SEEK System Scan Error:  Could Not Load File or Assembly","","","","00570000003KXurAAG","2024-12-02T20:23:27.000Z"
"0D5Qk00000S7XCBKA3","500Qk00000Ir5qRIAR","TextPost","00570000003KXurAAG","2024-12-02T20:23:42.000Z","What We've Learned Updated: Per prior cases this is a known bug","","","","00570000003KXurAAG","2024-12-02T20:23:42.000Z"
"0D5Qk00000S7Y5sKAF","500Qk00000Ir5qRIAR","TextPost","0054u000007MiY9AAK","2024-12-02T21:39:28.000Z","<p>Collect logs (@Dusty Grayson​ please grab DEBUG logs for the job and application), escalate, resolve issue for customer with KB, close as Pending Fix Availability, Reopen Escalation Ticket</p>","","","","0054u000007MiY9AAK","2024-12-02T21:39:28.000Z"
"0D5Qk00000SHMDQKA5","500Qk00000Ir5qRIAR","TextPost","00570000003KXurAAG","2024-12-04T20:04:51.000Z","Next Steps Updated: Apply Knowledge SEEK System Scan Error:  Could Not Load File or Assembly

Linked to Escalation Ticket Number  00427172.

Awaiting log dump.","","","","00570000003KXurAAG","2024-12-04T20:04:51.000Z"
"0D5Qk00000SLEO1KAP","500Qk00000Ir5qRIAR","TextPost","00570000003KXurAAG","2024-12-05T15:17:32.000Z","<p>***00428321Netwrix Enterprise Auditor LogsApplication LogsApplication<b>SADebug-20241127134205-8516.TSV</b></p><p>27/11/2024 13:42:21   <b>ERROR  </b>   SQLSERVER   TSPSQLHMStorageItf.UpdateSchema.ExecuteMySQLStatement   &quot;Exception (EOleException) was raised with message : Invalid column name &#39;database_type&#39;&quot;           8328   8516   11508</p><p>27/11/2024 13:42:21   <b>ERROR  </b>   SQLSERVER   TSPSQLServerConfigItf.RunSQLScripts   &quot;File: &quot;SA_UsageStatistics_SQL.proc&quot;, <b>ERROR  </b>: Invalid column name &#39;database_type&#39; &quot;           8328   8516   11508</p><p>27/11/2024 13:42:21   <b>ERROR  </b>   SQLSERVER   TSPSQLHMStorageItf.UpdateSchema.ExecuteMySQLStatement   &quot;Exception (EOleException) was raised with message : Cannot insert the value NULL into column &#39;port_number&#39;, table &#39;StealthAudit.dbo.SA_SQL_Instances&#39;; column does not allow nulls. INSERT fails&quot;           8328   8516   11508</p><p>27/11/2024 13:42:21   <b>ERROR  </b>   SQLSERVER   TSPSQLServerConfigItf.RunSQLScripts   &quot;File: &quot;Patch_DC_4.sql&quot;, <b>ERROR  </b>: Cannot insert the value NULL into column &#39;port_number&#39;, table &#39;StealthAudit.dbo.SA_SQL_Instances&#39;; column does not allow nulls. INSERT fails &quot;           8328   8516   11508</p><p>27/11/2024 13:42:27   <b>ERROR  </b>   SQLSERVER   TSPSQLHMStorageItf.UpdateSchema.ExecuteMySQLStatement   &quot;Exception (EOleException) was raised with message : Invalid column name &#39;database_type&#39;&quot;           8328   8516   11508</p><p>27/11/2024 13:42:27   <b>ERROR  </b>   SQLSERVER   TSPSQLServerConfigItf.RunSQLScripts   &quot;File: &quot;SA_UsageStatistics_SQL.proc&quot;, <b>ERROR  </b>: Invalid column name &#39;database_type&#39; &quot;           8328   8516   11508</p><p>27/11/2024 13:42:27   <b>ERROR  </b>   SQLSERVER   TSPSQLHMStorageItf.UpdateSchema.ExecuteMySQLStatement   &quot;Exception (EOleException) was raised with message : Cannot insert the value NULL into column &#39;port_number&#39;, table &#39;StealthAudit.dbo.SA_SQL_Instances&#39;; column does not allow nulls. INSERT fails&quot;           8328   8516   11508</p><p>27/11/2024 13:42:27   <b>ERROR  </b>   SQLSERVER   TSPSQLServerConfigItf.RunSQLScripts   &quot;File: &quot;Patch_DC_4.sql&quot;, <b>ERROR  </b>: Cannot insert the value NULL into column &#39;port_number&#39;, table &#39;StealthAudit.dbo.SA_SQL_Instances&#39;; column does not allow nulls. INSERT fails &quot;           8328   8516   11508</p><p> </p><p> </p><p>***00428321Netwrix Enterprise Auditor Logs00.SEEKGROUP_00.SEEKJOB_1-SEEK System ScansOutput<b>1-SEEK System Scans_Log.tsv</b></p><p>27/11/2024 13:44:31   <b>ERROR  </b>   SQLSERVER   TSPSQLHMStorageItf.UpdateSchema.ExecuteMySQLStatement   &quot;Exception (EOleException) was raised with message : Invalid column name &#39;database_type&#39;&quot;           13384   10696   10220</p><p>27/11/2024 13:44:31   <b>ERROR  </b>   SQLSERVER   TSPSQLServerConfigItf.RunSQLScripts   &quot;File: &quot;SA_UsageStatistics_SQL.proc&quot;, <b>ERROR  </b>: Invalid column name &#39;database_type&#39; &quot;           13384   10696   10220</p><p> </p>","","","","00570000003KXurAAG","2024-12-05T15:17:32.000Z"
