"Id","ParentId","Type","CreatedById","CreatedDate","Body","Title","LinkUrl","RelatedRecordId","InsertedById","LastModifiedDate"
"0D5Qk00000d8ZrnKAE","500Qk00000OhunVIAR","TextPost","0054u000008ARZjAAO","2025-05-02T09:15:45.000Z","Description: SharePoint Activity Not Importing Correctly . Please see error below:

[C:24] Unable to perform bulk import Error: Exception has been thrown by the target of an invocation.","","","","0054u000008ARZjAAO","2025-05-02T09:15:45.000Z"
"0D5Qk00000dOlPSKA0","500Qk00000OhunVIAR","TextPost","0054u000007ow49AAA","2025-05-05T09:31:38.000Z","Steps to Reproduce Updated: Sharepoint bulk import job","","","","0054u000007ow49AAA","2025-05-05T09:31:38.000Z"
"0D5Qk00000dOqxIKAS","500Qk00000OhunVIAR","TextPost","0054u000007ow49AAA","2025-05-05T09:32:02.000Z","Next Steps Updated: Awaiting more info","","","","0054u000007ow49AAA","2025-05-05T09:32:02.000Z"
"0D5Qk00000dOqxHKAS","500Qk00000OhunVIAR","TextPost","0054u000007ow49AAA","2025-05-05T09:32:02.000Z","What We've Learned Updated: Nothing yet, awaiting customer","","","","0054u000007ow49AAA","2025-05-05T09:32:02.000Z"
"0D5Qk00000dXh8UKAS","500Qk00000OhunVIAR","TextPost","0054u000007ow49AAA","2025-05-07T15:26:15.000Z","What We've Learned Updated: Nothing yet, awaiting customer

System.InvalidOperationException: This implementation is not part of the Windows Platform FIPS validated cryptographic algorithms.","","","","0054u000007ow49AAA","2025-05-07T15:26:15.000Z"
"0D5Qk00000dXh8VKAS","500Qk00000OhunVIAR","TextPost","0054u000007ow49AAA","2025-05-07T15:26:15.000Z","Next Steps Updated: Awaiting more info
FIPS issue, suggested a fix, looking deeper","","","","0054u000007ow49AAA","2025-05-07T15:26:15.000Z"
