"Id","ParentId","CommentBody","CreatedById","CreatedDate","LastModifiedDate","IsPublished","IsDeleted"
"00aQk000007Sb73IAC","500Qk00000C53G5IAJ","this is probably caused by sites being locked in SharePoint Online:

https://learn.microsoft.com/en-us/sharepoint/manage-lock-status","0054u000006goFUAAY","2024-06-20T20:26:44.000Z","2024-06-20T20:26:44.000Z","false","false"
"00aQk000007SkThIAK","500Qk00000C53G5IAJ","The customer is in EMEA time zone GMT+1","0054u000007osjSAAQ","2024-06-20T22:24:57.000Z","2024-06-20T22:24:57.000Z","false","false"
"00aQk0000084bh8IAA","500Qk00000C53G5IAJ","they are scope creeping again
waiting for confirmation they have/don't have issues with SPAA on A server","0054u000007MeUDAA0","2024-07-22T14:17:15.000Z","2024-07-22T14:17:15.000Z","false","false"
