"Id","ParentId","CommentBody","CreatedById","CreatedDate","LastModifiedDate","IsPublished","IsDeleted"
"00aQk000008Xs1pIAC","500Qk00000ESaZyIAL","un-supported time zone >> TL queue","0054u000008F3GEAA0","2024-08-15T14:00:09.000Z","2024-08-15T14:00:09.000Z","false","false"
"00aQk000008Y999IAC","500Qk00000ESaZyIAL","Assigning to TL queue. The case is for Enterprise Auditor","0054u000007Mdn4AAC","2024-08-15T17:25:50.000Z","2024-08-15T17:25:50.000Z","false","false"
"00aQk000008caYvIAI","500Qk00000ESaZyIAL","I will review the log","0054u000007osjSAAQ","2024-08-19T23:32:28.000Z","2024-08-19T23:32:28.000Z","false","false"
"00aQk000009QQL3IAO","500Qk00000ESaZyIAL","Today we:

Identified that a possible cause of the console locking up was the SP_StaleUsers job being enabled. After disabling that job the Sharepoint group seems to have performed a successful run without issue. 

We then re-enabled the job as a test to run with the entire group at 7 pm tomorrow.

Our next steps are:

You will:

Allow the job to run through the scheduled tasks and attempt to open the console at your earliest convenience. 

If the console hangs during the attempt to access it please provide application logs in the file path below:

Program Files (x86)StealthAuditSADatabaseLogsApplication

As well as a screenshot of any performance impacts from the task manager and the reliability monitor.","0054u000007MdqrAAC","2024-10-01T21:34:08.000Z","2024-10-01T21:34:08.000Z","false","false"
"00aQk000009iwCnIAI","500Qk00000ESaZyIAL","Contact did not show for the scheduled meeting today.","0054u000007MdqrAAC","2024-10-17T19:21:27.000Z","2024-10-17T19:21:27.000Z","false","false"
