"Id","CaseNumber","Ticket_Record_Type_Name__c","Subject","Description","DevOps_Steps_to_Reproduce__c","What_We_Know__c","Next_Steps__c","Solution_Comment__c","Issue_Type__c","Ticket_Owner_Name__c","Ticket_Type__c","Platform__c","Collector_Code__c","Feature__c","Product_Version__c","Build_Number__c","Age__c","Status","Account_Name__c","Contact_Name__c","CreatedDate","ClosedDate"
"500Qk00000I0hLxIAJ","00426395","Support Ticket","Access to Webpage is not working","Greg Dieter from Bank of America 
called in regarding his access to our webpage which he needs to reset the password, he is also complaining that his email is not being detected as business email and is not letting him sign in or sign up using it

Transcription:
Hi there, this is Greg. Dear, I'm with the Bank of America. We are. I'm trying to get signed back up to be able to log into your web page, but the, uh,  The stinking web page doesn't like my email address. It's Greg Peter  At bofa.com B ofa.com. Um, give me a call 303-589-2390. I just need help getting set up so I can  Log in to, uh, open a ticket. I used to be uh, on this contract, uh, about a year ago and so there may be an existing account for me. I just can't log in and it won't let me reset the password, so give me a call. Greg der at Bank of America, thank you.","","there is an active account under the email greg.dieter@bofa.com

Password has been reset and sent to contact 
manage portal accounts at: https://dev3.netwrix.com/adm/default/index","receive confirmation that contact was able to log in and close ticket","Password has been reset and sent to contact manage portal accounts.","Guidance","Scottie Taylor","","Netwrix Enterprise Auditor","Website and Documentation","Customer Portal","","","4.0","Closed - Resolved","Bank of America Corporation","Greg Dieter","2024-11-07T16:24:08.000Z","2024-11-11T17:05:03.000Z"
