"Id","ParentId","Type","CreatedById","CreatedDate","Body","Title","LinkUrl","RelatedRecordId","InsertedById","LastModifiedDate"
"0D5Qk00000alS5ZKAU","500Qk00000NXB7eIAH","TextPost","0054u000006gpoAAAQ","2025-03-31T20:50:27.000Z","Description: Upgrade to 11.6","","","","0054u000006gpoAAAQ","2025-03-31T20:50:27.000Z"
"0D5Qk00000alUv2KAE","500Qk00000NXB7eIAH","TextPost","0054u000006gpoAAAQ","2025-03-31T20:50:47.000Z","Invitation updated. Attendees: No attendees listed","","","","0054u000006gpoAAAQ","2025-03-31T20:50:47.000Z"
"0D5Qk00000alUv4KAE","500Qk00000NXB7eIAH","TextPost","0054u000006gpoAAAQ","2025-03-31T20:50:48.000Z","Invitation updated. Attendees: Nicholas Zimmer, Sean Barbour","","","","0054u000006gpoAAAQ","2025-03-31T20:50:48.000Z"
"0D5Qk00000alUv3KAE","500Qk00000NXB7eIAH","TextPost","0054u000006gpoAAAQ","2025-03-31T20:50:48.000Z","Invitation updated. Attendees: Nicholas Zimmer","","","","0054u000006gpoAAAQ","2025-03-31T20:50:48.000Z"
"0D5Qk00000dZWPWKA4","500Qk00000NXB7eIAH","TextPost","0054u000006gpoAAAQ","2025-05-07T20:37:40.000Z","What We've Learned Updated: Upgraded successfully.
Main console
AIC
Proxy
Both websites aic and reports","","","","0054u000006gpoAAAQ","2025-05-07T20:37:40.000Z"
"0D5Qk00000dZWPXKA4","500Qk00000NXB7eIAH","TextPost","0054u000006gpoAAAQ","2025-05-07T20:37:41.000Z","Next Steps Updated: Plan to review by 5-9","","","","0054u000006gpoAAAQ","2025-05-07T20:37:41.000Z"
